tweet_id,username,created_at,text,replies,retweets,likes,url,year,month,date
2000496269454692807,_aliemili_,2025-12-15T11:20:52.000Z,از آدمایی که نیاز ندارن هرکسی دوستشون داشته باشه خوشم میاد.,0,0,0,https://x.com/Leila_7876/status/2000496269454692807,2025,12,2025-12-15
1999734041768263871,_aliemili_,2025-12-13T08:52:03.000Z,— Fyodor Dostoyevsky,0,0,0,https://x.com/Lovandfear/status/1999734041768263871,2025,12,2025-12-13
2000292653536366726,_aliemili_,2025-12-14T21:51:46.000Z,"فقط خودتون آدمین بقیه هرچی که شد شد
گمشین بابا لعنت به فلسفه وجودتون",0,0,0,https://x.com/_Aliemili_/status/2000292653536366726,2025,12,2025-12-14
2000256666080808977,_aliemili_,2025-12-14T19:28:46.000Z,"به چه کسی میگویند آدم اَمن؟
به کسی که وقتی جای زخم هایت را به او نشان دادی از آن پس همه تلاشش را میکند که از آن سمت به تو آسیبی نرسد!",0,0,0,https://x.com/Thisismohammadd/status/2000256666080808977,2025,12,2025-12-14
2000273429266665594,_aliemili_,2025-12-14T20:35:23.000Z,"از آدمایی که توی زندگیشون روتین ندارن و وقتی سینگل میشن شروع میکنن درگیر self improvement میشن خوشم نمیاد
این اتفاق خیلی چیزا رو در موردشون توضیح میده",0,0,0,https://x.com/_Aliemili_/status/2000273429266665594,2025,12,2025-12-14
2000268241319456940,_aliemili_,2025-12-14T20:14:46.000Z,"تا می‌فهمین آدم سینگله با هزار بهونه نیاز به راهنمایی برای برنامه‌نویسی و چرت و پرتای دیگه وقت آدمو می‌گیرین که نزدیک بشین ولی حرفتونو نمیزنین
فک می‌کنین این موها کجا سفید شده؟ :))",0,0,0,https://x.com/_Aliemili_/status/2000268241319456940,2025,12,2025-12-14
2000267443370127580,_aliemili_,2025-12-14T20:11:36.000Z,"اوف که دیگه بهرام آلبومش داره میاد و دلم میخواد چند ماهی کسی سراغم نیاد فقط غرق شم توش
ببین غرقا",0,0,0,https://x.com/_Aliemili_/status/2000267443370127580,2025,12,2025-12-14
1999923243751469519,_aliemili_,2025-12-13T21:23:52.000Z,آقا سوپرانوز (sopranos) واقعا ارزش دیدن داره,0,0,0,https://x.com/_Aliemili_/status/1999923243751469519,2025,12,2025-12-13
1999922958287134902,_aliemili_,2025-12-13T21:22:44.000Z,ولی انصاف نبود این مدت که تمام اتفاقای بد دومینو وار افتاد، رئال مادریدم انقدر بد باشه ,0,0,0,https://x.com/_Aliemili_/status/1999922958287134902,2025,12,2025-12-13
1999922184245199038,_aliemili_,2025-12-13T21:19:40.000Z,"صحبت از سرمایه‌گذاری شد
تو می‌تونی روزی که داری پول جمع می‌کنی تا بدی پارتنرت که یه قدم به هدف نزدیکتر بشه و مرخصی میگیری که به سلامتیش برسی‌ام از دستش بدی
روی خودت سرمایه‌گذاری کن، مرسی.",0,0,0,https://x.com/_Aliemili_/status/1999922184245199038,2025,12,2025-12-13
1999904053875351868,_aliemili_,2025-12-13T20:07:37.000Z,"دیسیپلین دیسیپلین دیسیپلین
و برای مفاهیم پایه بیشتر وقت بذار و از اینکه زمانت از دست بره نترس",0,0,0,https://x.com/_Aliemili_/status/1999904053875351868,2025,12,2025-12-13
1999903626186416216,_aliemili_,2025-12-13T20:05:55.000Z,"اگه گند زدی و زمین خوردی
ارزشمندی ",0,0,0,https://x.com/_Aliemili_/status/1999903626186416216,2025,12,2025-12-13
1999901332396712094,_aliemili_,2025-12-13T19:56:48.000Z,"از خودت بپرس دوست داری روی خودت کوتاه مدت سرمایه‌گذاری کنی یا بلند مدت
بعد تصمیماتتو بر اساس این بگیر",0,0,0,https://x.com/_Aliemili_/status/1999901332396712094,2025,12,2025-12-13
1999883186911003070,_aliemili_,2025-12-13T18:44:42.000Z,"فهمیدم بین ۶ ماه تا یکسال اولی که آدم میخواد ساز یاد بگیره خیلی تفاوتی نداره که چی تمرین میکنه
مهمه که فقط تمرین کنه آدم
البته که مهمه اشتباه جلو نره و استاد میتونه کمک کنه ولی وجودش ضروری نیست
قطعا ساز دومو خودم میتونم یاد بگیرم دیگه",0,0,0,https://x.com/_Aliemili_/status/1999883186911003070,2025,12,2025-12-13
1999880929205211156,_aliemili_,2025-12-13T18:35:44.000Z,"این روزا همه‌چی بهتره
کم کم داره ورزش لذت قبلشو میده
سیگار داره ترک میشه
ساز زدن داره مثل قبل لذت میده و روی غلتک افتاده
تمرکزم سر کار داره برمیگرده و سطح تحملم بالاتر میره هرروز
خلاصه اینکه هر چیز خوب و بدی می‌گذره
نه جوگیر شو نه خودتو بباز
باشه؟",0,0,0,https://x.com/_Aliemili_/status/1999880929205211156,2025,12,2025-12-13
1999788216438882625,_aliemili_,2025-12-13T12:27:19.000Z,بالاخره جواب داد و به نظر سوپروایزری که بخاطر مسخره بازیاش آموزشگاه زبانمو عوض کردم، داره اخراج میشه ,0,0,0,https://x.com/_Aliemili_/status/1999788216438882625,2025,12,2025-12-13
1999732576874009026,_aliemili_,2025-12-13T08:46:14.000Z,شانس ما از همکلاسی غیر هم‌جنس به روایت تصویر,0,0,0,https://x.com/_Aliemili_/status/1999732576874009026,2025,12,2025-12-13
1999586071873568821,_aliemili_,2025-12-12T23:04:04.000Z,"اصطلاحی وجود داره به اسم Plateau 
توی یادگیری هرچیزی یک جاهای نمودار یادگیری خط صاف میشه و بالا نمیره
خبر خوب اینکه این فاز همیشه تموم میشه
خبر بد اینکه ار زمانی که ما می‌خوایم یه چیز جدید رو توش استاد بشیم توی این فاز سپری می‌کنیم
مهم اینه که کم نیاریم",0,0,0,https://x.com/_Aliemili_/status/1999586071873568821,2025,12,2025-12-12
1999580731450736932,_aliemili_,2025-12-12T22:42:51.000Z,"میگن برای یاد گرفتن یک حرفه حداقل ۲ سال باید با چیزای مختلف اون حرفه ور بری و تا تازه بفهمی چند چندی
برای منی که الان حدودا یک ساله ساز میزنم و باشگاه میرم خبر خوبی بود",0,0,0,https://x.com/_Aliemili_/status/1999580731450736932,2025,12,2025-12-12
1999577175050092646,_aliemili_,2025-12-12T22:28:43.000Z,"دوس دارم هرچی زودتر برم سراغ کتاب Mastery از George Leonard ولی فعلا باید کتاب شوپنهاور عزیزم رو تموم کنم
چقدر تو پیریای منی مرد.",0,0,0,https://x.com/_Aliemili_/status/1999577175050092646,2025,12,2025-12-12
1999568548344008903,_aliemili_,2025-12-12T21:54:26.000Z,"دوباره برگشتم چون لازمه از اینجا به بعد رو برای خودم ژورنال کنم
چون همه‌چی تقسیم میشه به از اینجا به قبل و از اینجا به بعد.",0,0,0,https://x.com/_Aliemili_/status/1999568548344008903,2025,12,2025-12-12
