tweet_id,username,created_at,text,replies,retweets,likes,url
2022710608689238186,_aliemili_,,زن زندگی فقط اون دختری که الان داره تو کوچمون بدون توقف داد میزنه جاوید شاه، پهلوی برمی‌گرده. ,0,0,0,https://x.com/_Aliemili_/status/2022710608689238186
2022298180642013515,_aliemili_,,زنان با پوشش ممنوعه در جمهوری اسلامی در خیابان‌های تهران (۲۹ خرداد ۱۴۰۳) و در راهپیمایی بیست و دو بهمن (۲۲ بهمن ۱۴۰۴),0,0,0,https://x.com/hafezeh_tarikhi/status/2022298180642013515
2021526030360711435,_aliemili_,,End the UN now. Garbage.,0,0,0,https://x.com/JohnnyNash77/status/2021526030360711435
2021280996658749678,_aliemili_,,"تا اطلاع ثانوی فقط 
@AshkanFadaei
 و 
@SadeghOfficial
 گوش میکنم.",0,0,0,https://x.com/_Aliemili_/status/2021280996658749678
2008285488981946418,_aliemili_,,"من اینجا ریشه در خاک دارم
من اینجا تا نفس باقیس می مانم
مردمو ایرانو با هیچی عوض نمی کنم",0,0,0,https://x.com/Aliidaeii/status/2008285488981946418
2011295476314951854,_aliemili_,," Update: Metrics show #Iran remains offline as the country wakes to another day of digital darkness.

With the internet blackout now past its 132nd hour, early reports indicate thousands of casualties. The true extent of the killings is obscured by the absence of connectivity.",0,0,0,https://x.com/netblocks/status/2011295476314951854
2011130483724431501,_aliemili_,,"1 fucking death in Minnesota and the world goes crazy 

12,000 Iranian deaths and it’s like nothing happened 

Sickening",0,0,0,https://x.com/kiantrades/status/2011130483724431501
2011114025636016478,_aliemili_,," Update: #Iran has now been offline for 120 hours.

Despite some phone calls now connecting, there is no secure way to communicate and the general public remain cut off from the outside world.

What footage makes it through shows extensive use of force against civilians ",0,0,0,https://x.com/netblocks/status/2011114025636016478
2011022305628209157,_aliemili_,,"استوری یک از آشنایان که تازه از ایران برگشته: 

واقعا مردم عزیزی داریم و حقمون حکومت آخوندی نیست..",0,0,0,https://x.com/Iliaaaa6/status/2011022305628209157
2010800640583483616,_aliemili_,,"گفتم برم فیدیبو کتاب بخونم حواسمو پرت کنم. 
چه هوش و زکاوتی 
#DigitalBlackoutlran 
#IranRevolution2026",0,0,0,https://x.com/niliitis/status/2010800640583483616
2010813373676429741,_aliemili_,,"آنچه اکنون در ایران اتفاق می‌افتد از جمله اعتراضات گسترده، در واقع یک قیام، همچنین يک نشانه روشن ان است که برای روسیه آسان‌تر نخواهد بود. و هر فرد عادی روی زمین واقعاً می‌خواهد که مردم ایران بلاخره خوش شانس باشد تا خود را از رژیمی
که در آنجا وجود دارد و شرارت‌های زیادی را به بار",0,0,0,https://x.com/ZelenskyyUa/status/2010813373676429741
2010790967004316005,_aliemili_,,"من خشونت دولتی را که کورکورانه زنان و مردان ایرانی را، که با شجاعت خواستار احترام به حقوق خود هستند، هدف قرار می‌دهد، محکوم می‌کنم.

احترام به آزادی‌های بنیادین یک مطالبه جهانی است و ما در کنار زنانی و مردانی ایستاده‌ایم که از آن دفاع می‌کنند.",0,0,0,https://x.com/EmmanuelMacron/status/2010790967004316005
2010289136607863128,_aliemili_,,#DigitalBlackoutIran #IranRevolution,0,0,0,https://x.com/_Aliemili_/status/2010289136607863128
2010220886847299898,_aliemili_,,ALL EYES ON IRAN ,0,0,0,https://x.com/NimaYamini/status/2010220886847299898
2010084002519232788,_aliemili_,,#IranRevolution2026 #DigitalBlackoutIran,0,0,0,https://x.com/_Aliemili_/status/2010084002519232788
2009772596540121177,_aliemili_,,"An elderly Iranian woman screams after being hit in the face with a projectile fired by the regime’s security forces:

“I’m not afraid! I’m not afraid! I’ve been dead for 47 years!”",0,0,0,https://x.com/visegrad24/status/2009772596540121177
2009826304443699402,_aliemili_,,“A country waiting for the second check mark.”,0,0,0,https://x.com/NazaninNour/status/2009826304443699402
2009902455333761378,_aliemili_,,"In solidarity with the people of #Iran, we have updated the flag to the historic Sun and Lion emblem across 
codelita.com and our iOS and Android mobile apps.

Honoring Iran’s heritage and the voice of its people.
#FreeIran",0,0,0,https://x.com/theCodelita/status/2009902455333761378
2009901263371325873,_aliemili_,,#DigitalBlackoutIran,0,0,0,https://x.com/_Aliemili_/status/2009901263371325873
2009644016036450493,_aliemili_,,"Mr. President, this is an urgent and immediate call for your attention, support, and action. Last night you saw the millions of brave Iranians in the streets facing down live bullets. Today, they are facing not just bullets but a total communications blackout. No Internet. No",0,0,0,https://x.com/PahlaviReza/status/2009644016036450493
2009576778814411159,_aliemili_,,IRAN,0,0,0,https://x.com/JohnnyNash77/status/2009576778814411159
2009491379043618891,_aliemili_,,"Over million people rally: Iran’s 2nd largest city under protesters’ control, regime forces leave: 
youtube.com/watch?v=eDpP53
…

(TS: 09 Jan 00:01 ET)‍‌‍‌‍‌‍‌‍‌‍‌‍‌‍‌‍‌‍‌‍‌‍‌‍‌‍‌‍‌‍‌‍‌‍",0,0,0,https://x.com/TrumpTruthOnX/status/2009491379043618891
2009207434678817221,_aliemili_,,"The revolution in Iran is THE most important news story in the world right now. But it isn't on the front page of the BBC News website. Odd, that.",0,0,0,https://x.com/SimonFoxWriter/status/2009207434678817221
2007446665163100581,_aliemili_,,خب,0,0,0,https://x.com/_Aliemili_/status/2007446665163100581
2006646948053520542,_aliemili_,,"اونجا که فدایی میگه:
تهدید به مرگ می‌کنن مگه هرشب کم می‌میرم؟
منو از چی می‌ترسونی اونیم که از سر بریده لب می‌گیرم",0,0,0,https://x.com/_Aliemili_/status/2006646948053520542
2006613003022573779,_aliemili_,,یوتیوبم هستم,0,0,0,https://x.com/_Aliemili_/status/2006613003022573779
2006436627934228612,_aliemili_,,"اگه ساز زدنام دیده بشه باعث خوشحالیمه

نمونشو از اینجا بشنوید:",0,0,0,https://x.com/_Aliemili_/status/2006436627934228612
2006435987711472087,_aliemili_,,"در تکمیل تصمیمات impulsive امسالم که زندگیمو از این رو به اون‌رو کرد
از تیمم جدا شدم و رفتم یه تیم دیگه و از سرپرستی تیم استخدام هم استعفا دادم ",0,0,0,https://x.com/_Aliemili_/status/2006435987711472087
2005896846795809013,_aliemili_,,فقط می‌تونم بگم لعنت بهتون.,0,0,0,https://x.com/_Aliemili_/status/2005896846795809013
1569250386673901568,_aliemili_,,زندگی سراسر pain است.,0,0,0,https://x.com/_sarinaez_/status/1569250386673901568
2005761786038083598,_aliemili_,,"حرومی دستای من خالی‌ان عین مغزت
یه دست به ماشه بسه
بزن معطل نکن
جوری بزن بلند نشم 
جوری بزن بلند نشم که جر میدم هفت جدتو",0,0,0,https://x.com/_Aliemili_/status/2005761786038083598
2005756433623605466,_aliemili_,,آدم توی برهه‌های حساسی مثل الان میفهمه چرا آدمایی مثل جادی محبوب شدن,0,0,0,https://x.com/_Aliemili_/status/2005756433623605466
2005723539249435111,_aliemili_,,مرسی که هستی باشگاهِ عزیزم,0,0,0,https://x.com/_Aliemili_/status/2005723539249435111
2005722517730721893,_aliemili_,,بیژد,0,0,0,https://x.com/_Aliemili_/status/2005722517730721893
2005675201405829267,_aliemili_,,"اونجایی که نامجو می‌گه:
چه باشد اگر حال من بد نمی‌بود
و خوش هم نمی‌بود و اصلا نمی‌بود",0,0,0,https://x.com/_Aliemili_/status/2005675201405829267
2005564166254284996,_aliemili_,,"کاری که باید ۴ ساعت زمان میذاشتم رو qwen برام توی نیم‌ساعت انجام داد
خواستم بگم کیر تو آدمیزاد و زنده باد هوش‌مصنوعی :))",0,0,0,https://x.com/_Aliemili_/status/2005564166254284996
2005363847583105411,_aliemili_,,"اونجا که مرصاد میگه:
نای جاده رو ندارم زدم بغل نشستم
تخصصمه بزنم لگد به بختم",0,0,0,https://x.com/_Aliemili_/status/2005363847583105411
2005340598593859760,_aliemili_,,"ولی من خوب نیستم
نگران نشو من خوب میشم
ولی من خوب نیستم
نگران نشو من خوب میشم
من خوب نیستم
نگران نشو",0,0,0,https://x.com/_Aliemili_/status/2005340598593859760
2005336467858727197,_aliemili_,,امشب تماما غروب جمعه‌س انگار,0,0,0,https://x.com/_Aliemili_/status/2005336467858727197
2005293536259006559,_aliemili_,,"اين شوخى نامردان است كه اميد مى‌دهند و سپس باز پس می‌گیرند و بر نومیدشدگان از ته دل می‌خندند.

«مرگ یزدگرد»
بهرام بیضایی",0,0,0,https://x.com/jafekripodcast/status/2005293536259006559
2005155535969288221,_aliemili_,,یه فالو توی استراوا به ما نمی‌رسه؟,0,0,0,https://x.com/_Aliemili_/status/2005155535969288221
2005010279151857890,_aliemili_,,"یعنی شانس نیس گوز خره
حالا که ما بلیت گرجستان گرفتیم اونجا داره انقلاب میشه :|",0,0,0,https://x.com/_Aliemili_/status/2005010279151857890
2004985149587611732,_aliemili_,,Let it happen,0,0,0,https://x.com/_Aliemili_/status/2004985149587611732
2004969772555845880,_aliemili_,,مگه بدترین اتفاقی که می‌تونه بیفته چیه عزیزِ من؟,0,0,0,https://x.com/_Aliemili_/status/2004969772555845880
2004947958165635465,_aliemili_,,"ویدیو آخرم رفت تو اکسپلور و کلی استقبال شد و خوشحالم 
آیدی پیج هنریم: aliemili_brainless",0,0,0,https://x.com/_Aliemili_/status/2004947958165635465
2004947084026495181,_aliemili_,,"نتیجه یک سال نیمه جدی وزنه زدن 
تغذیه معمولی 
وی + کازئین + کراتین
فرمون خوبه؟",0,0,0,https://x.com/_Aliemili_/status/2004947084026495181
2004939149481238814,_aliemili_,,"این بار به جای سیگار شرکتی توتون خالص گرفتم که تست کنم و فاک
چقدر فرق داره و چقدر سیگارای شرکتی به معنای واقعی اسکمه
نکش یا اگه میکشی شرکتی نکش",0,0,0,https://x.com/_Aliemili_/status/2004939149481238814
2004936775601717707,_aliemili_,,کفشای جوردن برای باشگاه بسیار بهتر از چیزی بود که حدس میزدم,0,0,0,https://x.com/_Aliemili_/status/2004936775601717707
2004929485767057539,_aliemili_,,"بعد یک ماه pre-workout زدم
الان منتظرم خود رونی کلمن بیاد بلندش کنم :))",0,0,0,https://x.com/_Aliemili_/status/2004929485767057539
2004862077954138441,_aliemili_,,"بمیرم برای این موبایل دولوپرا
یه خروجی twa میخوام بگیرم پاره شدم از دست نت ایران
چطوری زنده میمونین شماها؟",0,0,0,https://x.com/_Aliemili_/status/2004862077954138441
2004627334444597393,_aliemili_,,"بعد چندین ماه نوشابه مشکی خوردم و در حد ارضا شدن لذت داشت
چیه این دوپامین دیتاکس لامذهب واقعا",0,0,0,https://x.com/_Aliemili_/status/2004627334444597393
2004515006797516999,_aliemili_,,"ظاهرا دیگه شعب بانک ارز مسافرتی نمیدن و باید از سایت
travel ice ir
اقدام کرد
(طبیعتا به جای اسپیس داته)",0,0,0,https://x.com/_Aliemili_/status/2004515006797516999
2004513944929710348,_aliemili_,,"اونجا که فرهاد میگه:
می‌بینم صورتمو تو آینه
با لبی خسته می‌پرسم از خودم
این غریبه کیه از من چی می‌خواد؟
اون به من یا من به اون خیره شدم؟",0,0,0,https://x.com/_Aliemili_/status/2004513944929710348
2004354725215449561,_aliemili_,,This is exactly why men want daughters ,0,0,0,https://x.com/EpicClipVault/status/2004354725215449561
2004141631784816727,_aliemili_,,از کسایی که سلیقه شخصی دارن و صرفا هرچی ترند میشه رو استفاده نمیکنن خوشم میاد....,0,0,0,https://x.com/khosrushonm/status/2004141631784816727
2004486697011056650,_aliemili_,,قبل از اینکه به مرحله burnout برسی خودت به استراحت و انجام کارایی که براشون هدف خاصی نداری بپرداز,0,0,0,https://x.com/_Aliemili_/status/2004486697011056650
2004485547348365797,_aliemili_,,تشکر از آشواگاندای عزیزم که انقدر توی مودم تاثیر مثبت می‌ذاره,0,0,0,https://x.com/_Aliemili_/status/2004485547348365797
2004385541580816411,_aliemili_,,"هیچ‌کس بزرگ نیست
هیچ‌چیز عمیق نیست
هیچ‌کدام ما مهم نیستیم دگر
تنها سکوت سطحی خاک گرفته‌ی حجم این کتاب‌هاست که زنده‌ست",0,0,0,https://x.com/_Aliemili_/status/2004385541580816411
2004268701059866708,_aliemili_,,"دوتا از بزرگترین سختیایی که توی طول عمرم متحمل شدم، مدتیه که بهتر دارن پیش میرن
کم کم حس میکنم اوضاع بهتره و تو مسیر نرمال شدنه",0,0,0,https://x.com/_Aliemili_/status/2004268701059866708
2004259027518468223,_aliemili_,,"یک آشپز ژاپنی باید دو سال اولی که می‌خواد آشپز سوشی بشه، فقط یاد بگیره چطوری برنج درست کنه
دو سااال
بعد به یه برنامه‌نویس میگی یک هفته بیشتر توی فولان ابزار عمیق شو ترش میکنه",0,0,0,https://x.com/_Aliemili_/status/2004259027518468223
2004256499473043636,_aliemili_,,"اگه می‌خوای توی یه حرفه جدید خفن بشی
تا سرعت پیشرفتت کم میشه
سختیای اون حوزه کم کم خودشو نشون میده
موضوعات دیگه برات جذاب به نظر میان
نکش بیرون
زجر بکش ولی ادامه بده",0,0,0,https://x.com/_Aliemili_/status/2004256499473043636
2004248650063741426,_aliemili_,,"تحقیق کردم در مورد اینکه کی در مورد روابط عاطفی صاحب نظره
فعلا 
@EstherPerel
 به نظر گزینه خوبی میاد و می‌خوام برم سراغ ریسورسایی که داده بیرون
اینطور که به نظر میاد بیشتر از چهل سال توی این دنیا تجربه کسب کرده و قطعا خیلی چیزا میشه ازش یاد گرفت",0,0,0,https://x.com/_Aliemili_/status/2004248650063741426
2004247321266245672,_aliemili_,,"چقد تو خوبی مرد 
@hubermanlab",0,0,0,https://x.com/_Aliemili_/status/2004247321266245672
2003688650983551484,_aliemili_,,گاهی هم اینطوریه ، یه اتفاق میفته .,0,0,0,https://x.com/mahshkin/status/2003688650983551484
2004136342301954393,_aliemili_,,"صلوات بفرستین هیچِ بهرام اومد روی اپل میوزیک
خب دیگه چند روز بهم پیام ندین بذارین قفلی بزنم :))",0,0,0,https://x.com/_Aliemili_/status/2004136342301954393
2004130500353339842,_aliemili_,,ترانه علیدوستی ,0,0,0,https://x.com/_Aliemili_/status/2004130500353339842
2004121412026695864,_aliemili_,,"بهش میگه دوست دختر داری؟ میگه آره
معروفه به چی تو کلاس؟ پسره‌ی چشم چرون :))",0,0,0,https://x.com/_Aliemili_/status/2004121412026695864
2003910420244189443,_aliemili_,,"رزومه‌ش تقریبا خالی بود و اسم یه شرکتو زده بود
زنگ زدیم، بدفاز گفت چیزایی که می‌پرسین تو رزومم هست دیگه
ما چرا دعوتش کردیم به مصاحبه و استخدامش کردیم؟
اون چرا انقدر نیروی خوبی از کار در اومد؟",0,0,0,https://x.com/_Aliemili_/status/2003910420244189443
2003909569643532325,_aliemili_,,"باباش پینک‌فلوید باز بود باهاش قرار گذاشتم :))
بعد یکم فکر کردم چه گوهی دارم می‌خورم دقیقا
کنسلش کردم
به کارت برس بچه جان ول کن این چیزارو.",0,0,0,https://x.com/_Aliemili_/status/2003909569643532325
2003908022524170331,_aliemili_,,"توی کلوس فرند که هیچی
توی یک خونه‌ام باشیم و لخت بشی فایده نداره
ذاتا ترن آفی واقعا
اصن نمیشه هرچی فکر می‌کنم",0,0,0,https://x.com/_Aliemili_/status/2003908022524170331
2003906236316881061,_aliemili_,,"دختره برام پست می‌فرسته در مورد اینکه چطوری یه نفر رو دعوت کنم به دیت
سیگنالیه که دعوتش کنم به دیت یا حس میکنه انقدر کصشر و بی‌دست و پام که نیاز به این محتوا دارم؟ 
خدا دماغ است (God Knows)",0,0,0,https://x.com/_Aliemili_/status/2003906236316881061
2003701969043751123,_aliemili_,,"بهم میگن چرا دیگه وارد رابطه نمیشی!
راستش من دیگه نمیخوام حس صبح جدا شدن رو تجربه کنم....",0,0,0,https://x.com/mehdi4325/status/2003701969043751123
2003900718512853500,_aliemili_,,"امشب اون نقطه‌ایه که تصمیم جدی گرفتم که زندگی مستقل رو شروع کنم
اینم اینجا برای یادگاری گذاشتم که یادم بمونه",0,0,0,https://x.com/_Aliemili_/status/2003900718512853500
2003780861666480538,_aliemili_,,وضعیت,0,0,0,https://x.com/_Aliemili_/status/2003780861666480538
2003524934920982645,_aliemili_,,رزومه با عکس لب غنچه‌ای نفرست که دیگه قربونت برم,0,0,0,https://x.com/_Aliemili_/status/2003524934920982645
2003523074881413323,_aliemili_,,"پاسپورت یا همون گذرنامه که شما میگین اومد
چندتا نکته که ممکنه به درد بخوره:
دوسه روز کاری میرسه و خیلی طول بکشه ده روزه
پولتونو به قرمساقای دزد ندین که زودتر برسه
بعدم اینکه اطلاعاتو دابل چک کنین خیلی مهمه
نکته اخر
اگه مدرکی چیزی ترجمه کردین مهمه که با پاسپورت اطلاعات یکسان باشه",0,0,0,https://x.com/_Aliemili_/status/2003523074881413323
2003455492362809639,_aliemili_,,"اگه این آسیب از سمت محل کارم تکمیل بشه که دیگه امسال از تمام جهان ممکن آسیب می‌بینم و دیگه چیزی باقی نمیمونه که برام تروما ایجاد نکرده باشه
بخش مثبتش اینه در واقع",0,0,0,https://x.com/_Aliemili_/status/2003455492362809639
2003382414001995976,_aliemili_,,"راحت‌ترین روش گرفتن ارز مسافرتی چیه؟
بگو ببینم. 
یه ۵۰۰ یورو بگیریم به کار میاد",0,0,0,https://x.com/_Aliemili_/status/2003382414001995976
2003202929088704927,_aliemili_,,"خب برای گرجستان مسیر زمینی خیلی دنگ و فنگ داشت
یکم سر کیسه رو شل کردیم
قطار به تهران
هواپیما به تفلیس
تیل لیندمان آماده باش که عامدیم",0,0,0,https://x.com/_Aliemili_/status/2003202929088704927
2003196212615479672,_aliemili_,,"چقدر آدم چیزای جدید می‌بینه
پاشده از اونور اومده نشسته کنارم میگه من با چند نفر تو رابطه‌ام می‌خوام توام جزوشون باشی
Get the fuck out بابا",0,0,0,https://x.com/_Aliemili_/status/2003196212615479672
2003171925615682008,_aliemili_,,"خسته‌ام مامان خسته
وقتی میگی هرچی از خدا میخوای بهت بده، چیزی میاد تو ذهنم که نمیتونم با گفتنش دلتو بشکنم",0,0,0,https://x.com/_Aliemili_/status/2003171925615682008
2003127452399513964,_aliemili_,,بخاطر مرگ Chris Rea عملا گریه‌ام گرفت.,0,0,0,https://x.com/_Aliemili_/status/2003127452399513964
2003114358373859621,_aliemili_,,"فقدان، فقدان، فقدان، فقدان....

آیا دردی جانکاه‌تر از فقدان هم هست؟",0,0,0,https://x.com/HalghehMag/status/2003114358373859621
2003102599021527522,_aliemili_,,"اوج خرد؟
چیزی که می‌تونم تغییر بدم رو براش تلاش کنم
و چیزی که نمی‌تونم رو پذیرم",0,0,0,https://x.com/_Aliemili_/status/2003102599021527522
2003081956536304031,_aliemili_,,یک سری خط,0,0,0,https://x.com/mahshkin/status/2003081956536304031
2002824170271367269,_aliemili_,,"باید اجازه بدم این احساسات هنوز همراهم باشه؟
می‌تونم بیخیالشون بشم؟
قراره بیخیالشون بشم؟
چه زمانی قراره بیخیالشون بشم؟

در کل متد Sedona چیز جالبی به نظر میاد",0,0,0,https://x.com/_Aliemili_/status/2002824170271367269
2002823326553751565,_aliemili_,,"یه جایی توی فایت کلاب برد پیت طرف رو از پشت دخل میکشه بیرون و رو سرش اسلحه می‌کشه و میگه رویات این بود که چیکاره بشی؟
میگه دانپزشک
میگه ترجیح میدی الان بکشمت یا بری دانپزشک بشی؟
و طرف رو ول میکنه و بهش فرصت میده و تهدید میکنه اگه به رویاش نرسه قراره با اسلحه بکشش
همین.",0,0,0,https://x.com/_Aliemili_/status/2002823326553751565
2002808822742864148,_aliemili_,,امسال اشتباهات زیادی داشتم و امیدوارم بتونم کم کم با خودم مهربون‌تر باشم و خودمو ببخشم,0,0,0,https://x.com/_Aliemili_/status/2002808822742864148
2002799145694961711,_aliemili_,,"اگه از تفلیس گرجستان و استانبول ترکیه تجربه‌ای دارین خوشحال میشم باهام در میون بذارین
چی ببرم؟ حواسم به چیا باشه؟ کجاها برم؟",0,0,0,https://x.com/_Aliemili_/status/2002799145694961711
2002797120416550969,_aliemili_,,"نه هرگز
هرگز هیچکس چنین خطری را به چنان خاطره‌ای تاب نیاورد
از آن که خیال خوبی‌ها، درمان بدی‌ها نیست
بلکه صد چندان بر زشتی آن‌ها می‌افزاید",0,0,0,https://x.com/_Aliemili_/status/2002797120416550969
2002750223341559971,_aliemili_,,"تابستونم یه کنسرت lamb of godمون بشه زیبا میشه واقعا
وقتشه کم کم بیشتر به خودم و علایقم برسم و بقیه چیزارو تو گذشته رها کنم",0,0,0,https://x.com/_Aliemili_/status/2002750223341559971
2002679545766519260,_aliemili_,,آقا بلیت اولین کنسرت خارج از ایران اوکی شد ,0,0,0,https://x.com/_Aliemili_/status/2002679545766519260
2002658532404138348,_aliemili_,,"خب خوشبختانه کد پاسپورت قبل از رسیدنش قابل استعلام بود
میریم که بریم سراغ بلیت ",0,0,0,https://x.com/_Aliemili_/status/2002658532404138348
2002655405105950981,_aliemili_,,"یکم روی آلبوم هیچ این تلاش نشده که کمی عامه‌پسندی توش موج بزنه؟
فعلا رسیدم به ترک «اون آزاده» و چقدر بیتش با هویت بهرام فاصله داره",0,0,0,https://x.com/_Aliemili_/status/2002655405105950981
2002440802262528156,_aliemili_,,"چرا آلبوم #هیچ بهرام هنوز توی اپل میوزیک نیست؟ -_-
@BahramNouraei",0,0,0,https://x.com/_Aliemili_/status/2002440802262528156
2002440040086110564,_aliemili_,,هنوز باورم نمیشه طرف توی نوت گوشی آیفونش رزومه نوشته بعد ازش اسکرین‌شات گرفته و png فرستاده,0,0,0,https://x.com/_Aliemili_/status/2002440040086110564
2002437910185062710,_aliemili_,,"مسیج اومد پاسپورت ارسال شد
فک کنم فردا پس‌فردا برسه
بلیت اجرا و هواپیما تموم نشه پیش من شیرینی دارین :))",0,0,0,https://x.com/_Aliemili_/status/2002437910185062710
2002434571888193933,_aliemili_,,خوبتو نمی‌خواد هر چاقالی که,0,0,0,https://x.com/_Aliemili_/status/2002434571888193933
2002426838174609676,_aliemili_,,و برای تبدیل شدن از staff به principal باید تاثیرات عظیم در سطح سازمان بذاری و ویژن و بینش استراتژیک داشته باشی که اصولا مسائل بلند مدت رو شامل میشه,0,0,0,https://x.com/_Aliemili_/status/2002426838174609676
