tweet_id,username,created_at,text,replies,retweets,likes,url,year,month,date
2022710608689238186,_aliemili_,2026-02-14T18:32:43.000Z,زن زندگی فقط اون دختری که الان داره تو کوچمون بدون توقف داد میزنه جاوید شاه، پهلوی برمی‌گرده. ,0,0,0,https://x.com/_Aliemili_/status/2022710608689238186,2026,2,2026-02-14
2022298180642013515,_aliemili_,2026-02-13T15:13:53.000Z,زنان با پوشش ممنوعه در جمهوری اسلامی در خیابان‌های تهران (۲۹ خرداد ۱۴۰۳) و در راهپیمایی بیست و دو بهمن (۲۲ بهمن ۱۴۰۴),0,0,0,https://x.com/hafezeh_tarikhi/status/2022298180642013515,2026,2,2026-02-13
2021526030360711435,_aliemili_,2026-02-11T12:05:38.000Z,End the UN now. Garbage.,0,0,0,https://x.com/JohnnyNash77/status/2021526030360711435,2026,2,2026-02-11
2021280996658749678,_aliemili_,2026-02-10T19:51:57.000Z,"تا اطلاع ثانوی فقط 
@AshkanFadaei
 و 
@SadeghOfficial
 گوش میکنم.",0,0,0,https://x.com/_Aliemili_/status/2021280996658749678,2026,2,2026-02-10
2008285488981946418,_aliemili_,2026-01-05T23:12:27.000Z,"من اینجا ریشه در خاک دارم
من اینجا تا نفس باقیس می مانم
مردمو ایرانو با هیچی عوض نمی کنم",0,0,0,https://x.com/Aliidaeii/status/2008285488981946418,2026,1,2026-01-05
2011295476314951854,_aliemili_,2026-01-14T06:33:04.000Z," Update: Metrics show #Iran remains offline as the country wakes to another day of digital darkness.

With the internet blackout now past its 132nd hour, early reports indicate thousands of casualties. The true extent of the killings is obscured by the absence of connectivity.",0,0,0,https://x.com/netblocks/status/2011295476314951854,2026,1,2026-01-14
2011130483724431501,_aliemili_,2026-01-13T19:37:26.000Z,"1 fucking death in Minnesota and the world goes crazy 

12,000 Iranian deaths and it’s like nothing happened 

Sickening",0,0,0,https://x.com/kiantrades/status/2011130483724431501,2026,1,2026-01-13
2011114025636016478,_aliemili_,2026-01-13T18:32:03.000Z," Update: #Iran has now been offline for 120 hours.

Despite some phone calls now connecting, there is no secure way to communicate and the general public remain cut off from the outside world.

What footage makes it through shows extensive use of force against civilians ",0,0,0,https://x.com/netblocks/status/2011114025636016478,2026,1,2026-01-13
2011022305628209157,_aliemili_,2026-01-13T12:27:35.000Z,"استوری یک از آشنایان که تازه از ایران برگشته: 

واقعا مردم عزیزی داریم و حقمون حکومت آخوندی نیست..",0,0,0,https://x.com/Iliaaaa6/status/2011022305628209157,2026,1,2026-01-13
2010800640583483616,_aliemili_,2026-01-12T21:46:46.000Z,"گفتم برم فیدیبو کتاب بخونم حواسمو پرت کنم. 
چه هوش و زکاوتی 
#DigitalBlackoutlran 
#IranRevolution2026",0,0,0,https://x.com/niliitis/status/2010800640583483616,2026,1,2026-01-12
2010813373676429741,_aliemili_,2026-01-12T22:37:22.000Z,"آنچه اکنون در ایران اتفاق می‌افتد از جمله اعتراضات گسترده، در واقع یک قیام، همچنین يک نشانه روشن ان است که برای روسیه آسان‌تر نخواهد بود. و هر فرد عادی روی زمین واقعاً می‌خواهد که مردم ایران بلاخره خوش شانس باشد تا خود را از رژیمی
که در آنجا وجود دارد و شرارت‌های زیادی را به بار",0,0,0,https://x.com/ZelenskyyUa/status/2010813373676429741,2026,1,2026-01-12
2010790967004316005,_aliemili_,2026-01-12T21:08:19.000Z,"من خشونت دولتی را که کورکورانه زنان و مردان ایرانی را، که با شجاعت خواستار احترام به حقوق خود هستند، هدف قرار می‌دهد، محکوم می‌کنم.

احترام به آزادی‌های بنیادین یک مطالبه جهانی است و ما در کنار زنانی و مردانی ایستاده‌ایم که از آن دفاع می‌کنند.",0,0,0,https://x.com/EmmanuelMacron/status/2010790967004316005,2026,1,2026-01-12
2010289136607863128,_aliemili_,2026-01-11T11:54:14.000Z,#DigitalBlackoutIran #IranRevolution,0,0,0,https://x.com/_Aliemili_/status/2010289136607863128,2026,1,2026-01-11
2010220886847299898,_aliemili_,2026-01-11T07:23:02.000Z,ALL EYES ON IRAN ,0,0,0,https://x.com/NimaYamini/status/2010220886847299898,2026,1,2026-01-11
2010084002519232788,_aliemili_,2026-01-10T22:19:06.000Z,#IranRevolution2026 #DigitalBlackoutIran,0,0,0,https://x.com/_Aliemili_/status/2010084002519232788,2026,1,2026-01-10
2009772596540121177,_aliemili_,2026-01-10T01:41:41.000Z,"An elderly Iranian woman screams after being hit in the face with a projectile fired by the regime’s security forces:

“I’m not afraid! I’m not afraid! I’ve been dead for 47 years!”",0,0,0,https://x.com/visegrad24/status/2009772596540121177,2026,1,2026-01-10
2009826304443699402,_aliemili_,2026-01-10T05:15:06.000Z,“A country waiting for the second check mark.”,0,0,0,https://x.com/NazaninNour/status/2009826304443699402,2026,1,2026-01-10
2009902455333761378,_aliemili_,2026-01-10T10:17:42.000Z,"In solidarity with the people of #Iran, we have updated the flag to the historic Sun and Lion emblem across 
codelita.com and our iOS and Android mobile apps.

Honoring Iran’s heritage and the voice of its people.
#FreeIran",0,0,0,https://x.com/theCodelita/status/2009902455333761378,2026,1,2026-01-10
2009901263371325873,_aliemili_,2026-01-10T10:12:58.000Z,#DigitalBlackoutIran,0,0,0,https://x.com/_Aliemili_/status/2009901263371325873,2026,1,2026-01-10
2009644016036450493,_aliemili_,2026-01-09T17:10:45.000Z,"Mr. President, this is an urgent and immediate call for your attention, support, and action. Last night you saw the millions of brave Iranians in the streets facing down live bullets. Today, they are facing not just bullets but a total communications blackout. No Internet. No",0,0,0,https://x.com/PahlaviReza/status/2009644016036450493,2026,1,2026-01-09
2009576778814411159,_aliemili_,2026-01-09T12:43:34.000Z,IRAN,0,0,0,https://x.com/JohnnyNash77/status/2009576778814411159,2026,1,2026-01-09
2009491379043618891,_aliemili_,2026-01-09T07:04:13.000Z,"Over million people rally: Iran’s 2nd largest city under protesters’ control, regime forces leave: 
youtube.com/watch?v=eDpP53
…

(TS: 09 Jan 00:01 ET)‍‌‍‌‍‌‍‌‍‌‍‌‍‌‍‌‍‌‍‌‍‌‍‌‍‌‍‌‍‌‍‌‍‌‍",0,0,0,https://x.com/TrumpTruthOnX/status/2009491379043618891,2026,1,2026-01-09
2009207434678817221,_aliemili_,2026-01-08T12:15:56.000Z,"The revolution in Iran is THE most important news story in the world right now. But it isn't on the front page of the BBC News website. Odd, that.",0,0,0,https://x.com/SimonFoxWriter/status/2009207434678817221,2026,1,2026-01-08
2007446665163100581,_aliemili_,2026-01-03T15:39:16.000Z,خب,0,0,0,https://x.com/_Aliemili_/status/2007446665163100581,2026,1,2026-01-03
2006646948053520542,_aliemili_,2026-01-01T10:41:28.000Z,"اونجا که فدایی میگه:
تهدید به مرگ می‌کنن مگه هرشب کم می‌میرم؟
منو از چی می‌ترسونی اونیم که از سر بریده لب می‌گیرم",0,0,0,https://x.com/_Aliemili_/status/2006646948053520542,2026,1,2026-01-01
2006613003022573779,_aliemili_,2026-01-01T08:26:35.000Z,یوتیوبم هستم,0,0,0,https://x.com/_Aliemili_/status/2006613003022573779,2026,1,2026-01-01
2006436627934228612,_aliemili_,2025-12-31T20:45:44.000Z,"اگه ساز زدنام دیده بشه باعث خوشحالیمه

نمونشو از اینجا بشنوید:",0,0,0,https://x.com/_Aliemili_/status/2006436627934228612,2025,12,2025-12-31
2006435987711472087,_aliemili_,2025-12-31T20:43:11.000Z,"در تکمیل تصمیمات impulsive امسالم که زندگیمو از این رو به اون‌رو کرد
از تیمم جدا شدم و رفتم یه تیم دیگه و از سرپرستی تیم استخدام هم استعفا دادم ",0,0,0,https://x.com/_Aliemili_/status/2006435987711472087,2025,12,2025-12-31
2005896846795809013,_aliemili_,2025-12-30T09:00:50.000Z,فقط می‌تونم بگم لعنت بهتون.,0,0,0,https://x.com/_Aliemili_/status/2005896846795809013,2025,12,2025-12-30
1569250386673901568,_aliemili_,2022-09-12T12:03:42.000Z,زندگی سراسر pain است.,0,0,0,https://x.com/_sarinaez_/status/1569250386673901568,2022,9,2022-09-12
2005761786038083598,_aliemili_,2025-12-30T00:04:09.000Z,"حرومی دستای من خالی‌ان عین مغزت
یه دست به ماشه بسه
بزن معطل نکن
جوری بزن بلند نشم 
جوری بزن بلند نشم که جر میدم هفت جدتو",0,0,0,https://x.com/_Aliemili_/status/2005761786038083598,2025,12,2025-12-30
2005756433623605466,_aliemili_,2025-12-29T23:42:53.000Z,آدم توی برهه‌های حساسی مثل الان میفهمه چرا آدمایی مثل جادی محبوب شدن,0,0,0,https://x.com/_Aliemili_/status/2005756433623605466,2025,12,2025-12-29
2005723539249435111,_aliemili_,2025-12-29T21:32:10.000Z,مرسی که هستی باشگاهِ عزیزم,0,0,0,https://x.com/_Aliemili_/status/2005723539249435111,2025,12,2025-12-29
2005722517730721893,_aliemili_,2025-12-29T21:28:07.000Z,بیژد,0,0,0,https://x.com/_Aliemili_/status/2005722517730721893,2025,12,2025-12-29
2005675201405829267,_aliemili_,2025-12-29T18:20:06.000Z,"اونجایی که نامجو می‌گه:
چه باشد اگر حال من بد نمی‌بود
و خوش هم نمی‌بود و اصلا نمی‌بود",0,0,0,https://x.com/_Aliemili_/status/2005675201405829267,2025,12,2025-12-29
2005564166254284996,_aliemili_,2025-12-29T10:58:53.000Z,"کاری که باید ۴ ساعت زمان میذاشتم رو qwen برام توی نیم‌ساعت انجام داد
خواستم بگم کیر تو آدمیزاد و زنده باد هوش‌مصنوعی :))",0,0,0,https://x.com/_Aliemili_/status/2005564166254284996,2025,12,2025-12-29
2005363847583105411,_aliemili_,2025-12-28T21:42:53.000Z,"اونجا که مرصاد میگه:
نای جاده رو ندارم زدم بغل نشستم
تخصصمه بزنم لگد به بختم",0,0,0,https://x.com/_Aliemili_/status/2005363847583105411,2025,12,2025-12-28
2005340598593859760,_aliemili_,2025-12-28T20:10:30.000Z,"ولی من خوب نیستم
نگران نشو من خوب میشم
ولی من خوب نیستم
نگران نشو من خوب میشم
من خوب نیستم
نگران نشو",0,0,0,https://x.com/_Aliemili_/status/2005340598593859760,2025,12,2025-12-28
2005336467858727197,_aliemili_,2025-12-28T19:54:05.000Z,امشب تماما غروب جمعه‌س انگار,0,0,0,https://x.com/_Aliemili_/status/2005336467858727197,2025,12,2025-12-28
2005293536259006559,_aliemili_,2025-12-28T17:03:30.000Z,"اين شوخى نامردان است كه اميد مى‌دهند و سپس باز پس می‌گیرند و بر نومیدشدگان از ته دل می‌خندند.

«مرگ یزدگرد»
بهرام بیضایی",0,0,0,https://x.com/jafekripodcast/status/2005293536259006559,2025,12,2025-12-28
2005155535969288221,_aliemili_,2025-12-28T07:55:08.000Z,یه فالو توی استراوا به ما نمی‌رسه؟,0,0,0,https://x.com/_Aliemili_/status/2005155535969288221,2025,12,2025-12-28
2005010279151857890,_aliemili_,2025-12-27T22:17:56.000Z,"یعنی شانس نیس گوز خره
حالا که ما بلیت گرجستان گرفتیم اونجا داره انقلاب میشه :|",0,0,0,https://x.com/_Aliemili_/status/2005010279151857890,2025,12,2025-12-27
2004985149587611732,_aliemili_,2025-12-27T20:38:05.000Z,Let it happen,0,0,0,https://x.com/_Aliemili_/status/2004985149587611732,2025,12,2025-12-27
2004969772555845880,_aliemili_,2025-12-27T19:36:58.000Z,مگه بدترین اتفاقی که می‌تونه بیفته چیه عزیزِ من؟,0,0,0,https://x.com/_Aliemili_/status/2004969772555845880,2025,12,2025-12-27
2004947958165635465,_aliemili_,2025-12-27T18:10:18.000Z,"ویدیو آخرم رفت تو اکسپلور و کلی استقبال شد و خوشحالم 
آیدی پیج هنریم: aliemili_brainless",0,0,0,https://x.com/_Aliemili_/status/2004947958165635465,2025,12,2025-12-27
2004947084026495181,_aliemili_,2025-12-27T18:06:49.000Z,"نتیجه یک سال نیمه جدی وزنه زدن 
تغذیه معمولی 
وی + کازئین + کراتین
فرمون خوبه؟",0,0,0,https://x.com/_Aliemili_/status/2004947084026495181,2025,12,2025-12-27
2004939149481238814,_aliemili_,2025-12-27T17:35:17.000Z,"این بار به جای سیگار شرکتی توتون خالص گرفتم که تست کنم و فاک
چقدر فرق داره و چقدر سیگارای شرکتی به معنای واقعی اسکمه
نکش یا اگه میکشی شرکتی نکش",0,0,0,https://x.com/_Aliemili_/status/2004939149481238814,2025,12,2025-12-27
2004936775601717707,_aliemili_,2025-12-27T17:25:51.000Z,کفشای جوردن برای باشگاه بسیار بهتر از چیزی بود که حدس میزدم,0,0,0,https://x.com/_Aliemili_/status/2004936775601717707,2025,12,2025-12-27
2004929485767057539,_aliemili_,2025-12-27T16:56:53.000Z,"بعد یک ماه pre-workout زدم
الان منتظرم خود رونی کلمن بیاد بلندش کنم :))",0,0,0,https://x.com/_Aliemili_/status/2004929485767057539,2025,12,2025-12-27
2004862077954138441,_aliemili_,2025-12-27T12:29:02.000Z,"بمیرم برای این موبایل دولوپرا
یه خروجی twa میخوام بگیرم پاره شدم از دست نت ایران
چطوری زنده میمونین شماها؟",0,0,0,https://x.com/_Aliemili_/status/2004862077954138441,2025,12,2025-12-27
2004627334444597393,_aliemili_,2025-12-26T20:56:15.000Z,"بعد چندین ماه نوشابه مشکی خوردم و در حد ارضا شدن لذت داشت
چیه این دوپامین دیتاکس لامذهب واقعا",0,0,0,https://x.com/_Aliemili_/status/2004627334444597393,2025,12,2025-12-26
2004515006797516999,_aliemili_,2025-12-26T13:29:54.000Z,"ظاهرا دیگه شعب بانک ارز مسافرتی نمیدن و باید از سایت
travel ice ir
اقدام کرد
(طبیعتا به جای اسپیس داته)",0,0,0,https://x.com/_Aliemili_/status/2004515006797516999,2025,12,2025-12-26
2004513944929710348,_aliemili_,2025-12-26T13:25:41.000Z,"اونجا که فرهاد میگه:
می‌بینم صورتمو تو آینه
با لبی خسته می‌پرسم از خودم
این غریبه کیه از من چی می‌خواد؟
اون به من یا من به اون خیره شدم؟",0,0,0,https://x.com/_Aliemili_/status/2004513944929710348,2025,12,2025-12-26
2004354725215449561,_aliemili_,2025-12-26T02:53:00.000Z,This is exactly why men want daughters ,0,0,0,https://x.com/EpicClipVault/status/2004354725215449561,2025,12,2025-12-26
2004141631784816727,_aliemili_,2025-12-25T12:46:14.000Z,از کسایی که سلیقه شخصی دارن و صرفا هرچی ترند میشه رو استفاده نمیکنن خوشم میاد....,0,0,0,https://x.com/khosrushonm/status/2004141631784816727,2025,12,2025-12-25
2004486697011056650,_aliemili_,2025-12-26T11:37:24.000Z,قبل از اینکه به مرحله burnout برسی خودت به استراحت و انجام کارایی که براشون هدف خاصی نداری بپرداز,0,0,0,https://x.com/_Aliemili_/status/2004486697011056650,2025,12,2025-12-26
2004485547348365797,_aliemili_,2025-12-26T11:32:50.000Z,تشکر از آشواگاندای عزیزم که انقدر توی مودم تاثیر مثبت می‌ذاره,0,0,0,https://x.com/_Aliemili_/status/2004485547348365797,2025,12,2025-12-26
2004385541580816411,_aliemili_,2025-12-26T04:55:27.000Z,"هیچ‌کس بزرگ نیست
هیچ‌چیز عمیق نیست
هیچ‌کدام ما مهم نیستیم دگر
تنها سکوت سطحی خاک گرفته‌ی حجم این کتاب‌هاست که زنده‌ست",0,0,0,https://x.com/_Aliemili_/status/2004385541580816411,2025,12,2025-12-26
2004268701059866708,_aliemili_,2025-12-25T21:11:10.000Z,"دوتا از بزرگترین سختیایی که توی طول عمرم متحمل شدم، مدتیه که بهتر دارن پیش میرن
کم کم حس میکنم اوضاع بهتره و تو مسیر نرمال شدنه",0,0,0,https://x.com/_Aliemili_/status/2004268701059866708,2025,12,2025-12-25
2004259027518468223,_aliemili_,2025-12-25T20:32:44.000Z,"یک آشپز ژاپنی باید دو سال اولی که می‌خواد آشپز سوشی بشه، فقط یاد بگیره چطوری برنج درست کنه
دو سااال
بعد به یه برنامه‌نویس میگی یک هفته بیشتر توی فولان ابزار عمیق شو ترش میکنه",0,0,0,https://x.com/_Aliemili_/status/2004259027518468223,2025,12,2025-12-25
2004256499473043636,_aliemili_,2025-12-25T20:22:41.000Z,"اگه می‌خوای توی یه حرفه جدید خفن بشی
تا سرعت پیشرفتت کم میشه
سختیای اون حوزه کم کم خودشو نشون میده
موضوعات دیگه برات جذاب به نظر میان
نکش بیرون
زجر بکش ولی ادامه بده",0,0,0,https://x.com/_Aliemili_/status/2004256499473043636,2025,12,2025-12-25
2004248650063741426,_aliemili_,2025-12-25T19:51:29.000Z,"تحقیق کردم در مورد اینکه کی در مورد روابط عاطفی صاحب نظره
فعلا 
@EstherPerel
 به نظر گزینه خوبی میاد و می‌خوام برم سراغ ریسورسایی که داده بیرون
اینطور که به نظر میاد بیشتر از چهل سال توی این دنیا تجربه کسب کرده و قطعا خیلی چیزا میشه ازش یاد گرفت",0,0,0,https://x.com/_Aliemili_/status/2004248650063741426,2025,12,2025-12-25
2004247321266245672,_aliemili_,2025-12-25T19:46:13.000Z,"چقد تو خوبی مرد 
@hubermanlab",0,0,0,https://x.com/_Aliemili_/status/2004247321266245672,2025,12,2025-12-25
2003688650983551484,_aliemili_,2025-12-24T06:46:15.000Z,گاهی هم اینطوریه ، یه اتفاق میفته .,0,0,0,https://x.com/mahshkin/status/2003688650983551484,2025,12,2025-12-24
2004136342301954393,_aliemili_,2025-12-25T12:25:13.000Z,"صلوات بفرستین هیچِ بهرام اومد روی اپل میوزیک
خب دیگه چند روز بهم پیام ندین بذارین قفلی بزنم :))",0,0,0,https://x.com/_Aliemili_/status/2004136342301954393,2025,12,2025-12-25
2004130500353339842,_aliemili_,2025-12-25T12:02:00.000Z,ترانه علیدوستی ,0,0,0,https://x.com/_Aliemili_/status/2004130500353339842,2025,12,2025-12-25
2004121412026695864,_aliemili_,2025-12-25T11:25:54.000Z,"بهش میگه دوست دختر داری؟ میگه آره
معروفه به چی تو کلاس؟ پسره‌ی چشم چرون :))",0,0,0,https://x.com/_Aliemili_/status/2004121412026695864,2025,12,2025-12-25
2003910420244189443,_aliemili_,2025-12-24T21:27:29.000Z,"رزومه‌ش تقریبا خالی بود و اسم یه شرکتو زده بود
زنگ زدیم، بدفاز گفت چیزایی که می‌پرسین تو رزومم هست دیگه
ما چرا دعوتش کردیم به مصاحبه و استخدامش کردیم؟
اون چرا انقدر نیروی خوبی از کار در اومد؟",0,0,0,https://x.com/_Aliemili_/status/2003910420244189443,2025,12,2025-12-24
2003909569643532325,_aliemili_,2025-12-24T21:24:06.000Z,"باباش پینک‌فلوید باز بود باهاش قرار گذاشتم :))
بعد یکم فکر کردم چه گوهی دارم می‌خورم دقیقا
کنسلش کردم
به کارت برس بچه جان ول کن این چیزارو.",0,0,0,https://x.com/_Aliemili_/status/2003909569643532325,2025,12,2025-12-24
2003908022524170331,_aliemili_,2025-12-24T21:17:58.000Z,"توی کلوس فرند که هیچی
توی یک خونه‌ام باشیم و لخت بشی فایده نداره
ذاتا ترن آفی واقعا
اصن نمیشه هرچی فکر می‌کنم",0,0,0,https://x.com/_Aliemili_/status/2003908022524170331,2025,12,2025-12-24
2003906236316881061,_aliemili_,2025-12-24T21:10:52.000Z,"دختره برام پست می‌فرسته در مورد اینکه چطوری یه نفر رو دعوت کنم به دیت
سیگنالیه که دعوتش کنم به دیت یا حس میکنه انقدر کصشر و بی‌دست و پام که نیاز به این محتوا دارم؟ 
خدا دماغ است (God Knows)",0,0,0,https://x.com/_Aliemili_/status/2003906236316881061,2025,12,2025-12-24
2003701969043751123,_aliemili_,2025-12-24T07:39:11.000Z,"بهم میگن چرا دیگه وارد رابطه نمیشی!
راستش من دیگه نمیخوام حس صبح جدا شدن رو تجربه کنم....",0,0,0,https://x.com/mehdi4325/status/2003701969043751123,2025,12,2025-12-24
2003900718512853500,_aliemili_,2025-12-24T20:48:56.000Z,"امشب اون نقطه‌ایه که تصمیم جدی گرفتم که زندگی مستقل رو شروع کنم
اینم اینجا برای یادگاری گذاشتم که یادم بمونه",0,0,0,https://x.com/_Aliemili_/status/2003900718512853500,2025,12,2025-12-24
2003780861666480538,_aliemili_,2025-12-24T12:52:40.000Z,وضعیت,0,0,0,https://x.com/_Aliemili_/status/2003780861666480538,2025,12,2025-12-24
2003524934920982645,_aliemili_,2025-12-23T19:55:42.000Z,رزومه با عکس لب غنچه‌ای نفرست که دیگه قربونت برم,0,0,0,https://x.com/_Aliemili_/status/2003524934920982645,2025,12,2025-12-23
2003523074881413323,_aliemili_,2025-12-23T19:48:19.000Z,"پاسپورت یا همون گذرنامه که شما میگین اومد
چندتا نکته که ممکنه به درد بخوره:
دوسه روز کاری میرسه و خیلی طول بکشه ده روزه
پولتونو به قرمساقای دزد ندین که زودتر برسه
بعدم اینکه اطلاعاتو دابل چک کنین خیلی مهمه
نکته اخر
اگه مدرکی چیزی ترجمه کردین مهمه که با پاسپورت اطلاعات یکسان باشه",0,0,0,https://x.com/_Aliemili_/status/2003523074881413323,2025,12,2025-12-23
2003455492362809639,_aliemili_,2025-12-23T15:19:46.000Z,"اگه این آسیب از سمت محل کارم تکمیل بشه که دیگه امسال از تمام جهان ممکن آسیب می‌بینم و دیگه چیزی باقی نمیمونه که برام تروما ایجاد نکرده باشه
بخش مثبتش اینه در واقع",0,0,0,https://x.com/_Aliemili_/status/2003455492362809639,2025,12,2025-12-23
2003382414001995976,_aliemili_,2025-12-23T10:29:23.000Z,"راحت‌ترین روش گرفتن ارز مسافرتی چیه؟
بگو ببینم. 
یه ۵۰۰ یورو بگیریم به کار میاد",0,0,0,https://x.com/_Aliemili_/status/2003382414001995976,2025,12,2025-12-23
2003202929088704927,_aliemili_,2025-12-22T22:36:10.000Z,"خب برای گرجستان مسیر زمینی خیلی دنگ و فنگ داشت
یکم سر کیسه رو شل کردیم
قطار به تهران
هواپیما به تفلیس
تیل لیندمان آماده باش که عامدیم",0,0,0,https://x.com/_Aliemili_/status/2003202929088704927,2025,12,2025-12-22
2003196212615479672,_aliemili_,2025-12-22T22:09:29.000Z,"چقدر آدم چیزای جدید می‌بینه
پاشده از اونور اومده نشسته کنارم میگه من با چند نفر تو رابطه‌ام می‌خوام توام جزوشون باشی
Get the fuck out بابا",0,0,0,https://x.com/_Aliemili_/status/2003196212615479672,2025,12,2025-12-22
2003171925615682008,_aliemili_,2025-12-22T20:32:58.000Z,"خسته‌ام مامان خسته
وقتی میگی هرچی از خدا میخوای بهت بده، چیزی میاد تو ذهنم که نمیتونم با گفتنش دلتو بشکنم",0,0,0,https://x.com/_Aliemili_/status/2003171925615682008,2025,12,2025-12-22
2003127452399513964,_aliemili_,2025-12-22T17:36:15.000Z,بخاطر مرگ Chris Rea عملا گریه‌ام گرفت.,0,0,0,https://x.com/_Aliemili_/status/2003127452399513964,2025,12,2025-12-22
2003114358373859621,_aliemili_,2025-12-22T16:44:13.000Z,"فقدان، فقدان، فقدان، فقدان....

آیا دردی جانکاه‌تر از فقدان هم هست؟",0,0,0,https://x.com/HalghehMag/status/2003114358373859621,2025,12,2025-12-22
2003102599021527522,_aliemili_,2025-12-22T15:57:30.000Z,"اوج خرد؟
چیزی که می‌تونم تغییر بدم رو براش تلاش کنم
و چیزی که نمی‌تونم رو پذیرم",0,0,0,https://x.com/_Aliemili_/status/2003102599021527522,2025,12,2025-12-22
2003081956536304031,_aliemili_,2025-12-22T14:35:28.000Z,یک سری خط,0,0,0,https://x.com/mahshkin/status/2003081956536304031,2025,12,2025-12-22
2002824170271367269,_aliemili_,2025-12-21T21:31:07.000Z,"باید اجازه بدم این احساسات هنوز همراهم باشه؟
می‌تونم بیخیالشون بشم؟
قراره بیخیالشون بشم؟
چه زمانی قراره بیخیالشون بشم؟

در کل متد Sedona چیز جالبی به نظر میاد",0,0,0,https://x.com/_Aliemili_/status/2002824170271367269,2025,12,2025-12-21
