tweet_id,username,created_at,text,replies,retweets,likes,url,year,month,date
2002823326553751565,_aliemili_,2025-12-21T21:27:46.000Z,"یه جایی توی فایت کلاب برد پیت طرف رو از پشت دخل میکشه بیرون و رو سرش اسلحه می‌کشه و میگه رویات این بود که چیکاره بشی؟
میگه دانپزشک
میگه ترجیح میدی الان بکشمت یا بری دانپزشک بشی؟
و طرف رو ول میکنه و بهش فرصت میده و تهدید میکنه اگه به رویاش نرسه قراره با اسلحه بکشش
همین.",0,0,0,https://x.com/_Aliemili_/status/2002823326553751565,2025,12,2025-12-21
2002808822742864148,_aliemili_,2025-12-21T20:30:08.000Z,امسال اشتباهات زیادی داشتم و امیدوارم بتونم کم کم با خودم مهربون‌تر باشم و خودمو ببخشم,0,0,0,https://x.com/_Aliemili_/status/2002808822742864148,2025,12,2025-12-21
2002799145694961711,_aliemili_,2025-12-21T19:51:41.000Z,"اگه از تفلیس گرجستان و استانبول ترکیه تجربه‌ای دارین خوشحال میشم باهام در میون بذارین
چی ببرم؟ حواسم به چیا باشه؟ کجاها برم؟",0,0,0,https://x.com/_Aliemili_/status/2002799145694961711,2025,12,2025-12-21
2002797120416550969,_aliemili_,2025-12-21T19:43:38.000Z,"نه هرگز
هرگز هیچکس چنین خطری را به چنان خاطره‌ای تاب نیاورد
از آن که خیال خوبی‌ها، درمان بدی‌ها نیست
بلکه صد چندان بر زشتی آن‌ها می‌افزاید",0,0,0,https://x.com/_Aliemili_/status/2002797120416550969,2025,12,2025-12-21
2002750223341559971,_aliemili_,2025-12-21T16:37:17.000Z,"تابستونم یه کنسرت lamb of godمون بشه زیبا میشه واقعا
وقتشه کم کم بیشتر به خودم و علایقم برسم و بقیه چیزارو تو گذشته رها کنم",0,0,0,https://x.com/_Aliemili_/status/2002750223341559971,2025,12,2025-12-21
2002679545766519260,_aliemili_,2025-12-21T11:56:26.000Z,آقا بلیت اولین کنسرت خارج از ایران اوکی شد ,0,0,0,https://x.com/_Aliemili_/status/2002679545766519260,2025,12,2025-12-21
2002658532404138348,_aliemili_,2025-12-21T10:32:56.000Z,"خب خوشبختانه کد پاسپورت قبل از رسیدنش قابل استعلام بود
میریم که بریم سراغ بلیت ",0,0,0,https://x.com/_Aliemili_/status/2002658532404138348,2025,12,2025-12-21
2002655405105950981,_aliemili_,2025-12-21T10:20:30.000Z,"یکم روی آلبوم هیچ این تلاش نشده که کمی عامه‌پسندی توش موج بزنه؟
فعلا رسیدم به ترک «اون آزاده» و چقدر بیتش با هویت بهرام فاصله داره",0,0,0,https://x.com/_Aliemili_/status/2002655405105950981,2025,12,2025-12-21
2002440802262528156,_aliemili_,2025-12-20T20:07:45.000Z,"چرا آلبوم #هیچ بهرام هنوز توی اپل میوزیک نیست؟ -_-
@BahramNouraei",0,0,0,https://x.com/_Aliemili_/status/2002440802262528156,2025,12,2025-12-20
2002440040086110564,_aliemili_,2025-12-20T20:04:43.000Z,هنوز باورم نمیشه طرف توی نوت گوشی آیفونش رزومه نوشته بعد ازش اسکرین‌شات گرفته و png فرستاده,0,0,0,https://x.com/_Aliemili_/status/2002440040086110564,2025,12,2025-12-20
2002437910185062710,_aliemili_,2025-12-20T19:56:15.000Z,"مسیج اومد پاسپورت ارسال شد
فک کنم فردا پس‌فردا برسه
بلیت اجرا و هواپیما تموم نشه پیش من شیرینی دارین :))",0,0,0,https://x.com/_Aliemili_/status/2002437910185062710,2025,12,2025-12-20
2002434571888193933,_aliemili_,2025-12-20T19:43:00.000Z,خوبتو نمی‌خواد هر چاقالی که,0,0,0,https://x.com/_Aliemili_/status/2002434571888193933,2025,12,2025-12-20
2002426838174609676,_aliemili_,2025-12-20T19:12:16.000Z,و برای تبدیل شدن از staff به principal باید تاثیرات عظیم در سطح سازمان بذاری و ویژن و بینش استراتژیک داشته باشی که اصولا مسائل بلند مدت رو شامل میشه,0,0,0,https://x.com/_Aliemili_/status/2002426838174609676,2025,12,2025-12-20
2002426639154884793,_aliemili_,2025-12-20T19:11:28.000Z,برای تبدیل شدن از سنیوربهstaff بایدبتونی پروژه‌های پیچیده رو جلو ببری و روی تصمیمات تکنیکال با مقیاس بالا، مثلا در حد معماری، تاثیرات مستقیم بذاری,0,0,0,https://x.com/_Aliemili_/status/2002426639154884793,2025,12,2025-12-20
2002406407102992491,_aliemili_,2025-12-20T17:51:05.000Z,برای تبدیل شدن از میدلِوِل به سنیور باید بتونی قدرت رهبری کردن خودتو تقویت کنی و تصمیمات جدی تکنیکال بگیری,0,0,0,https://x.com/_Aliemili_/status/2002406407102992491,2025,12,2025-12-20
2002404281224229274,_aliemili_,2025-12-20T17:42:38.000Z,"برای تبدیل شدن از جونیور به میدلِوِل استقلال خودتو بدست بیار و به صورت مداوم تسک‌هاتو برسون
- بلاک نشدن توی رسوندن تسک مهمه
- اینکه هر خروجی آشغالی رو تحویل ندی که نشون بدی مثلا مستقلی هم مهمه",0,0,0,https://x.com/_Aliemili_/status/2002404281224229274,2025,12,2025-12-20
2002392824411570662,_aliemili_,2025-12-20T16:57:06.000Z,"همکارم گفت دوره dometrain رو با عنوان career getting promoted as a software engineer رو ببین
گفتم چرا که نه و شروعش کردم",0,0,0,https://x.com/_Aliemili_/status/2002392824411570662,2025,12,2025-12-20
2002390356696944758,_aliemili_,2025-12-20T16:47:18.000Z,انقدر جدیدا دارم سر تحلیل کامپوننت‌هام کمال‌گرایی میکنم که سرعت توسعه‌ام اومده پایین‌تر نسبت به قبل,0,0,0,https://x.com/_Aliemili_/status/2002390356696944758,2025,12,2025-12-20
2002387152433271246,_aliemili_,2025-12-20T16:34:34.000Z,"اونجا که فرانک سیناترا میگه:

Each time I find myself flat on my face
I pick myself up and get back in the race
That's life.",0,0,0,https://x.com/_Aliemili_/status/2002387152433271246,2025,12,2025-12-20
2002386586772677054,_aliemili_,2025-12-20T16:32:19.000Z,نجات‌دهنده قهوه است,0,0,0,https://x.com/_Aliemili_/status/2002386586772677054,2025,12,2025-12-20
2002384985479590078,_aliemili_,2025-12-20T16:25:57.000Z,"همینطوریش که توی ایران نود درصد آدما نمیدونن رزومه چیه
کافیه یکی از بچه‌هایی که گذاشتم تو تیم استخدام یکم در مورد رزومه‌نویسی یاد بگیره
دیگه با ریت ۱۰۰ درصد همه رو رد می‌کنه
میگی فلانیو چرا رد کردی؟ میگه غلط املایی داشت ",0,0,0,https://x.com/_Aliemili_/status/2002384985479590078,2025,12,2025-12-20
2002285003451896284,_aliemili_,2025-12-20T09:48:40.000Z,"چیکار کنم این اکانتای اسکم مربوط به کریپتو و کوفت و زهرمار فالوم نکنن؟ 
هی بلاک بلاک بلاک -_-",0,0,0,https://x.com/_Aliemili_/status/2002285003451896284,2025,12,2025-12-20
2001933018345140601,_aliemili_,2025-12-19T10:30:00.000Z,,0,0,0,https://x.com/PathOfMen_/status/2001933018345140601,2025,12,2025-12-19
2002282547099660412,_aliemili_,2025-12-20T09:38:54.000Z,"برام phenomenology جذابه
چون تجربه first-person آدم تمرکزشه
درک subjective آدما از وقایع همیشه از مفاهیم objective برام جالب‌تر بوده",0,0,0,https://x.com/_Aliemili_/status/2002282547099660412,2025,12,2025-12-20
2002275451922768042,_aliemili_,2025-12-20T09:10:42.000Z,"اونجا که نوید میگه:
همیشه یه اخم هست رو صورتم که یه وقت از تو ماشین شاسی بلندت فکر نکنی من کوچیکم
غرورم واسه خودمه نه واسه سوییچ بابام تو جیبم",0,0,0,https://x.com/_Aliemili_/status/2002275451922768042,2025,12,2025-12-20
2002117725926404428,_aliemili_,2025-12-19T22:43:58.000Z,مگه خودتون چقدر تلاش کردین آدم باشین؟,0,0,0,https://x.com/_Aliemili_/status/2002117725926404428,2025,12,2025-12-19
2002033680781373789,_aliemili_,2025-12-19T17:10:00.000Z,برای سلامت روانتونم که شده زیاد پیاده‌روی کنید و بعدا ازم تشکر کنین,0,0,0,https://x.com/_Aliemili_/status/2002033680781373789,2025,12,2025-12-19
2002033192514027694,_aliemili_,2025-12-19T17:08:03.000Z,استویا رو به زندگیتون بیارین و بعدا ازم تشکر کنین,0,0,0,https://x.com/_Aliemili_/status/2002033192514027694,2025,12,2025-12-19
2002031031587607029,_aliemili_,2025-12-19T16:59:28.000Z,"کم کم دارم کامیونیتی مورد علاقمو توی برنامه‌نویسی پیدا می‌کنم اینجا
ولی کامیونیتی موزیسینا و گیتار الکتریک بازا و متالهدا کجاست؟
وجود ندارن توی ایکس؟",0,0,0,https://x.com/_Aliemili_/status/2002031031587607029,2025,12,2025-12-19
2002018678469009413,_aliemili_,2025-12-19T16:10:23.000Z,"داشتم خودمو برای تعطیلات فردا آماده می‌کردم که یهو یادم اومد فردا شنبه‌س
یعنی دو سه تا ترومای ریز اختلال حواسی داده که نگم در موردش",0,0,0,https://x.com/_Aliemili_/status/2002018678469009413,2025,12,2025-12-19
2002010433503301827,_aliemili_,2025-12-19T15:37:37.000Z,صبحانه یه اسکوپ کازئین برین بالا و بعدا ازم تشکر کنین,0,0,0,https://x.com/_Aliemili_/status/2002010433503301827,2025,12,2025-12-19
2002010135212806241,_aliemili_,2025-12-19T15:36:26.000Z,"من از پس این شیب لعنتی
این پیشونی و کلی چین بی‌دلیل
بر میام یه روز",0,0,0,https://x.com/_Aliemili_/status/2002010135212806241,2025,12,2025-12-19
2002009835039064504,_aliemili_,2025-12-19T15:35:14.000Z,"رگ نوک انگشتام سر double bend به فاک میره
بعد چند روز رو برای تمرین از دست میدم
از درد شست موقعی که خیلی برای فرت‌گیری زور میزنمم نگم برات
حس میکنم فقط من به این درد دچارم",0,0,0,https://x.com/_Aliemili_/status/2002009835039064504,2025,12,2025-12-19
2002007523553914994,_aliemili_,2025-12-19T15:26:03.000Z,"از همه‌چی مووآن کردم ولی نتونستم از پستای هیت به اکسی که لایکای اکسم باعث میشد بیان رو فیدم مووآن کنم
من هرجا نشستم خوبتو گفتم
بی‌معرفت.",0,0,0,https://x.com/_Aliemili_/status/2002007523553914994,2025,12,2025-12-19
2000994226394611815,_aliemili_,2025-12-16T20:19:34.000Z,عیب نداره بازم بلند میشم.,0,0,0,https://x.com/_Aliemili_/status/2000994226394611815,2025,12,2025-12-16
2001949971466301463,_aliemili_,2025-12-19T11:37:22.000Z,"اونجایی که شاهین میگه:

همیشه به اندازه ی یک یتیم خواب می دیدی
تو از نبود و من از بودِ پدر ترسیدیم
میان داشته ها هر دو بی پدر بودیم
میان سکته و سرطان هر دو در به در بودیم",0,0,0,https://x.com/_Aliemili_/status/2001949971466301463,2025,12,2025-12-19
2001623865487954127,_aliemili_,2025-12-18T14:01:32.000Z,از استادم به غیر از موسیقی اخلاقم یاد می‌گیرم,0,0,0,https://x.com/_Aliemili_/status/2001623865487954127,2025,12,2025-12-18
2001609484180091198,_aliemili_,2025-12-18T13:04:23.000Z,"شدم مثل یه سیستم عامل که چندتا تارگت اومده سمتش و داره پراسس‌های هرکدوم رو به صورت راندرابین پاسخ میده
(خیلی نِرد بود خودم می‌دونم)",0,0,0,https://x.com/_Aliemili_/status/2001609484180091198,2025,12,2025-12-18
2001607986213720110,_aliemili_,2025-12-18T12:58:26.000Z,"همکارم هربار منو میبینه سرشونه‌هامو دستمالی میکنه میگه چقدر گرد داره میشه، چقدر حال میده
ولی هیچ درصدی از هزینه باشگاه و مربیمو متقبل نمیشه
حداقل برام یه مکمل بخر ",0,0,0,https://x.com/_Aliemili_/status/2001607986213720110,2025,12,2025-12-18
2001605649369817106,_aliemili_,2025-12-18T12:49:09.000Z,"یه زمانی مامانمو اذیت می‌کردم که مستخدم می‌گیره بعد خودش خونه رو تمیز می‌کنه که آبروش نره تا طرف میاد
خودم این مدت داشتم سعی می‌کردم به یه سطحی از نرمال بودن خودمو برگردونم تا بتونم تایم تراپی بگیرم :))",0,0,0,https://x.com/_Aliemili_/status/2001605649369817106,2025,12,2025-12-18
2001604816649306478,_aliemili_,2025-12-18T12:45:50.000Z,"جدا دلم می‌خواد هر آدمی رو که تو خیابون می‌بینم بکشم کنار بگم رویات چیه و اون نقطه‌ای که بهش میگی خوشبختی چیه
حالا نوبت توئه، فکر کن کشیدمت کنار
بگو",0,0,0,https://x.com/_Aliemili_/status/2001604816649306478,2025,12,2025-12-18
2001603296067248336,_aliemili_,2025-12-18T12:39:48.000Z,"بفرست دیگه پاسپورت لعنتیو 
داره بلیتا تموم میشه ",0,0,0,https://x.com/_Aliemili_/status/2001603296067248336,2025,12,2025-12-18
2001602615176470674,_aliemili_,2025-12-18T12:37:06.000Z,دلم برای روزایی که انقدر ساده بودم که می‌خواستم بعد از فرانت برم سراغ بک‌اند و دواپس هم کنارش ادامه بدم تنگ شده ,0,0,0,https://x.com/_Aliemili_/status/2001602615176470674,2025,12,2025-12-18
2001600804256407740,_aliemili_,2025-12-18T12:29:54.000Z,"I just remember years ago when I’d been trying to improve as a junior developer, been watching 
@traversymedia
 courses, it was a Nextjs course. So I sent my first pull request ever something really trivial to his repo and he accepted it. It was so inspiring. Wanted to appreciate.",0,0,0,https://x.com/_Aliemili_/status/2001600804256407740,2025,12,2025-12-18
2001599472359338232,_aliemili_,2025-12-18T12:24:36.000Z,احسنت,0,0,0,https://x.com/_Aliemili_/status/2001599472359338232,2025,12,2025-12-18
2001565240472002951,_aliemili_,2025-12-18T10:08:35.000Z,هنوز به گیتار الکتریک میگین گیتار برقی؟ ,0,0,0,https://x.com/_Aliemili_/status/2001565240472002951,2025,12,2025-12-18
2001552291191505058,_aliemili_,2025-12-18T09:17:07.000Z,میگفت گاهی اوقات انقدر نگرانیم و تلاش می‌کنیم که ویترین خوب باشه که یادمون میره در مغازه رو هنوز باز نکردیم,0,0,0,https://x.com/_Aliemili_/status/2001552291191505058,2025,12,2025-12-18
2001549394337026215,_aliemili_,2025-12-18T09:05:37.000Z,,0,0,0,https://x.com/_Aliemili_/status/2001549394337026215,2025,12,2025-12-18
2001517611129942185,_aliemili_,2025-12-18T06:59:19.000Z,این روزا که شوپنهاور میخونم فقط نگران اینم که یه روز دیگه کتابی از شوپنهاور نمیمونه که بخونم,0,0,0,https://x.com/_Aliemili_/status/2001517611129942185,2025,12,2025-12-18
2001399086889468166,_aliemili_,2025-12-17T23:08:21.000Z,دیگر حضورش برایم ارزشی نداشت، وقتی به یاد می‌آوردم که من در آتش می‌سوختم و او چنان رفتار می‌کرد، گویی غریبه‌ای و گناهکاری بیش نیستم.,0,0,0,https://x.com/rsh7nd/status/2001399086889468166,2025,12,2025-12-17
2001279992848629989,_aliemili_,2025-12-17T15:15:06.000Z,"چقد این مدت به ben کم لطفی کردم
اصلا تا آلبوم بهرام بیا قفلی میزنم روش",0,0,0,https://x.com/_Aliemili_/status/2001279992848629989,2025,12,2025-12-17
2001281141446160547,_aliemili_,2025-12-17T15:19:40.000Z,بیاد*,0,0,0,https://x.com/_Aliemili_/status/2001281141446160547,2025,12,2025-12-17
2001280677812015132,_aliemili_,2025-12-17T15:17:50.000Z,"من می‌خوام سازمو عوض کنم
عذاب وجدان فروش ساز قبلیم باعث شده نخوام بفروشمش چون حس میکنم دارم بهش خیانت می‌کنم، پولم کم میارما، دارم اذیت میشم ولی خب. 
بعد شما تو رابطه عاطفیتون چطوری خیانت می‌کنین و بعد به زندگیتون ادامه میدین؟ :))",0,0,0,https://x.com/_Aliemili_/status/2001280677812015132,2025,12,2025-12-17
2001277121004499029,_aliemili_,2025-12-17T15:03:42.000Z,"اونجای «پرواز بر آشیانه فاخته» که جک نیکلسون تمام زورشو میزنه عرق میکنه، قرمز میشه، نابود میشه تا سنگ رو بلند کنه و بزنه تو شیشه و آخرش نمیتونه
بقیه با ریشخند میگن نتونستی که 
میگه ولی تمام تلاشمو کردم.",0,0,0,https://x.com/_Aliemili_/status/2001277121004499029,2025,12,2025-12-17
2001274630644903979,_aliemili_,2025-12-17T14:53:48.000Z,"حالا هی سعی کن توی همه‌چی «ترین‌اش» باشی
یه روز می‌فهمی که نقص داشتن ناگزیره
تصوری که از بی‌نقص بودن داری افسانه‌س",0,0,0,https://x.com/_Aliemili_/status/2001274630644903979,2025,12,2025-12-17
2001271829210501241,_aliemili_,2025-12-17T14:42:40.000Z,رازش اینه که سیزیف باید بدونه چرا داره این کارو میکنه,0,0,0,https://x.com/_Aliemili_/status/2001271829210501241,2025,12,2025-12-17
2001271506353914173,_aliemili_,2025-12-17T14:41:23.000Z,همین,0,0,0,https://x.com/_Aliemili_/status/2001271506353914173,2025,12,2025-12-17
2001260331834986909,_aliemili_,2025-12-17T13:56:59.000Z,راه رهایی از رنج پذیرش رنجه.,0,0,0,https://x.com/_Aliemili_/status/2001260331834986909,2025,12,2025-12-17
2001202091188949451,_aliemili_,2025-12-17T10:05:33.000Z,فکر کنم love language من کل‌کل و اذیت کردنه.,0,0,0,https://x.com/kiyanfirooz/status/2001202091188949451,2025,12,2025-12-17
2001205304629878879,_aliemili_,2025-12-17T10:18:19.000Z,امروز رو مرخصی گرفتم چون روحم خسته‌س.,0,0,0,https://x.com/_Aliemili_/status/2001205304629878879,2025,12,2025-12-17
2001205221553283532,_aliemili_,2025-12-17T10:18:00.000Z,شاید به درد شما هم خورد اگه میخواین برین توی frontend و اونورا,0,0,0,https://x.com/_Aliemili_/status/2001205221553283532,2025,12,2025-12-17
2001198868461916351,_aliemili_,2025-12-17T09:52:45.000Z,"کاش حداقل این روزا راشل بود
دلم برات تنگ شده موجود مورد علاقه‌ی من
تو بی‌‌نقص‌ترین موجودی بودی که توی عمرم دیدم
فکر می‌کنم فرشته باشی ",0,0,0,https://x.com/_Aliemili_/status/2001198868461916351,2025,12,2025-12-17
2001198099876733091,_aliemili_,2025-12-17T09:49:42.000Z,"یکی از سختیای مدیریت کردن تیم
حضور اعضاییه که دیفالت دوس دارن مخالفت کنن
مهم نیس با چی
مهم اینه که هرجلسه باید یه چیزی برای مخالفت داشته باشن
نکاتشون کمک میکنه ولی معمولا هدف پیش‌برد مسائل نیست",0,0,0,https://x.com/_Aliemili_/status/2001198099876733091,2025,12,2025-12-17
2001196805862678829,_aliemili_,2025-12-17T09:44:33.000Z,"چرا من انقدر برای تعویض روغن و چمیدونم معاینه فنی و تعویض پلاک و این کارا بیش از حد کم طاقتم؟
دوس دارم برگردم خونه هی",0,0,0,https://x.com/_Aliemili_/status/2001196805862678829,2025,12,2025-12-17
2001194418963890244,_aliemili_,2025-12-17T09:35:04.000Z,"پشمام
واقعا فکر نمی‌کردم انقدر نیاز تو جامعه باشه
تا الان پنج نفر ثبت نام کردن
شاید برای بهمن هم پلنی بذارم با این حساب
فعلا دیگه درخواست نفرستین لطفا",0,0,0,https://x.com/_Aliemili_/status/2001194418963890244,2025,12,2025-12-17
2001001004540858716,_aliemili_,2025-12-16T20:46:30.000Z,"میخوام تو ماه جدید (دی) سه نفر جونیور برنامه‌نویسی رو انتخاب کنم و توی مسیر یادگیری و رزومه‌نویسی و همه‌ی این داستانا کمک کنم تا به شغل برسن و قرار نیس بابتش پولی بگیرم
اگه کسی رو میشناسین که اول مسیره میتونین بهم معرفیش کنین",0,0,0,https://x.com/_Aliemili_/status/2001001004540858716,2025,12,2025-12-16
2000626876134396209,_aliemili_,2025-12-15T19:59:51.000Z,وضعیت:,0,0,0,https://x.com/arazz70/status/2000626876134396209,2025,12,2025-12-15
2000987372503359534,_aliemili_,2025-12-16T19:52:20.000Z,"هرچقدرم آدم بدی می‌بودم و کارمائم حقیقت می‌داشت انقدر اتفاق بد پشت سر هم واقعا حق من نبود
برای نصف اینام گناه داشتم واقعا :)",0,0,0,https://x.com/_Aliemili_/status/2000987372503359534,2025,12,2025-12-16
2000938866614919343,_aliemili_,2025-12-16T16:39:36.000Z,"چی بگم والا
منم بار اولمه رو زمینم",0,0,0,https://x.com/_Aliemili_/status/2000938866614919343,2025,12,2025-12-16
2000834631084765579,_aliemili_,2025-12-16T09:45:24.000Z,"یه بیت از فرزاد قدیمی مدت‌ها نجاتم داد
اونجایی که میگه:
«دوباره خودمو پیدا می‌کنم
الان حالم تنها بهتره»",0,0,0,https://x.com/_Aliemili_/status/2000834631084765579,2025,12,2025-12-16
2000622367970656739,_aliemili_,2025-12-15T19:41:56.000Z,اعتمادی ک با رفتار از بین رفته ،با حرف بر نمیگرده.,0,0,0,https://x.com/Mahsaraufinia/status/2000622367970656739,2025,12,2025-12-15
2000647243381326185,_aliemili_,2025-12-15T21:20:47.000Z,لیاقت شما ایناییه که دارن برنامه میریزن با چیپس و ماست موسیر مختونو بزنن با من به رمانتیسیسم  نپرداز گلم,0,0,0,https://x.com/_Aliemili_/status/2000647243381326185,2025,12,2025-12-15
2000646318893453701,_aliemili_,2025-12-15T21:17:07.000Z,دیگه سه ست بارفیکسو بدون کمک می‌زنم و خوشحالم,0,0,0,https://x.com/_Aliemili_/status/2000646318893453701,2025,12,2025-12-15
2000644159997149639,_aliemili_,2025-12-15T21:08:32.000Z,اگه پولت بی‌نهایت بود روزهای باقی موندت چطوری می‌گذشت؟,0,0,0,https://x.com/_Aliemili_/status/2000644159997149639,2025,12,2025-12-15
2000643256846000153,_aliemili_,2025-12-15T21:04:57.000Z,"سامان احتشامی توی یه ویدیو اینستا می‌گفت سال‌هاست (مثلا ۲۰ ۳۰ سال) که خانومم شبی نبوده که برای اجرای زنده من حضور نداشته باشه
می‌خوام بگم با این چرت و پرتایی که تو رابطه هستین اسم پارتنر/همراه رو به انحطاط نبرین",0,0,0,https://x.com/_Aliemili_/status/2000643256846000153,2025,12,2025-12-15
2000565236143935580,_aliemili_,2025-12-15T15:54:55.000Z,با آقا خوشگله دارم میرم ددر دودور,0,0,0,https://x.com/_Aliemili_/status/2000565236143935580,2025,12,2025-12-15
2000253615366443210,_aliemili_,2025-12-14T19:16:39.000Z,No regrets because I know my heart was pure.,0,0,0,https://x.com/rumilyrics/status/2000253615366443210,2025,12,2025-12-14
2000544663619400180,_aliemili_,2025-12-15T14:33:10.000Z,"امسال باید گیتار الکتریک رو عوض کنم
یدونه midi controller بخرم
پلن اینه که یه کنسرت اطراف ایرانم برم و گوشیمم عوض کنم
چندتا مورد دیگه‌ام هست که انداختم ته لیست اگه پول خوب در اومد برم سراغشون",0,0,0,https://x.com/_Aliemili_/status/2000544663619400180,2025,12,2025-12-15
2000543212675461158,_aliemili_,2025-12-15T14:27:24.000Z,اعضای خانواده دست به دست هم دادن انقدر این هفته بهم نیاز داشته باشن که باشگاه کلا کنکل,0,0,0,https://x.com/_Aliemili_/status/2000543212675461158,2025,12,2025-12-15
2000537041814086024,_aliemili_,2025-12-15T14:02:53.000Z,اینکه تمام درآمدت برای خودت باشه موهبت بزرگیه واقعا :)),0,0,0,https://x.com/_Aliemili_/status/2000537041814086024,2025,12,2025-12-15
2000535339866189925,_aliemili_,2025-12-15T13:56:07.000Z,"امروزم یه نفر دیگه که تو زندگیم بود رو از دست دادم و اینجوری بودم که mehr
دیگه سورپرایز نشدم و حس خاصی نداشتم",0,0,0,https://x.com/_Aliemili_/status/2000535339866189925,2025,12,2025-12-15
2000534664805507482,_aliemili_,2025-12-15T13:53:26.000Z,این روزا بعضا غریبه‌ها بیشتر از آدمایی که حاضر بودم براشون جونمو بدن دارن ازم حمایت می‌کنن و هوامو دارن,0,0,0,https://x.com/_Aliemili_/status/2000534664805507482,2025,12,2025-12-15
