tweet_id,username,created_at,text,replies,retweets,likes,url
2002426639154884793,_aliemili_,,برای تبدیل شدن از سنیوربهstaff بایدبتونی پروژه‌های پیچیده رو جلو ببری و روی تصمیمات تکنیکال با مقیاس بالا، مثلا در حد معماری، تاثیرات مستقیم بذاری,0,0,0,https://x.com/_Aliemili_/status/2002426639154884793
2002406407102992491,_aliemili_,,برای تبدیل شدن از میدلِوِل به سنیور باید بتونی قدرت رهبری کردن خودتو تقویت کنی و تصمیمات جدی تکنیکال بگیری,0,0,0,https://x.com/_Aliemili_/status/2002406407102992491
2002404281224229274,_aliemili_,,"برای تبدیل شدن از جونیور به میدلِوِل استقلال خودتو بدست بیار و به صورت مداوم تسک‌هاتو برسون
- بلاک نشدن توی رسوندن تسک مهمه
- اینکه هر خروجی آشغالی رو تحویل ندی که نشون بدی مثلا مستقلی هم مهمه",0,0,0,https://x.com/_Aliemili_/status/2002404281224229274
2002392824411570662,_aliemili_,,"همکارم گفت دوره dometrain رو با عنوان career getting promoted as a software engineer رو ببین
گفتم چرا که نه و شروعش کردم",0,0,0,https://x.com/_Aliemili_/status/2002392824411570662
2002390356696944758,_aliemili_,,انقدر جدیدا دارم سر تحلیل کامپوننت‌هام کمال‌گرایی میکنم که سرعت توسعه‌ام اومده پایین‌تر نسبت به قبل,0,0,0,https://x.com/_Aliemili_/status/2002390356696944758
2002387152433271246,_aliemili_,,"اونجا که فرانک سیناترا میگه:

Each time I find myself flat on my face
I pick myself up and get back in the race
That's life.",0,0,0,https://x.com/_Aliemili_/status/2002387152433271246
2002386586772677054,_aliemili_,,نجات‌دهنده قهوه است,0,0,0,https://x.com/_Aliemili_/status/2002386586772677054
2002384985479590078,_aliemili_,,"همینطوریش که توی ایران نود درصد آدما نمیدونن رزومه چیه
کافیه یکی از بچه‌هایی که گذاشتم تو تیم استخدام یکم در مورد رزومه‌نویسی یاد بگیره
دیگه با ریت ۱۰۰ درصد همه رو رد می‌کنه
میگی فلانیو چرا رد کردی؟ میگه غلط املایی داشت ",0,0,0,https://x.com/_Aliemili_/status/2002384985479590078
2002285003451896284,_aliemili_,,"چیکار کنم این اکانتای اسکم مربوط به کریپتو و کوفت و زهرمار فالوم نکنن؟ 
هی بلاک بلاک بلاک -_-",0,0,0,https://x.com/_Aliemili_/status/2002285003451896284
2001933018345140601,_aliemili_,,,0,0,0,https://x.com/PathOfMen_/status/2001933018345140601
2002282547099660412,_aliemili_,,"برام phenomenology جذابه
چون تجربه first-person آدم تمرکزشه
درک subjective آدما از وقایع همیشه از مفاهیم objective برام جالب‌تر بوده",0,0,0,https://x.com/_Aliemili_/status/2002282547099660412
2002275451922768042,_aliemili_,,"اونجا که نوید میگه:
همیشه یه اخم هست رو صورتم که یه وقت از تو ماشین شاسی بلندت فکر نکنی من کوچیکم
غرورم واسه خودمه نه واسه سوییچ بابام تو جیبم",0,0,0,https://x.com/_Aliemili_/status/2002275451922768042
2002117725926404428,_aliemili_,,مگه خودتون چقدر تلاش کردین آدم باشین؟,0,0,0,https://x.com/_Aliemili_/status/2002117725926404428
2002033680781373789,_aliemili_,,برای سلامت روانتونم که شده زیاد پیاده‌روی کنید و بعدا ازم تشکر کنین,0,0,0,https://x.com/_Aliemili_/status/2002033680781373789
2002033192514027694,_aliemili_,,استویا رو به زندگیتون بیارین و بعدا ازم تشکر کنین,0,0,0,https://x.com/_Aliemili_/status/2002033192514027694
2002031031587607029,_aliemili_,,"کم کم دارم کامیونیتی مورد علاقمو توی برنامه‌نویسی پیدا می‌کنم اینجا
ولی کامیونیتی موزیسینا و گیتار الکتریک بازا و متالهدا کجاست؟
وجود ندارن توی ایکس؟",0,0,0,https://x.com/_Aliemili_/status/2002031031587607029
2002018678469009413,_aliemili_,,"داشتم خودمو برای تعطیلات فردا آماده می‌کردم که یهو یادم اومد فردا شنبه‌س
یعنی دو سه تا ترومای ریز اختلال حواسی داده که نگم در موردش",0,0,0,https://x.com/_Aliemili_/status/2002018678469009413
2002010433503301827,_aliemili_,,صبحانه یه اسکوپ کازئین برین بالا و بعدا ازم تشکر کنین,0,0,0,https://x.com/_Aliemili_/status/2002010433503301827
2002010135212806241,_aliemili_,,"من از پس این شیب لعنتی
این پیشونی و کلی چین بی‌دلیل
بر میام یه روز",0,0,0,https://x.com/_Aliemili_/status/2002010135212806241
2002009835039064504,_aliemili_,,"رگ نوک انگشتام سر double bend به فاک میره
بعد چند روز رو برای تمرین از دست میدم
از درد شست موقعی که خیلی برای فرت‌گیری زور میزنمم نگم برات
حس میکنم فقط من به این درد دچارم",0,0,0,https://x.com/_Aliemili_/status/2002009835039064504
2002007523553914994,_aliemili_,,"از همه‌چی مووآن کردم ولی نتونستم از پستای هیت به اکسی که لایکای اکسم باعث میشد بیان رو فیدم مووآن کنم
من هرجا نشستم خوبتو گفتم
بی‌معرفت.",0,0,0,https://x.com/_Aliemili_/status/2002007523553914994
2000994226394611815,_aliemili_,,عیب نداره بازم بلند میشم.,0,0,0,https://x.com/_Aliemili_/status/2000994226394611815
2001949971466301463,_aliemili_,,"اونجایی که شاهین میگه:

همیشه به اندازه ی یک یتیم خواب می دیدی
تو از نبود و من از بودِ پدر ترسیدیم
میان داشته ها هر دو بی پدر بودیم
میان سکته و سرطان هر دو در به در بودیم",0,0,0,https://x.com/_Aliemili_/status/2001949971466301463
2001623865487954127,_aliemili_,,از استادم به غیر از موسیقی اخلاقم یاد می‌گیرم,0,0,0,https://x.com/_Aliemili_/status/2001623865487954127
2001609484180091198,_aliemili_,,"شدم مثل یه سیستم عامل که چندتا تارگت اومده سمتش و داره پراسس‌های هرکدوم رو به صورت راندرابین پاسخ میده
(خیلی نِرد بود خودم می‌دونم)",0,0,0,https://x.com/_Aliemili_/status/2001609484180091198
2001607986213720110,_aliemili_,,"همکارم هربار منو میبینه سرشونه‌هامو دستمالی میکنه میگه چقدر گرد داره میشه، چقدر حال میده
ولی هیچ درصدی از هزینه باشگاه و مربیمو متقبل نمیشه
حداقل برام یه مکمل بخر ",0,0,0,https://x.com/_Aliemili_/status/2001607986213720110
2001605649369817106,_aliemili_,,"یه زمانی مامانمو اذیت می‌کردم که مستخدم می‌گیره بعد خودش خونه رو تمیز می‌کنه که آبروش نره تا طرف میاد
خودم این مدت داشتم سعی می‌کردم به یه سطحی از نرمال بودن خودمو برگردونم تا بتونم تایم تراپی بگیرم :))",0,0,0,https://x.com/_Aliemili_/status/2001605649369817106
2001604816649306478,_aliemili_,,"جدا دلم می‌خواد هر آدمی رو که تو خیابون می‌بینم بکشم کنار بگم رویات چیه و اون نقطه‌ای که بهش میگی خوشبختی چیه
حالا نوبت توئه، فکر کن کشیدمت کنار
بگو",0,0,0,https://x.com/_Aliemili_/status/2001604816649306478
2001603296067248336,_aliemili_,,"بفرست دیگه پاسپورت لعنتیو 
داره بلیتا تموم میشه ",0,0,0,https://x.com/_Aliemili_/status/2001603296067248336
2001602615176470674,_aliemili_,,دلم برای روزایی که انقدر ساده بودم که می‌خواستم بعد از فرانت برم سراغ بک‌اند و دواپس هم کنارش ادامه بدم تنگ شده ,0,0,0,https://x.com/_Aliemili_/status/2001602615176470674
2001600804256407740,_aliemili_,,"I just remember years ago when I’d been trying to improve as a junior developer, been watching 
@traversymedia
 courses, it was a Nextjs course. So I sent my first pull request ever something really trivial to his repo and he accepted it. It was so inspiring. Wanted to appreciate.",0,0,0,https://x.com/_Aliemili_/status/2001600804256407740
2001599472359338232,_aliemili_,,احسنت,0,0,0,https://x.com/_Aliemili_/status/2001599472359338232
2001565240472002951,_aliemili_,,هنوز به گیتار الکتریک میگین گیتار برقی؟ ,0,0,0,https://x.com/_Aliemili_/status/2001565240472002951
2001552291191505058,_aliemili_,,میگفت گاهی اوقات انقدر نگرانیم و تلاش می‌کنیم که ویترین خوب باشه که یادمون میره در مغازه رو هنوز باز نکردیم,0,0,0,https://x.com/_Aliemili_/status/2001552291191505058
2001549394337026215,_aliemili_,,,0,0,0,https://x.com/_Aliemili_/status/2001549394337026215
2001517611129942185,_aliemili_,,این روزا که شوپنهاور میخونم فقط نگران اینم که یه روز دیگه کتابی از شوپنهاور نمیمونه که بخونم,0,0,0,https://x.com/_Aliemili_/status/2001517611129942185
2001399086889468166,_aliemili_,,دیگر حضورش برایم ارزشی نداشت، وقتی به یاد می‌آوردم که من در آتش می‌سوختم و او چنان رفتار می‌کرد، گویی غریبه‌ای و گناهکاری بیش نیستم.,0,0,0,https://x.com/rsh7nd/status/2001399086889468166
2001279992848629989,_aliemili_,,"چقد این مدت به ben کم لطفی کردم
اصلا تا آلبوم بهرام بیا قفلی میزنم روش",0,0,0,https://x.com/_Aliemili_/status/2001279992848629989
2001281141446160547,_aliemili_,,بیاد*,0,0,0,https://x.com/_Aliemili_/status/2001281141446160547
2001280677812015132,_aliemili_,,"من می‌خوام سازمو عوض کنم
عذاب وجدان فروش ساز قبلیم باعث شده نخوام بفروشمش چون حس میکنم دارم بهش خیانت می‌کنم، پولم کم میارما، دارم اذیت میشم ولی خب. 
بعد شما تو رابطه عاطفیتون چطوری خیانت می‌کنین و بعد به زندگیتون ادامه میدین؟ :))",0,0,0,https://x.com/_Aliemili_/status/2001280677812015132
2001277121004499029,_aliemili_,,"اونجای «پرواز بر آشیانه فاخته» که جک نیکلسون تمام زورشو میزنه عرق میکنه، قرمز میشه، نابود میشه تا سنگ رو بلند کنه و بزنه تو شیشه و آخرش نمیتونه
بقیه با ریشخند میگن نتونستی که 
میگه ولی تمام تلاشمو کردم.",0,0,0,https://x.com/_Aliemili_/status/2001277121004499029
2001274630644903979,_aliemili_,,"حالا هی سعی کن توی همه‌چی «ترین‌اش» باشی
یه روز می‌فهمی که نقص داشتن ناگزیره
تصوری که از بی‌نقص بودن داری افسانه‌س",0,0,0,https://x.com/_Aliemili_/status/2001274630644903979
2001271829210501241,_aliemili_,,رازش اینه که سیزیف باید بدونه چرا داره این کارو میکنه,0,0,0,https://x.com/_Aliemili_/status/2001271829210501241
2001271506353914173,_aliemili_,,همین,0,0,0,https://x.com/_Aliemili_/status/2001271506353914173
2001260331834986909,_aliemili_,,راه رهایی از رنج پذیرش رنجه.,0,0,0,https://x.com/_Aliemili_/status/2001260331834986909
2001202091188949451,_aliemili_,,فکر کنم love language من کل‌کل و اذیت کردنه.,0,0,0,https://x.com/kiyanfirooz/status/2001202091188949451
2001205304629878879,_aliemili_,,امروز رو مرخصی گرفتم چون روحم خسته‌س.,0,0,0,https://x.com/_Aliemili_/status/2001205304629878879
2001205221553283532,_aliemili_,,شاید به درد شما هم خورد اگه میخواین برین توی frontend و اونورا,0,0,0,https://x.com/_Aliemili_/status/2001205221553283532
2001198868461916351,_aliemili_,,"کاش حداقل این روزا راشل بود
دلم برات تنگ شده موجود مورد علاقه‌ی من
تو بی‌‌نقص‌ترین موجودی بودی که توی عمرم دیدم
فکر می‌کنم فرشته باشی ",0,0,0,https://x.com/_Aliemili_/status/2001198868461916351
2001198099876733091,_aliemili_,,"یکی از سختیای مدیریت کردن تیم
حضور اعضاییه که دیفالت دوس دارن مخالفت کنن
مهم نیس با چی
مهم اینه که هرجلسه باید یه چیزی برای مخالفت داشته باشن
نکاتشون کمک میکنه ولی معمولا هدف پیش‌برد مسائل نیست",0,0,0,https://x.com/_Aliemili_/status/2001198099876733091
2001196805862678829,_aliemili_,,"چرا من انقدر برای تعویض روغن و چمیدونم معاینه فنی و تعویض پلاک و این کارا بیش از حد کم طاقتم؟
دوس دارم برگردم خونه هی",0,0,0,https://x.com/_Aliemili_/status/2001196805862678829
2001194418963890244,_aliemili_,,"پشمام
واقعا فکر نمی‌کردم انقدر نیاز تو جامعه باشه
تا الان پنج نفر ثبت نام کردن
شاید برای بهمن هم پلنی بذارم با این حساب
فعلا دیگه درخواست نفرستین لطفا",0,0,0,https://x.com/_Aliemili_/status/2001194418963890244
2001001004540858716,_aliemili_,,"میخوام تو ماه جدید (دی) سه نفر جونیور برنامه‌نویسی رو انتخاب کنم و توی مسیر یادگیری و رزومه‌نویسی و همه‌ی این داستانا کمک کنم تا به شغل برسن و قرار نیس بابتش پولی بگیرم
اگه کسی رو میشناسین که اول مسیره میتونین بهم معرفیش کنین",0,0,0,https://x.com/_Aliemili_/status/2001001004540858716
2000626876134396209,_aliemili_,,وضعیت:,0,0,0,https://x.com/arazz70/status/2000626876134396209
2000987372503359534,_aliemili_,,"هرچقدرم آدم بدی می‌بودم و کارمائم حقیقت می‌داشت انقدر اتفاق بد پشت سر هم واقعا حق من نبود
برای نصف اینام گناه داشتم واقعا :)",0,0,0,https://x.com/_Aliemili_/status/2000987372503359534
2000938866614919343,_aliemili_,,"چی بگم والا
منم بار اولمه رو زمینم",0,0,0,https://x.com/_Aliemili_/status/2000938866614919343
2000834631084765579,_aliemili_,,"یه بیت از فرزاد قدیمی مدت‌ها نجاتم داد
اونجایی که میگه:
«دوباره خودمو پیدا می‌کنم
الان حالم تنها بهتره»",0,0,0,https://x.com/_Aliemili_/status/2000834631084765579
2000622367970656739,_aliemili_,,اعتمادی ک با رفتار از بین رفته ،با حرف بر نمیگرده.,0,0,0,https://x.com/Mahsaraufinia/status/2000622367970656739
2000647243381326185,_aliemili_,,لیاقت شما ایناییه که دارن برنامه میریزن با چیپس و ماست موسیر مختونو بزنن با من به رمانتیسیسم  نپرداز گلم,0,0,0,https://x.com/_Aliemili_/status/2000647243381326185
2000646318893453701,_aliemili_,,دیگه سه ست بارفیکسو بدون کمک می‌زنم و خوشحالم,0,0,0,https://x.com/_Aliemili_/status/2000646318893453701
2000644159997149639,_aliemili_,,اگه پولت بی‌نهایت بود روزهای باقی موندت چطوری می‌گذشت؟,0,0,0,https://x.com/_Aliemili_/status/2000644159997149639
2000643256846000153,_aliemili_,,"سامان احتشامی توی یه ویدیو اینستا می‌گفت سال‌هاست (مثلا ۲۰ ۳۰ سال) که خانومم شبی نبوده که برای اجرای زنده من حضور نداشته باشه
می‌خوام بگم با این چرت و پرتایی که تو رابطه هستین اسم پارتنر/همراه رو به انحطاط نبرین",0,0,0,https://x.com/_Aliemili_/status/2000643256846000153
2000565236143935580,_aliemili_,,با آقا خوشگله دارم میرم ددر دودور,0,0,0,https://x.com/_Aliemili_/status/2000565236143935580
2000253615366443210,_aliemili_,,No regrets because I know my heart was pure.,0,0,0,https://x.com/rumilyrics/status/2000253615366443210
2000544663619400180,_aliemili_,,"امسال باید گیتار الکتریک رو عوض کنم
یدونه midi controller بخرم
پلن اینه که یه کنسرت اطراف ایرانم برم و گوشیمم عوض کنم
چندتا مورد دیگه‌ام هست که انداختم ته لیست اگه پول خوب در اومد برم سراغشون",0,0,0,https://x.com/_Aliemili_/status/2000544663619400180
2000543212675461158,_aliemili_,,اعضای خانواده دست به دست هم دادن انقدر این هفته بهم نیاز داشته باشن که باشگاه کلا کنکل,0,0,0,https://x.com/_Aliemili_/status/2000543212675461158
2000537041814086024,_aliemili_,,اینکه تمام درآمدت برای خودت باشه موهبت بزرگیه واقعا :)),0,0,0,https://x.com/_Aliemili_/status/2000537041814086024
2000535339866189925,_aliemili_,,"امروزم یه نفر دیگه که تو زندگیم بود رو از دست دادم و اینجوری بودم که mehr
دیگه سورپرایز نشدم و حس خاصی نداشتم",0,0,0,https://x.com/_Aliemili_/status/2000535339866189925
2000534664805507482,_aliemili_,,این روزا بعضا غریبه‌ها بیشتر از آدمایی که حاضر بودم براشون جونمو بدن دارن ازم حمایت می‌کنن و هوامو دارن,0,0,0,https://x.com/_Aliemili_/status/2000534664805507482
2000496269454692807,_aliemili_,,از آدمایی که نیاز ندارن هرکسی دوستشون داشته باشه خوشم میاد.,0,0,0,https://x.com/Leila_7876/status/2000496269454692807
1999734041768263871,_aliemili_,,— Fyodor Dostoyevsky,0,0,0,https://x.com/Lovandfear/status/1999734041768263871
2000292653536366726,_aliemili_,,"فقط خودتون آدمین بقیه هرچی که شد شد
گمشین بابا لعنت به فلسفه وجودتون",0,0,0,https://x.com/_Aliemili_/status/2000292653536366726
2000256666080808977,_aliemili_,,"به چه کسی میگویند آدم اَمن؟
به کسی که وقتی جای زخم هایت را به او نشان دادی از آن پس همه تلاشش را میکند که از آن سمت به تو آسیبی نرسد!",0,0,0,https://x.com/Thisismohammadd/status/2000256666080808977
2000273429266665594,_aliemili_,,"از آدمایی که توی زندگیشون روتین ندارن و وقتی سینگل میشن شروع میکنن درگیر self improvement میشن خوشم نمیاد
این اتفاق خیلی چیزا رو در موردشون توضیح میده",0,0,0,https://x.com/_Aliemili_/status/2000273429266665594
2000268241319456940,_aliemili_,,"تا می‌فهمین آدم سینگله با هزار بهونه نیاز به راهنمایی برای برنامه‌نویسی و چرت و پرتای دیگه وقت آدمو می‌گیرین که نزدیک بشین ولی حرفتونو نمیزنین
فک می‌کنین این موها کجا سفید شده؟ :))",0,0,0,https://x.com/_Aliemili_/status/2000268241319456940
2000267443370127580,_aliemili_,,"اوف که دیگه بهرام آلبومش داره میاد و دلم میخواد چند ماهی کسی سراغم نیاد فقط غرق شم توش
ببین غرقا",0,0,0,https://x.com/_Aliemili_/status/2000267443370127580
1999923243751469519,_aliemili_,,آقا سوپرانوز (sopranos) واقعا ارزش دیدن داره,0,0,0,https://x.com/_Aliemili_/status/1999923243751469519
1999922958287134902,_aliemili_,,ولی انصاف نبود این مدت که تمام اتفاقای بد دومینو وار افتاد، رئال مادریدم انقدر بد باشه ,0,0,0,https://x.com/_Aliemili_/status/1999922958287134902
1999922184245199038,_aliemili_,,"صحبت از سرمایه‌گذاری شد
تو می‌تونی روزی که داری پول جمع می‌کنی تا بدی پارتنرت که یه قدم به هدف نزدیکتر بشه و مرخصی میگیری که به سلامتیش برسی‌ام از دستش بدی
روی خودت سرمایه‌گذاری کن، مرسی.",0,0,0,https://x.com/_Aliemili_/status/1999922184245199038
1999904053875351868,_aliemili_,,"دیسیپلین دیسیپلین دیسیپلین
و برای مفاهیم پایه بیشتر وقت بذار و از اینکه زمانت از دست بره نترس",0,0,0,https://x.com/_Aliemili_/status/1999904053875351868
1999903626186416216,_aliemili_,,"اگه گند زدی و زمین خوردی
ارزشمندی ",0,0,0,https://x.com/_Aliemili_/status/1999903626186416216
1999901332396712094,_aliemili_,,"از خودت بپرس دوست داری روی خودت کوتاه مدت سرمایه‌گذاری کنی یا بلند مدت
بعد تصمیماتتو بر اساس این بگیر",0,0,0,https://x.com/_Aliemili_/status/1999901332396712094
1999883186911003070,_aliemili_,,"فهمیدم بین ۶ ماه تا یکسال اولی که آدم میخواد ساز یاد بگیره خیلی تفاوتی نداره که چی تمرین میکنه
مهمه که فقط تمرین کنه آدم
البته که مهمه اشتباه جلو نره و استاد میتونه کمک کنه ولی وجودش ضروری نیست
قطعا ساز دومو خودم میتونم یاد بگیرم دیگه",0,0,0,https://x.com/_Aliemili_/status/1999883186911003070
1999880929205211156,_aliemili_,,"این روزا همه‌چی بهتره
کم کم داره ورزش لذت قبلشو میده
سیگار داره ترک میشه
ساز زدن داره مثل قبل لذت میده و روی غلتک افتاده
تمرکزم سر کار داره برمیگرده و سطح تحملم بالاتر میره هرروز
خلاصه اینکه هر چیز خوب و بدی می‌گذره
نه جوگیر شو نه خودتو بباز
باشه؟",0,0,0,https://x.com/_Aliemili_/status/1999880929205211156
1999788216438882625,_aliemili_,,بالاخره جواب داد و به نظر سوپروایزری که بخاطر مسخره بازیاش آموزشگاه زبانمو عوض کردم، داره اخراج میشه ,0,0,0,https://x.com/_Aliemili_/status/1999788216438882625
1999732576874009026,_aliemili_,,شانس ما از همکلاسی غیر هم‌جنس به روایت تصویر,0,0,0,https://x.com/_Aliemili_/status/1999732576874009026
1999586071873568821,_aliemili_,,"اصطلاحی وجود داره به اسم Plateau 
توی یادگیری هرچیزی یک جاهای نمودار یادگیری خط صاف میشه و بالا نمیره
خبر خوب اینکه این فاز همیشه تموم میشه
خبر بد اینکه ار زمانی که ما می‌خوایم یه چیز جدید رو توش استاد بشیم توی این فاز سپری می‌کنیم
مهم اینه که کم نیاریم",0,0,0,https://x.com/_Aliemili_/status/1999586071873568821
1999580731450736932,_aliemili_,,"میگن برای یاد گرفتن یک حرفه حداقل ۲ سال باید با چیزای مختلف اون حرفه ور بری و تا تازه بفهمی چند چندی
برای منی که الان حدودا یک ساله ساز میزنم و باشگاه میرم خبر خوبی بود",0,0,0,https://x.com/_Aliemili_/status/1999580731450736932
1999577175050092646,_aliemili_,,"دوس دارم هرچی زودتر برم سراغ کتاب Mastery از George Leonard ولی فعلا باید کتاب شوپنهاور عزیزم رو تموم کنم
چقدر تو پیریای منی مرد.",0,0,0,https://x.com/_Aliemili_/status/1999577175050092646
1999568548344008903,_aliemili_,,"دوباره برگشتم چون لازمه از اینجا به بعد رو برای خودم ژورنال کنم
چون همه‌چی تقسیم میشه به از اینجا به قبل و از اینجا به بعد.",0,0,0,https://x.com/_Aliemili_/status/1999568548344008903
