tweet_id,username,created_at,text,replies,retweets,likes,url,year,month,date
1890030904812388574,_h_o_o_r_,2025-02-13T15:30:57.000Z,با اینکه کشور اسلامی هستیم ولی اندازه یه تایلند جنده داریم.,0,0,0,https://x.com/_h_o_o_r_/status/1890030904812388574,2025,2,2025-02-13
1890028967492767901,_h_o_o_r_,2025-02-13T15:23:15.000Z,"طغیان شرف برده است و اما شرف شما در فرمانبری باد، فرماندهی‌تان همانا فرمانبری باد!
«چنین گفت زرتشت»",0,0,0,https://x.com/_h_o_o_r_/status/1890028967492767901,2025,2,2025-02-13
1889697800570442138,_h_o_o_r_,2025-02-12T17:27:19.000Z,به تخمم حساسید که پیامتونو دیر سین میکنم.,0,0,0,https://x.com/_h_o_o_r_/status/1889697800570442138,2025,2,2025-02-12
1889696251496538282,_h_o_o_r_,2025-02-12T17:21:09.000Z,فکت: مذهبیا به داگی استایل میگن سجده‌ای!,0,0,0,https://x.com/_h_o_o_r_/status/1889696251496538282,2025,2,2025-02-12
1859949521268297734,_h_o_o_r_,2024-11-22T15:18:16.000Z,"#فکت 
اگه میخوای بدونی یه دختر ازت خوشش میاد یا نه به پاهاش نگاه کن:
اگه جفت بودن احتمالا ازت خوشش نمیاد. 
ولی اگه رو شونه هات بودن حتما خوشش میاد.",0,0,0,https://x.com/_h_o_o_r_/status/1859949521268297734,2024,11,2024-11-22
1858954604979122543,_h_o_o_r_,2024-11-19T21:24:50.000Z,"کی میگییره جاتووو؟
یه آدم خونواده دار…",0,0,0,https://x.com/_h_o_o_r_/status/1858954604979122543,2024,11,2024-11-19
1833914075405074612,_h_o_o_r_,2024-09-11T20:02:42.000Z,پارک نیاوران=اراضی ییلاق کولی ها و عشایر,0,0,0,https://x.com/_h_o_o_r_/status/1833914075405074612,2024,9,2024-09-11
