tweet_id,username,created_at,text,replies,retweets,likes,url,year,month,date
1529738436902588417,_mehrabooon,2022-05-26 11:17:19.180,"ایرانمون دیگه شبیه گربه نیست
بیشتر شبیه گورستان آدما و آرزوهاشونه
#آبادان 
#آبادان_مظلوم",0,0,0,https://x.com/_Mehraboonn/status/1529738436902588417,2022,5,2022-05-26
1527564577394802691,_mehrabooon,2022-05-20 11:19:10.685,تجربه اولمه که دارم دلمه درست میکنم,0,0,0,https://x.com/_Mehraboonn/status/1527564577394802691,2022,5,2022-05-20
1526100049029214208,_mehrabooon,2022-05-16 10:19:39.913,یک عدد خاله خوشحالو میبینین,0,0,0,https://x.com/_Mehraboonn/status/1526100049029214208,2022,5,2022-05-16
1516829318558720013,_mehrabooon,2022-04-20 20:21:05.527,"دلت که تنگ شد فقط صدایم کن 
حوالی احوال تو همیشه منتظرم 

#نیما",0,0,0,https://x.com/W_L_F01/status/1516829318558720013,2022,4,2022-04-20
1508790044257144842,_mehrabooon,2022-03-29 15:55:53.171,اومدم حالو هوای تایم لاینتونو گل گلی کنم,0,0,0,https://x.com/_Mehraboonn/status/1508790044257144842,2022,3,2022-03-29
1516865432749330437,_mehrabooon,2022-04-20 22:44:35.821,"تو وسایل قدیمی پیداش کردم
تاریخ انتشارش یک سال بعد از تولد منه
حتی اون موقع هم مسئولین مشکل بینایی داشتن",0,0,0,https://x.com/_Mehraboonn/status/1516865432749330437,2022,4,2022-04-20
1510638856462340098,_mehrabooon,2022-04-03 18:22:24.350,خب الان میرسیم به بحث شیرین حلیم با شکر یا نمک؟؟؟,0,0,0,https://x.com/_Mehraboonn/status/1510638856462340098,2022,4,2022-04-03
1502662114669998084,_mehrabooon,2022-03-12 17:05:40.906,"میشه پیج کاریمو فالو کنین
instagram.com/tv/Ca7sBIxjJbH
….",0,0,0,https://x.com/_Mehraboonn/status/1502662114669998084,2022,3,2022-03-12
1499790503063130112,_mehrabooon,2022-03-04 18:54:55.347,امیدوارم هیچوقت مسیرتون به بیمارستان دولتی نیافته ,0,0,0,https://x.com/_Mehraboonn/status/1499790503063130112,2022,3,2022-03-04
1493279781596516353,_mehrabooon,2022-02-14 19:43:38.386,"درسته رمانتیک نیست واسم گل  نمیخره ولی تا دید چندتااز کشوهام شکسته اومد کارگاه برام یه جدیدشو درست کنه
به عنوان کادو ولنتاین ازش قبول کردم",0,0,0,https://x.com/_Mehraboonn/status/1493279781596516353,2022,2,2022-02-14
1492481401173782529,_mehrabooon,2022-02-12 14:51:09.660,یه منشن بذارین ببینم چندنفریم,0,0,0,https://x.com/_mehrabooon/status/1492481401173782529,2022,2,2022-02-12
1492473159051845632,_mehrabooon,2022-02-12 14:18:24.585,"چی از این بهتره که بعد از کار خسته بیای خونه
هم ناهارت آماده باشه هم قلیونت",0,0,0,https://x.com/_Mehraboonn/status/1492473159051845632,2022,2,2022-02-12
1488590369587609603,_mehrabooon,2022-02-01 21:09:35.438,جا داره که تو منوی رستوران به جای پاستا بنویسن حضرت عشق,0,0,0,https://x.com/_Mehraboonn/status/1488590369587609603,2022,2,2022-02-01
1484617269061820416,_mehrabooon,2022-01-21 22:01:54.456,"از من به شما آقایون سینگل نصیحت با دخترای تپلی دوست بشین هم دستپخت  خوبی دارن
هم اینکه با خوراکیای خوشمزه میتونین خوشحالشون کنین",0,0,0,https://x.com/_Mehraboonn/status/1484617269061820416,2022,1,2022-01-21
1485578988877721601,_mehrabooon,2022-01-24 13:43:26.328,ای که دستت میرسد فالو کن بک میدم ریت هم بزنی که عالیه,0,0,0,https://x.com/_Mehraboonn/status/1485578988877721601,2022,1,2022-01-24
1482232847029219331,_mehrabooon,2022-01-15 08:07:03.943,"چرا شنبه ها باید صبح زود بیدار بشم
اصلا چرا باید برم سرکار
اصلا این چه زندگیه",0,0,0,https://x.com/_Mehraboonn/status/1482232847029219331,2022,1,2022-01-15
1482405572733550592,_mehrabooon,2022-01-15 19:33:24.960,"وقتی میاد محل کارت و با یه ذرت مکزیکی و چندتا شکلات سوپرایزت میکنه
یه جون کمه 10 تا جون به جونام اضافه شد",0,0,0,https://x.com/_Mehraboonn/status/1482405572733550592,2022,1,2022-01-15
1479092052344328196,_mehrabooon,2022-01-06 16:06:40.137,"احتمالا یه مدت طولانی نخوام بیام
امیدوارم تو این مدت اتفاقای خوبی براتون بیفته 
یاد من افتادین برام دعا کنین",0,0,0,https://x.com/chikichikiiland/status/1479092052344328196,2022,1,2022-01-06
1479327118718816258,_mehrabooon,2022-01-07 07:40:44.328,"هروقت عجله داری این خط چشم کوفتی جفت نمیشه
(وی با خط چشم تا به تا رفت بیرون)",0,0,0,https://x.com/_Mehraboonn/status/1479327118718816258,2022,1,2022-01-07
1478395316080627718,_mehrabooon,2022-01-04 17:58:05.267,"تا حالا تو عمرم واقعا سورپرایز نشده بودم
همیشه یه جوری میفهمیدم امروز واقعا پرام ریخت",0,0,0,https://x.com/_Mehraboonn/status/1478395316080627718,2022,1,2022-01-04
1475894430376857609,_mehrabooon,2021-12-28 20:20:27.651,بهش گفتم یه بسته چیپس بگیر بیا خونه,0,0,0,https://x.com/_Mehraboonn/status/1475894430376857609,2021,12,2021-12-28
1476632976590999554,_mehrabooon,2021-12-30 21:15:10.790,"پنجشنبه و تایم لاین خلوت
تازه همتونم از سینگلی مینالین",0,0,0,https://x.com/_Mehraboonn/status/1476632976590999554,2021,12,2021-12-30
1474138695909482496,_mehrabooon,2021-12-24 00:03:47.934,به هدرم توجه کنین احساس غریبی نکنه یه وقت,0,0,0,https://x.com/_Mehraboonn/status/1474138695909482496,2021,12,2021-12-24
1471685897074712578,_mehrabooon,2021-12-17 05:37:15.121,بعداز کارتو معدن سخترین کار ریمل زدن تو ماشینِ درحالِ حرکته,0,0,0,https://x.com/_Mehraboonn/status/1471685897074712578,2021,12,2021-12-17
1473032912077570059,_mehrabooon,2021-12-20 22:49:48.524,لذتی که تو پوشیدن هودی همسر هست تو هودی خودم نیست,0,0,0,https://x.com/_Mehraboonn/status/1473032912077570059,2021,12,2021-12-20
1470684240295641089,_mehrabooon,2021-12-14 11:17:01.535,"خواهرشوهرم 5 میلیون داده دکتر زیبایی که براش تزریق لُپ انجام بده
قدر لپتونو بدونین الان شما 5 میلیون جلویی",0,0,0,https://x.com/_Mehraboonn/status/1470684240295641089,2021,12,2021-12-14
1466383029065056261,_mehrabooon,2021-12-02 14:25:32.865,داری رد میشی یه منشنم واسه من بذار,0,0,0,https://x.com/_Mehraboonn/status/1466383029065056261,2021,12,2021-12-02
1468251428695199749,_mehrabooon,2021-12-07 18:09:54.050,"شماهم وقتی لوازم آرایشی میخرین ذوق میکنین یا فقط من این مدلی ام
منتظرم برسم خونه استفادشون کنم",0,0,0,https://x.com/_Mehraboonn/status/1468251428695199749,2021,12,2021-12-07
1469535155471716353,_mehrabooon,2021-12-11 07:10:58.364,"از من به شما نصیحت
اول صبح در مورد مسائل مالی با همسرتون بحث نکنین آخرش دعوا میشه",0,0,0,https://x.com/_Mehraboonn/status/1469535155471716353,2021,12,2021-12-11
1467917990989553678,_mehrabooon,2021-12-06 20:04:56.306,"امروز از اون روزای نادر زندگیم بود با دوتا آقا دعوا کردم
یکیشون سنش بالا بود و من عصبانی شدم بهش حرف بد زدم
به شدت عذاب وجدان دارم",0,0,0,https://x.com/_Mehraboonn/status/1467917990989553678,2021,12,2021-12-06
1466991563431628801,_mehrabooon,2021-12-04 06:43:38.764,بیاین بگین که فقط من نیستم که این بلارو سر همه کرم هام میارم,0,0,0,https://x.com/_Mehraboonn/status/1466991563431628801,2021,12,2021-12-04
1465662383393689605,_mehrabooon,2021-11-30 14:41:57.548,"یعنی اگه همه آقایون مثل همسرم انقد فنی بودن تمام مشاغلی که یه خدماتی رو ارائه میدادن ورشکست میشدن
از دیشب دل و جیگر ماشین لباس شویی رو ریخته بیرون منم دل تو دلم نیست نکنه خرابترش کنه",0,0,0,https://x.com/_Mehraboonn/status/1465662383393689605,2021,11,2021-11-30
1462336588470538243,_mehrabooon,2021-11-21 10:26:26.248,"به علت تغییر رنگ مو آواتار عوض کردم
باشد که گمم نکنید",0,0,0,https://x.com/_Mehraboonn/status/1462336588470538243,2021,11,2021-11-21
1464605547362144260,_mehrabooon,2021-11-27 16:42:28.203,"غمگینم
همکارم عوض شده قبلی قدش بلند بود به هرچی دستم نمیرسید صداش میزدم
این جدیده قدش کوتاهه",0,0,0,https://x.com/_Mehraboonn/status/1464605547362144260,2021,11,2021-11-27
1463910317646393353,_mehrabooon,2021-11-25 18:39:52.522,"خب منکه تو خونم و دارم چندتا فیلم دانلود میکنم بشینم ببینم
هرکی هم رفته مهمونی فسق و فجور
دورهمی دوستانه کوفتش بشه",0,0,0,https://x.com/_Mehraboonn/status/1463910317646393353,2021,11,2021-11-25
1394491231275831296,_mehrabooon,2021-05-18 06:13:12.587,"و خداوند فالو کنندگان را دوست دارد
ای کسانی که ایمان آوردید فالو کنید تا بک بگیرید",0,0,0,https://x.com/_mehrabooon/status/1394491231275831296,2021,5,2021-05-18
1399623495454179328,_mehrabooon,2021-06-01 10:06:59.720,"جدیدا وقتی از خرید برمیگردم خونه و همسرجان میپرسه همه اینا چند شد؟!
میگم قیمت دایرکت 
چه خبره بابا دو وجب پارچه رو انقد گرون حساب میکنن

#گرونی",0,0,0,https://x.com/_mehrabooon/status/1399623495454179328,2021,6,2021-06-01
1462160623329026051,_mehrabooon,2021-11-20 22:47:12.889,"همه جارو بنفش کردم
کاسه مخصوص رنگ نداشتم مجبورشدم یه کاسه شیشه ای بردارم که نتیجش اینه که میبینید
یه وقت فکر نکنین من رنگارو از رو زمین برداشتم زدم به موهام",0,0,0,https://x.com/_Mehraboonn/status/1462160623329026051,2021,11,2021-11-20
1461731283256725514,_mehrabooon,2021-11-19 18:21:10.239,جمعه ی دلگیر پاییزی رو فقط این دلبرِ خوشمزه میتونه بشوره ببره,0,0,0,https://x.com/_Mehraboonn/status/1461731283256725514,2021,11,2021-11-19
1459934964758335497,_mehrabooon,2021-11-14 19:23:14.535,"کاش یه خواننده بیاد یه آهنگ جدید واسه تولد بخونه
حالم از این آهنگه happy birthday (باریتم بخون) داره بهم میخوره",0,0,0,https://x.com/_Mehraboonn/status/1459934964758335497,2021,11,2021-11-14
1460182337904431108,_mehrabooon,2021-11-15 11:46:12.889,"گِلس صفحه گوشیمو عوض کردم
چقد همتون خوشکلین لعنتیا",0,0,0,https://x.com/_Mehraboonn/status/1460182337904431108,2021,11,2021-11-15
1459122854511976454,_mehrabooon,2021-11-12 13:36:12.364,"به نظرم غیر طبیعیه که انقد تند تند داره به فالوئرام اضافه میشه
بهتون مشکوکم",0,0,0,https://x.com/_Mehraboonn/status/1459122854511976454,2021,11,2021-11-12
1456865993918144514,_mehrabooon,2021-11-06 08:08:14.868,"چقد هوای بعد بارون خوبه
چقد آسمون ابری دلبره
چقد بوی نم و رطوبت دلنشینه
چقد هوای سرد دلپذیره
اصلا چقد بغل کردن تو این هوا میچسبه
اصلا هوا هوای عاشقی کردنه",0,0,0,https://x.com/_Mehraboonn/status/1456865993918144514,2021,11,2021-11-06
1454368793963212801,_mehrabooon,2021-10-30 11:45:16.003,"اسیرشدیم به خدا تازه لباس تابستونیارو جمع کرده بودم
الان دوباره هوا گرم شده",0,0,0,https://x.com/_Mehraboonn/status/1454368793963212801,2021,10,2021-10-30
1454479733790584847,_mehrabooon,2021-10-30 19:06:06.119,تو محل کار پریود نشدین گند بزنین به لباسو صندلیتون که عاشقی یادتون بره,0,0,0,https://x.com/_Mehraboonn/status/1454479733790584847,2021,10,2021-10-30
1451519310816550921,_mehrabooon,2021-10-22 15:02:26.280,گفتم به جای جنگل و دریا یکم هم از دیدن کویر لذت ببرین,0,0,0,https://x.com/_Mehraboonn/status/1451519310816550921,2021,10,2021-10-22
1451553192752332821,_mehrabooon,2021-10-22 17:17:04.363,"ببخشین اینستا کردم اینجارو
دیدن کویر خالی از لطف نیست",0,0,0,https://x.com/_Mehraboonn/status/1451553192752332821,2021,10,2021-10-22
1448740326919786514,_mehrabooon,2021-10-14 22:59:44.888,"نمیدونم اسم این مریضی چیه
فیلم یا سریالی که همه دارن ازش تعریف میکنن و خیلی ازش خوششون میادو من دلم نمیخاد دانلود کنم ببینم",0,0,0,https://x.com/_Mehraboonn/status/1448740326919786514,2021,10,2021-10-14
1447487820910710784,_mehrabooon,2021-10-11 12:02:44.185,"آقایون و خانومایی که خرج یه خانواده باشماس از همینجا بهتون خسته نباشید میگم خدا قوت
امروز به جای همسرم خودم رفتم خرید واسه خونه و گرونی و تورم رو با هربار کارت کشیدن کامل حس کردم
#گرونی
#تورم",0,0,0,https://x.com/_Mehraboonn/status/1447487820910710784,2021,10,2021-10-11
1447206740093718534,_mehrabooon,2021-10-10 17:25:49.296,"الان آدما به دو دستن
1.اونایی که همچنان لباس تابستونی میپوشن و گرمشونه
2.اونایی که لباس پاییزه میپوشنو سردشونه",0,0,0,https://x.com/_Mehraboonn/status/1447206740093718534,2021,10,2021-10-10
1450171738432675841,_mehrabooon,2021-10-18 21:47:39.987,کاش شعورشون برسه اونی که تو عروسی باید لباس سفید بپوشه فقط عروسه، بهترین شب زندگیه یه آدمو خراب نکنین حسودا,0,0,0,https://x.com/elii_isf/status/1450171738432675841,2021,10,2021-10-18
1450182080218992644,_mehrabooon,2021-10-18 22:28:45.661,"یهو چِش وا کردیم
دیدیم دلمون واسش هُرری ریخت،
مثِ برگای پاییز...",0,0,0,https://x.com/reise_ghabile/status/1450182080218992644,2021,10,2021-10-18
1450192461062619136,_mehrabooon,2021-10-18 23:10:00.647,"وضعیت ما اینجوریه که طبق عادت هرسال الان بخاریمونو نصب کردیم
ولی همچنان کولر روشنه",0,0,0,https://x.com/_Mehraboonn/status/1450192461062619136,2021,10,2021-10-18
1446841661754126340,_mehrabooon,2021-10-09 17:15:07.837,"آقاااا پشماااام
همین الان جلوی چشم خودم یه پیرزن تقریبا 70 ساله به همکارم که یه پسر 20 ساله هست پیشنهاد داد که اگه میخای کارای پاسپورتتو درست کن با خودم میبرمت کانادا",0,0,0,https://x.com/_Mehraboonn/status/1446841661754126340,2021,10,2021-10-09
1446228898543456258,_mehrabooon,2021-10-08 00:40:13.703,"خیلی دلم میخاد توییت فاخر بزنم ولی فاخرم نمیاد
اصلا توییت دونم خراب شده ",0,0,0,https://x.com/_Mehraboonn/status/1446228898543456258,2021,10,2021-10-08
1443647732636336132,_mehrabooon,2021-09-30 21:43:35.795,"یکی از توانایی هایی که لازمه هر مادری داشته باشه
توانایی پاسخگویی ده هزار سوال در روز
خدا بهم صبر بده مغزم داره میترکه",0,0,0,https://x.com/_Mehraboonn/status/1443647732636336132,2021,9,2021-09-30
1442225440085643265,_mehrabooon,2021-09-26 23:31:54.826,"آواتارمو دیدین؟ 
یه نگاه به هدرم هم بندازین",0,0,0,https://x.com/_Mehraboonn/status/1442225440085643265,2021,9,2021-09-26
1440969419216273409,_mehrabooon,2021-09-23 12:20:56.115,اومدم بگم بعداز گذشت 4 سال بالاخره کارت ملیم اومد,0,0,0,https://x.com/_Mehraboonn/status/1440969419216273409,2021,9,2021-09-23
1439290730481164296,_mehrabooon,2021-09-18 21:10:25.532,"لطفا تا آخر بخونین

اگه ازدواج کردی،دوست دختر یا دوست پسر داری با همه خوبو بدش بپذیرش
به خاطر پوشش، اندام،رنگ پوست،قد و... تحقیرش نکن 
چه خانم هایی رو میبینم که به خاطر رنگ پوست بدنشون اعتماد به نفس ندارن تا رابطه برقرار کنن و یا واسه اینکه بهش گفتن چاقه حاضره هرکاری بکنه",0,0,0,https://x.com/_Mehraboonn/status/1439290730481164296,2021,9,2021-09-18
1437476638904758276,_mehrabooon,2021-09-13 21:01:52.396,بعداز ناپلئونی خوشمزه ترین خوراکی دنیا ایشووون هستن,0,0,0,https://x.com/_Mehraboonn/status/1437476638904758276,2021,9,2021-09-13
1437417740009099268,_mehrabooon,2021-09-13 17:07:49.805,"عصری داشتم سوار ماشین میشدم که برم سرکار آقای همسایه منو دیده میگه امروز خونمون روضه خوانی داریم تشریف بیارین
حالا جدای بحث کرونا
چی تو من دید که فکر کرد من  روضه میرم",0,0,0,https://x.com/_Mehraboonn/status/1437417740009099268,2021,9,2021-09-13
1435638298551128072,_mehrabooon,2021-09-08 19:16:57.901,"اگه شرایط مالی خوبی نداری بچه دار نشو
اگه شرایط مالی خوبی نداری بچه دار نشو
 اگه شرایط مالی خوبی نداری بچه دار نشو
اگه شرایط مالی خوبی نداری بچه دار نشو
اگه شرایط مالی خوبی نداری بچه دار نشو
اگه شرایط مالی خوبی نداری بچه دار نشو",0,0,0,https://x.com/_Mehraboonn/status/1435638298551128072,2021,9,2021-09-08
1434113200178466826,_mehrabooon,2021-09-04 14:16:46.114,"instagram.com/mehrabooon7010
…
بیاین اینستامو توییتری کنین
به همتون بک میدم",0,0,0,https://x.com/_Mehraboonn/status/1434113200178466826,2021,9,2021-09-04
1433886188683857936,_mehrabooon,2021-09-03 23:14:42.356,"منو همسرم اینجوریم که
تو خونه حرفی واسه گفتن نداریم
ولی وقتی میشینیم تو ماشین
اگه تا ته دنیاهم بریم
حرف واسه گفتن داریم",0,0,0,https://x.com/_Mehraboonn/status/1433886188683857936,2021,9,2021-09-03
1432968418337169418,_mehrabooon,2021-09-01 10:27:48.854,"دیروز نصف عمرم رفت
سرکار بودم مامانم زنگ زد که اِلنا تب داره حالش خوب نیست
اصلا نفهمیدم چجوری خودمو رسوندم خونه
تا ببرمش دکتر
اون لحظه حاضربودم من بمیرم ولی دخترم طوریش نباشه
مادر بودن به همون اندازه که شیرینو دلچسبه
سخت و طاقت فرساس",0,0,0,https://x.com/_Mehraboonn/status/1432968418337169418,2021,9,2021-09-01
1430952055892553736,_mehrabooon,2021-08-26 20:55:30.585,از جوابی که بهش دادم راضیم,0,0,0,https://x.com/_Mehraboonn/status/1430952055892553736,2021,8,2021-08-26
1430538920522043396,_mehrabooon,2021-08-25 17:33:51.437,"نه پیرسینگ دارم
نه تتو
 نه مژه و ناخن کاشت
نه رنگ موی فانتزی
این همه نچرال بودن داره اذیتم میکنه",0,0,0,https://x.com/_Mehraboonn/status/1430538920522043396,2021,8,2021-08-25
1428000743835983873,_mehrabooon,2021-08-18 17:28:02.958,حوصلم سر رفت,0,0,0,https://x.com/_Mehraboonn/status/1428000743835983873,2021,8,2021-08-18
1428727160601292808,_mehrabooon,2021-08-20 17:34:34.211,"تو این چندروز تعطیلی با چیزایی که من از مردم شهرم دیدم قطعا آمار کرونا 10 برابر میشه
و چندین خانواده داغدار عزیزانش
از ماست که بر ماست",0,0,0,https://x.com/_Mehraboonn/status/1428727160601292808,2021,8,2021-08-20
1429750922008276999,_mehrabooon,2021-08-23 13:22:37.951,"حس میکنم طلسم شدم
محاله لباس اتو کنم و یه جا از بدنمو نسوزونم
الانم دستم برای هزارمین بار سوخت",0,0,0,https://x.com/_Mehraboonn/status/1429750922008276999,2021,8,2021-08-23
1425450325259997193,_mehrabooon,2021-08-11 16:33:35.785,"اگه مثل من تا حالا کرونا نگرفتی منشن بذار
(ایمپرشنم داغونه)",0,0,0,https://x.com/_Mehraboonn/status/1425450325259997193,2021,8,2021-08-11
1423906007944679426,_mehrabooon,2021-08-07 10:17:01.845,"بازم صبح شنبه و درد سراش
پسره اومده داروخونه  گردنشو چسب زده بود
چسب باز کرد که واسه جای کبودی و زخمش دارو بگیره
پارتنرش یه ذره وحشی بوده زیادی گاز گرفته بود طفلی روش نمیشد بگه چی شده
این وحشی بازیا چیه در میارن آخه ",0,0,0,https://x.com/_Mehraboonn/status/1423906007944679426,2021,8,2021-08-07
1422550509802622977,_mehrabooon,2021-08-03 16:30:45.904,"گااو کیست؟؟
همسایه ی کم شعوری که یه جوری ماشینشو پارک میکنه که یه ساعت علاف بشی و دیرتر برسی به محل کارت",0,0,0,https://x.com/_Mehraboonn/status/1422550509802622977,2021,8,2021-08-03
1421469458984488963,_mehrabooon,2021-07-31 16:55:03.304,"تو اینستا یه پسریه ماهی یه بار میاد فالوم میکنه منم بک میدم دو روز بعد آنفالو میکنه منم آنفالوش میکنم 
نمیدونم اسم این بیماریش چیه ",0,0,0,https://x.com/_Mehraboonn/status/1421469458984488963,2021,7,2021-07-31
1419377839829360643,_mehrabooon,2021-07-25 22:23:42.437,"دو سه روزه هر اتفاقی که میوفته یه حس آشنایی دارم بهش احساس میکنم قبلا این اتفاق اقتاده و من تو اون موقعیت بودم
حسه ترسناکیه ",0,0,0,https://x.com/_Mehraboonn/status/1419377839829360643,2021,7,2021-07-25
1418784898391977986,_mehrabooon,2021-07-24 07:07:34.182,"الهی این شنبه از اون شنبه هایی باشه که همیشه منتظرش بودی
اول هفته تون پراز اتفاقای خوب",0,0,0,https://x.com/_Mehraboonn/status/1418784898391977986,2021,7,2021-07-24
1418816285924790272,_mehrabooon,2021-07-24 09:12:17.553,"روی صحبتم با اوناییه که تا فالو میکنن میان دایرکت سلام میدن
گلم اینجا که حرم امام رضا نیست میای سلام میدی
علیک سلاام",0,0,0,https://x.com/_Mehraboonn/status/1418816285924790272,2021,7,2021-07-24
1417883691620184067,_mehrabooon,2021-07-21 19:26:29.744,چون موهام دیگه مشکی نیست آواتارمو عوض کردم,0,0,0,https://x.com/_Mehraboonn/status/1417883691620184067,2021,7,2021-07-21
1417479190476165127,_mehrabooon,2021-07-20 16:39:09.156,"وسط این همه مشکلات و بحران بی آبی
پوشیدن مانتو چهارخونه ممنوع شد
زیبا نیست این همه تدبیر و آینده نگری
#خوزستان
#خوزستان_تشنه",0,0,0,https://x.com/_Mehraboonn/status/1417479190476165127,2021,7,2021-07-20
1416128597732036609,_mehrabooon,2021-07-16 23:12:22.753,"در این حد فالوئرهای با ایمانی دارم
وارد ناشناسم که میشم بو گلاب پخش میشه",0,0,0,https://x.com/_Mehraboonn/status/1416128597732036609,2021,7,2021-07-16
1415710296245776389,_mehrabooon,2021-07-15 19:30:11.907,"ترکیب شیر+انبه
یه جور وحشتناکی خوشمزس اصلا قابل توصیف نیست
مزه بهشت میده لعنتی",0,0,0,https://x.com/_Mehraboonn/status/1415710296245776389,2021,7,2021-07-15
1415347680679763969,_mehrabooon,2021-07-14 19:29:17.619,حیفم اومد از دیدن این همه زیبایی محرومتون کنم,0,0,0,https://x.com/_Mehraboonn/status/1415347680679763969,2021,7,2021-07-14
1414609736432066563,_mehrabooon,2021-07-12 18:36:58.000,"آقاهه تو محل کارم وایساده جلوم هی اشاره میکرد به موهام میگم منظورت چیه؟!
میگه موهات پیداس
باسکوت فقط نگاهش کردم
یه پیرمرد کنارش بود زد به شونش گفت بیخیال آقا حالا موهاشو بکنه تو مشکلی ازت حل میشه؟!
کوتاه نمیومد و اصرار داشت که کار من اشتباهه",0,0,0,https://x.com/_Mehraboonn/status/1414609736432066563,2021,7,2021-07-12
1412839496903761929,_mehrabooon,2021-07-07 21:22:40.007,"امروز عصر یه خانومی تو محل کارم منو واسه پسرش خاستگاری کرد
تا عکس شوهرمو دخترمو بهش نشون ندادم باور نکرد",0,0,0,https://x.com/_Mehraboonn/status/1412839496903761929,2021,7,2021-07-07
1412718674465767434,_mehrabooon,2021-07-07 13:22:33.693,"میدونین خوبیه ازدواج کردن چیه؟؟؟
یکی هست که اون قسمت از کمرت که دستت نمیرسه بخارونی رو با جون دل بخارونه",0,0,0,https://x.com/_Mehraboonn/status/1412718674465767434,2021,7,2021-07-07
