tweet_id,username,created_at,text,replies,retweets,likes,url
1981741185686290827,abdulwadudkha12,,"با یه دختر خانوم 
هیچ وقت کل کل نکنین",0,0,0,https://x.com/ramin_ramin_/status/1981741185686290827
1981770584616038420,abdulwadudkha12,,"د تحریک تالبان پاکستان والو د پاکستاني پوځیانو د درېشیو نرخونه لس لس روپۍ مقررې کړي دي.
ددوی دغه لوبه ولاکه تر هغې ومنم چې ترڅو هغه د ګاز نل لیکې سهي روانې وي.
ګاز زمونږ او استعمالوي یې دا نور.",0,0,0,https://x.com/sohailnoorkhan/status/1981770584616038420
1981429650858668329,abdulwadudkha12,,دوکه شولی خانیه,0,0,0,https://x.com/ajab_haqbeen/status/1981429650858668329
1981094834187505835,abdulwadudkha12,,"این ظلم را کسی فراموش نمی کند، 
امروز یا فردا مردم ایستاد شدنیست، 
به یاد داشته باشید؛ به خدا اگر مردم به چوچه سگ تان هم رحم کننده، به اندازه کافی برایتان نفرت کاشتید.",0,0,0,https://x.com/Matin_TKPK/status/1981094834187505835
1980898213172506695,abdulwadudkha12,,"کشتار در ملاء عام توسط حماس فلسطینی - و سکوت کر کننده از سوی «واعظان اخلاق».

صدایی از جانب سازمان‌های حقوق بشری شنیده‌اید؟ حامیان ""فلسطین"" به خیابان‌ها آمده‌اند؟

حماس باید برود.",0,0,0,https://x.com/IsraelPersian/status/1980898213172506695
1981087303217938528,abdulwadudkha12,,سخت می زړه درد وکړ.,0,0,0,https://x.com/AdiloAfghan/status/1981087303217938528
1978451829764526557,abdulwadudkha12,,"سالار ولایتمدار، عضو کمیسیون امنیت ملی مجلس، گفت: «ایران هیچ‌گاه اسرائیل را به رسمیت نشناخته و نخواهد شناخت و در اولین فرصت» برای حذف آن اقدام خواهد کرد.

او افزود:‌ «اگر رابطه با آمریکا به نفع منافع ملی ایران بود، جمهوری اسلامی در نشست شرم‌الشیخ شرکت می‌کرد.»

این نماینده مجلس",0,0,0,https://x.com/IranIntl/status/1978451829764526557
1978533799798399193,abdulwadudkha12,,"خوشال سادات:

افغانستان اوس مثبت تغیر کړی او پنجشیر کې هم اوس خلک آماده دي چې د افغانستان د ارضي تمامیت دفاع وکړي.",0,0,0,https://x.com/IslamYarZadran/status/1978533799798399193
1978929450705138095,abdulwadudkha12,,#تصویرنمایه‌جدید,0,0,0,https://x.com/Abdulwadudkha12/status/1978929450705138095
