tweet_id,username,created_at,text,replies,retweets,likes,url,year,month,date
1990124493717574090,aliiorgi,2025-11-16T20:27:08.000Z,Bu,0,0,0,https://x.com/aliiorgi/status/1990124493717574090,2025,11,2025-11-16
2022104326127464920,aliiorgi,2026-02-13T02:23:34.000Z,"تا وقتی که هنوز مردمانی وجود دارند که به خزعبلات این حرامی و اَمثال این گوش می‌دن و باورشون می‌شه، چرا نباید بهشون حکومت کرد؟
چرا نباید جیبشون رو خالی کرد؟
چرا نباید از جهلشون لذت برد؟
چرا نباید تمام زندگیشون رو قاپید و چاپید؟
ارزشی جماعت الحق که لیاقتت همینه.",0,0,0,https://x.com/Shelby_UTD/status/2022104326127464920,2026,2,2026-02-13
2022296791811551607,aliiorgi,2026-02-13T15:08:22.000Z,"مهدی یراحی از اون دسته آدمهای معروفه که همیشه می‌دونسته طرف درست برای ایستادن کدوم طرفه. همیشه حرفش رو درست زده و پای حرفش هم بوده. 
دمش گرم با اون آهنگهای قشنگش.",0,0,0,https://x.com/abol_mashaghel/status/2022296791811551607,2026,2,2026-02-13
2021920011133366497,aliiorgi,2026-02-12T14:11:10.000Z,متاسفانه این کاربر به جایی رسیده که نیازی نمیبینه کسی سراغش رو بگیره، براش ناراحت یا خوشحال بشه، درکش کنه یا اهمیت بده یا حتی بشناستش.,0,0,0,https://x.com/mhrnbt1/status/2021920011133366497,2026,2,2026-02-12
2022178705574179029,aliiorgi,2026-02-13T07:19:08.000Z,"تو تا ۲۴سالگی فکر میکنی خوش قلبی؛
درنهایت میفهمی اسکلی.",0,0,0,https://x.com/parniavatankhah/status/2022178705574179029,2026,2,2026-02-13
2022015087738015874,aliiorgi,2026-02-12T20:28:58.000Z,"Valentine's 2016: single
Valentine's 2017: single
Valentine's 2018: single
Valentine's 2019: single
Valentine's 2020: single
Valentine's 2021: single
Valentine's 2022: single
Valentine's 2023: single
Valentine's 2024: single
Valentine's 2025: single
Valentine's 2026: single",0,0,0,https://x.com/litteralyme0/status/2022015087738015874,2026,2,2026-02-12
2021928883910848739,aliiorgi,2026-02-12T14:46:26.000Z,درد و نفرین,0,0,0,https://x.com/aliiorgi/status/2021928883910848739,2026,2,2026-02-12
2021859624014819617,aliiorgi,2026-02-12T10:11:13.000Z,حالا باشکوه تر از گذشته برو راهپیمایی ۲۲ بهمن,0,0,0,https://x.com/babak_ariayi/status/2021859624014819617,2026,2,2026-02-12
2021683294115705241,aliiorgi,2026-02-11T22:30:33.000Z,اگه حتی یک درصد هم در مورد آیسان اسلامی شک کردید این ویدئو رو ببینید ! ایران آزاد برای ریشه کن شدن این عقاید فاسد هستن نه اینکه خایه مالی شون رو کنید.,0,0,0,https://x.com/DragonArrives/status/2021683294115705241,2026,2,2026-02-11
2021497991824277527,aliiorgi,2026-02-11T10:14:13.000Z,۲۲ بهمنتون تموم شد؟ افرین حالا برگردید به زندگی سگی و کیری و پر از توهمتون عقب مونده ها.,0,0,0,https://x.com/Begooeren/status/2021497991824277527,2026,2,2026-02-11
2021563993748324696,aliiorgi,2026-02-11T14:36:29.000Z,خبر موثق دارم فامیلمون تو پنتاگون کار میکنه میگه امشب میزنن,0,0,0,https://x.com/aliiorgi/status/2021563993748324696,2026,2,2026-02-11
2021257882415587838,aliiorgi,2026-02-10T18:20:06.000Z,"کالابرگ واقعاً عالی عمل کرده 
پوشاک حذف شده 
تفریح حذف شده 
سفر حذف شده 
کبابی و ساندویچی و جگرکی حذف شده 
هله هوله حذف شده 
گوشت و مرغ و برنج و حتی ماست داره حذف میشه 
تنها چیزی که حذف نشد رانت و رانت خواریه 
خلاصه خدا ریشه تونو بخشکونه که ریشه‌مونو خشکوندید",0,0,0,https://x.com/javana97/status/2021257882415587838,2026,2,2026-02-10
2021218300898824486,aliiorgi,2026-02-10T15:42:50.000Z,,0,0,0,https://x.com/itswords_/status/2021218300898824486,2026,2,2026-02-10
2021245469276455251,aliiorgi,2026-02-10T17:30:47.000Z,بمیرم برات ایرانی که میگی با عکس ترامپ میم درست نکن بهمون کمک نمیکنه. بمیرم برات.,0,0,0,https://x.com/theonlyl4m4/status/2021245469276455251,2026,2,2026-02-10
2021265788645077001,aliiorgi,2026-02-10T18:51:31.000Z,"شاخص پیتزا اطراف پنتاگون
فلایت رادار 
ترور آلارم
کانال 13 
آرش آنال‌لیز
سایت polymarlet 
ژنرال بازنشسته
منبع موثق

بریم واسه تحلیل",0,0,0,https://x.com/DragonArrives/status/2021265788645077001,2026,2,2026-02-10
2021211974873284991,aliiorgi,2026-02-10T15:17:41.000Z,خبر بد برای سرور بازی پرسیتی,0,0,0,https://x.com/aliiorgi/status/2021211974873284991,2026,2,2026-02-10
2020815540512551220,aliiorgi,2026-02-09T13:02:24.000Z,بین این خاله زنک بازی‌های سیاسی، این عمر ما بود ک مفت به باد رفت.,0,0,0,https://x.com/_helliahy/status/2020815540512551220,2026,2,2026-02-09
2020910884819009839,aliiorgi,2026-02-09T19:21:16.000Z,"قانون حجاب اجباری در ۱۸ مرداد ۱۳۶۲ تصویب شد!
جنگ شهریور ۱۳۵۹ شروع شد،
سوال اینجاس اگه شهدا برای حفظ حجاب به جنگ رفتن پس اون سه سال اول رو واسه چی میجنگیدن؟؟
اینقدر از خون شهدا برای افکار پوسیده خودتون مایه نزارید.",0,0,0,https://x.com/yasamin6655/status/2020910884819009839,2026,2,2026-02-09
2020951515171783016,aliiorgi,2026-02-09T22:02:43.000Z,"من چه گوه شانسیم که ۲۰ سالگیم افتاد وسط بی پول ترین و بدبخت ترین دوران این کشور
حداقل آدمای بزرگتر از من خوشیاشونو کردن الان اذیت میشن (که حق هیچکس نیست)
من هیچ خوشی نداشتم
هیچکاری نکردم
هیچ مسافرت خاصی هم نرفتم
و تازه اول زندگیمه
همه چیز برام شد آرزو
همه چی.",0,0,0,https://x.com/CherryLadyLove/status/2020951515171783016,2026,2,2026-02-09
2020783083633385753,aliiorgi,2026-02-09T10:53:26.000Z,"تا یکی رو به اسم قشنگ سیو میکنی، گند میزنه!
تا یکی رو تو دلت از بقیه جدا میکنی، گند میزنه!
تا یکی رو از خط قرمزات عبور میدی، گند میزنه!
تا یکی رو ....",0,0,0,https://x.com/atisha61/status/2020783083633385753,2026,2,2026-02-09
2020205872203616568,aliiorgi,2026-02-07T20:39:48.000Z,"جدی یه پیتزا داره میشه هدف
پول جمع کنیم بریم پیتزا بخوریم
باید براش برنامه بچینی
دیگه نمیشه رندوم رفت بیرون یه چیزی خورد
دیگه نمیشه راحت رفت بیرون",0,0,0,https://x.com/CherryLadyLove/status/2020205872203616568,2026,2,2026-02-07
2020248129455431992,aliiorgi,2026-02-07T23:27:43.000Z,خوشبحال آدمای که بغل دارن,0,0,0,https://x.com/FRFRE__/status/2020248129455431992,2026,2,2026-02-07
2020364204771868860,aliiorgi,2026-02-08T07:08:57.000Z,"اخوند حالا حالا ها نمیره
ترامپ نمیزنه، اگه بزنه ام بازم اخوند نمیره چون به قصد از بین بردن اخوند نمیزنه
ما تا ابد بدبختیم",0,0,0,https://x.com/ripgrunger/status/2020364204771868860,2026,2,2026-02-08
2020081388159136163,aliiorgi,2026-02-07T12:25:08.000Z,اینایی که هنوز به ترامپ اعتقاد دارن کم کم دارن شبیه شیعه های منتظر فرج میشن,0,0,0,https://x.com/amiiirhosseein/status/2020081388159136163,2026,2,2026-02-07
2020089964755841383,aliiorgi,2026-02-07T12:59:13.000Z,"میدونی شهید همت که چهارصد تا توییت راجبش زدی راجب جنازه عراقیا چی گفته دیگه؟

شما ننگین بر اسم شهدای جنگ 
ننگین 
اگه زنده بودن ننه باباتونو کتلت میکردن 
نه شما که جوونای دسته گل مردمو که پر پر کردید بعد  مسخره کنید 
x.com/ahdeparvaz/sta
…",0,0,0,https://x.com/mamadkimia/status/2020089964755841383,2026,2,2026-02-07
2020036835557147101,aliiorgi,2026-02-07T09:28:06.000Z,"هرکسی این شخص رو باور داره مادرجندس 
اقای وحید شمسایی کص مادرتون ",0,0,0,https://x.com/0013ir/status/2020036835557147101,2026,2,2026-02-07
2019440622164160979,aliiorgi,2026-02-05T17:58:58.000Z,"آهان راستی
من ریدم دهن اونی که آهنگ «ما شرقی شادیم» رو خوند.",0,0,0,https://x.com/r0f0ell/status/2019440622164160979,2026,2,2026-02-05
2019787587687215305,aliiorgi,2026-02-06T16:57:41.000Z,مادرجنده مگه اتوبوس آوردم میخوای ده نفرو سوار ماشین کنی؟,0,0,0,https://x.com/aliiorgi/status/2019787587687215305,2026,2,2026-02-06
2019770955694739956,aliiorgi,2026-02-06T15:51:36.000Z,دلتونو به کله زرد خوش نکنین,0,0,0,https://x.com/aliiorgi/status/2019770955694739956,2026,2,2026-02-06
2019764639542710572,aliiorgi,2026-02-06T15:26:30.000Z,"کیرتونو بکنین تو چنلای تلگرامی
 اخبارای سیاسی رو از سایت واشنگتن پست و رسانه های آمریکایی از سایتشون بخونین بهتره",0,0,0,https://x.com/aliiorgi/status/2019764639542710572,2026,2,2026-02-06
2018957824894644314,aliiorgi,2026-02-04T10:00:30.000Z,"کل عمرمون دنبال کانفیگ گذشت
کل عمرمون با مذاکره هسته ای گذشت
کل عمرمون بدبختی و جنگ گذشت
‌کل عمرمون با ... گذشت",0,0,0,https://x.com/aliiorgi/status/2018957824894644314,2026,2,2026-02-04
2018266662190153845,aliiorgi,2026-02-02T12:14:04.000Z,"یادتونه گفتم خارج‌نشینا بعد از آخوند تا ده سال ممنوع الورود بشن؟
اشتباه کردم، بکنیدش ۴۰ سال یا حتی ۱۰۰.",0,0,0,https://x.com/LifetimeOfDoubt/status/2018266662190153845,2026,2,2026-02-02
2018270498606448788,aliiorgi,2026-02-02T12:29:19.000Z,"یه چیزی بگم خیالتون رو راحت کنم 
ترامپ خوارکصته دنبال تسلیم جمهوری اسلامیه حالا یا با مذاکره یا با جنگ شرط های هم که گذاشته مشخصه و همتون هم میدونید ما مردم ایران به تخمش هم‌ نیستیم اون گزینه اول و آخرش مامعله با آخوندها هست اینقدر دنبال ناجی و کشورهای خارجی نباشید",0,0,0,https://x.com/babak_ariayi/status/2018270498606448788,2026,2,2026-02-02
2018076473404301313,aliiorgi,2026-02-01T23:38:19.000Z,"سواد نمیخواد یه سری بحثا شرف میخواد که تو نداری
شعور هم نمیخواد ولی تو شعورت در حد کص هدیه تهرانیه
حداقل تو این وضعیت کشور و کسایی ک جونشونو دادن دغدغم کص هدیه تهرانی نیس و جنده ایمپرشن نیستم
@iamqazzal",0,0,0,https://x.com/fatiiology/status/2018076473404301313,2026,2,2026-02-01
2017926503976095824,aliiorgi,2026-02-01T13:42:24.000Z,"چگونه نظامی‌نویس شویم:
۱- سایت 
flightradar24.com را باز میکنیم.
۲- روی هواپیماها کلیک میکنیم.
۳- مدل هواپیماها رو گوگل میکنیم.
۴- در مورد ورود یا خروج آنها می‌نویسیم.
۵- هزینه اشتراک تیک آبی را واریز میکنیم.
۶- پیش‌بینی‌های احمقانه میکنیم.
تبریک. شما نظامی‌نویس شدید.",0,0,0,https://x.com/YouTdii/status/2017926503976095824,2026,2,2026-02-01
2016586456001552801,aliiorgi,2026-01-28T20:57:32.000Z,موندم اگر کانال عبری 12 و 13 نبود ادمینای تلگرام خبر از کجا میخواستن بیارن,0,0,0,https://x.com/aliiorgi/status/2016586456001552801,2026,1,2026-01-28
2016079086796337287,aliiorgi,2026-01-27T11:21:25.000Z,وزارت ارتباط یه جوری از ضررمالی روزانه قطع اینترنت شاکیه انگار من قطعش کردم!,0,0,0,https://x.com/kharabatii/status/2016079086796337287,2026,1,2026-01-27
2016118799439691990,aliiorgi,2026-01-27T13:59:14.000Z,"کلی جوون پرپر شد، دلار ۱۵۰ تومن شد، طلا ۱۷ میلیون شد و امید به زندگیمون به صفر رسید
دیگه واقعا وقتشه شیر گاز باز کنیم و بریم بگیریم بخوابیم.",0,0,0,https://x.com/imaedeee/status/2016118799439691990,2026,1,2026-01-27
2016120671575613895,aliiorgi,2026-01-27T14:06:40.000Z,"«چه جوانانی، اسماعيل، می‌بينی؟
چه جوانانی؛
بسياری‌شان هنوز صورت عشق را بر سينه نفشرده‌اند.»‌

- رضا براهنی.",0,0,0,https://x.com/monadchannel/status/2016120671575613895,2026,1,2026-01-27
2016087057106616397,aliiorgi,2026-01-27T11:53:06.000Z,"خیلیها منتظرن، ترامپ بزنه و براندازی بشه و پهلوی بیاد.
جدی فکر میکنین “اگه” ترامپ این‌بار جدی بزنه و ول نکنه، بجای یک بخشی از بدنه حکومت، از پهلوی حمایت میکنه؟
چرا من اصلا همچین سناریویی رو شدنی نمیبینم؟
اگه بزنه واسه دل ما که نمیزنه!",0,0,0,https://x.com/1vavekhandan/status/2016087057106616397,2026,1,2026-01-27
2016189408660042065,aliiorgi,2026-01-27T18:39:48.000Z,در صورتی ک شما میتونین به آنلاین شاپ ها گیر بدید خودتون تو این یک ماه سرکار نرفته باشی و پولی در نیاورده باشی.,0,0,0,https://x.com/aliiorgi/status/2016189408660042065,2026,1,2026-01-27
2015833500914688068,aliiorgi,2026-01-26T19:05:33.000Z,هموطن خارج‌نشین! به جای تهدید آنلاین‌شاپ‌های ایرانی و گوه خوردن از خارج، خودت رو با اولین پرواز برسون تهران و مبارزه کن.,0,0,0,https://x.com/BKhanjarian/status/2015833500914688068,2026,1,2026-01-26
2015749642110017744,aliiorgi,2026-01-26T13:32:20.000Z,ازت انتظار نداشتم,0,0,0,https://x.com/aliiorgi/status/2015749642110017744,2026,1,2026-01-26
2015473714507202703,aliiorgi,2026-01-25T19:15:53.000Z,"ایران‌اینترنشنال رو که باز میکنی، فکر میکنی تو ایران انقلاب شده، پهلوی هم شاه شده فقط کارای اداریش مونده
@IranIntl",0,0,0,https://x.com/volghan/status/2015473714507202703,2026,1,2026-01-25
2015561587302560171,aliiorgi,2026-01-26T01:05:04.000Z,امشب نمیزنن بگیرید بخوابید,0,0,0,https://x.com/aliiorgi/status/2015561587302560171,2026,1,2026-01-26
2015487592741900301,aliiorgi,2026-01-25T20:11:02.000Z,"از حرفم بد برداشت نکنید ولی توروخدا چهارصد و یکی بازی رو شروع نکنید. 
x.com/abtin86_/statu
…",0,0,0,https://x.com/mk_eliya/status/2015487592741900301,2026,1,2026-01-25
2015145689026527620,aliiorgi,2026-01-24T21:32:26.000Z,ما یک پایان بی‌آخوند میخواستیم، اما متاسفانه یک‌ آخوند بی‌پایان نصیبمون شد.,0,0,0,https://x.com/isnrjs/status/2015145689026527620,2026,1,2026-01-24
2013667083909743018,aliiorgi,2026-01-20T19:36:59.000Z,"با غم آن‌هایی که برای ما جان دادند،
چه باید کرد؟",0,0,0,https://x.com/TakMesra/status/2013667083909743018,2026,1,2026-01-20
2015107840281645061,aliiorgi,2026-01-24T19:02:02.000Z,فک کن یه وزارتخونه ساختن به اسم ارتباطات، وظیفه اصلیش قطع ارتباطاته,0,0,0,https://x.com/SeyMon10/status/2015107840281645061,2026,1,2026-01-24
2008285488981946418,aliiorgi,2026-01-05T23:12:27.000Z,"من اینجا ریشه در خاک دارم
من اینجا تا نفس باقیس می مانم
مردمو ایرانو با هیچی عوض نمی کنم",0,0,0,https://x.com/Aliidaeii/status/2008285488981946418,2026,1,2026-01-05
2015093362659828051,aliiorgi,2026-01-24T18:04:30.000Z,تنها آینده نزدیکی که برای خودم میبینم مرگه، این چه غمی بود که گرفتارش شدیم,0,0,0,https://x.com/fateme__so1/status/2015093362659828051,2026,1,2026-01-24
2015342562526081337,aliiorgi,2026-01-25T10:34:44.000Z,چقدر نفهمن بعضیا واسه این جماعت اخوند به کون منشن نذارید، بلاک کنید بره. باهاشون کل کل میکنید که چی؟ اینا بزرگ ترین دارایی انسان که اسمش (مغز) رو ندارن.,0,0,0,https://x.com/selenophail/status/2015342562526081337,2026,1,2026-01-25
2015367412183392547,aliiorgi,2026-01-25T12:13:29.000Z,"قطع کردن اینترنت کار یک ثانیست
وصل شدن اینترنت نیازمند زمان داره
چطوری میتونین یک ثانیه دوشاخه اینترنت رو بکشید ولی موقع وصل کردن امروز و فردا میکنید؟",0,0,0,https://x.com/aliiorgi/status/2015367412183392547,2026,1,2026-01-25
2015171193469562934,aliiorgi,2026-01-24T23:13:47.000Z,"سپهر بابا کجایی..‌
لعنت ب اول و آخرت تون.",0,0,0,https://x.com/aliiorgi/status/2015171193469562934,2026,1,2026-01-24
2014828441258926372,aliiorgi,2026-01-24T00:31:48.000Z,"همش میگفتن شاه مردم رو کشته زندانی کرده شکنجه کرده درحالی که حقیقت یکچی دیگه بود
 ولی الان خودشون تو یک هفته بیست هزارنفر کشتن
بعد توییت میزنن باز ما بردیم باز ما بردیم
واقعا زاده شده از واژن خوک هستید",0,0,0,https://x.com/ldv7l/status/2014828441258926372,2026,1,2026-01-24
2014377346757730711,aliiorgi,2026-01-22T18:39:19.000Z,"یک انسان باشرف و با وجدان هیچ فرقی بین صدا و سیمای امروز و اینترنشنال قائل نیست!

+هر دو بوی خون میدن
+هر دو دروغ میگن",0,0,0,https://x.com/shahin110ds/status/2014377346757730711,2026,1,2026-01-22
2014589218019017195,aliiorgi,2026-01-23T08:41:13.000Z,"از من دوری کنید چون مطلقا تفاوتی بین پهلوی و آخوند نمی‌بینم. 
x.com/Sashtyani/stat
…",0,0,0,https://x.com/Radioferferi/status/2014589218019017195,2026,1,2026-01-23
2013393205996167210,aliiorgi,2026-01-20T01:28:42.000Z,بختت ایرانی بختت,0,0,0,https://x.com/aliiorgi/status/2013393205996167210,2026,1,2026-01-20
2012328703460577655,aliiorgi,2026-01-17T02:58:44.000Z,آقا بعد 9 روز سلام,0,0,0,https://x.com/aliiorgi/status/2012328703460577655,2026,1,2026-01-17
2008457555454959838,aliiorgi,2026-01-06T10:36:11.000Z,همیشه آرزو داشتم یه ماشین میلیاردی زیر پام باشه خداروشکر دستشون درد نکنه ماشین زیر پام شد یک میلیارد,0,0,0,https://x.com/aliiorgi/status/2008457555454959838,2026,1,2026-01-06
2008424808048885945,aliiorgi,2026-01-06T08:26:03.000Z,اگر امشب خبری نبود قطعا فرداشب خبریه,0,0,0,https://x.com/aliiorgi/status/2008424808048885945,2026,1,2026-01-06
2006627020411908584,aliiorgi,2026-01-01T09:22:17.000Z,کاش یکم تخم داشتی میموندی اشکان. از اونور دنیا بچه های مردمو دعوت به مرگ نمیکردی.,0,0,0,https://x.com/Im_nadia__/status/2006627020411908584,2026,1,2026-01-01
2006684706629111871,aliiorgi,2026-01-01T13:11:31.000Z,حقا که تماشای اینترنشنال زوال عقل می‍اره.,0,0,0,https://x.com/Baharebahhar/status/2006684706629111871,2026,1,2026-01-01
2006698862967206162,aliiorgi,2026-01-01T14:07:46.000Z,کاش دسترسی به هوش مصنوعی رو از ایرانیا بگیرن,0,0,0,https://x.com/aliiorgi/status/2006698862967206162,2026,1,2026-01-01
2005651572571947334,aliiorgi,2025-12-29T16:46:12.000Z,"میدونم از این نظرم خوشتون ‌نمیاد ولی معتقدم که : 

دیدن ایرانِ آزادِ آبادِ امن به عمر ما قد نمیده.",0,0,0,https://x.com/shakhe_nabatam/status/2005651572571947334,2025,12,2025-12-29
2005219307375177777,aliiorgi,2025-12-28T12:08:32.000Z,"براتون سواله چرا قیمت رم افزایشی شده؟
دلیلش:",0,0,0,https://x.com/aliiorgi/status/2005219307375177777,2025,12,2025-12-28
2005218872790749456,aliiorgi,2025-12-28T12:06:49.000Z,"دلار و طلا انگار محسن لرستانی پلی کردن
#دلار",0,0,0,https://x.com/aliiorgi/status/2005218872790749456,2025,12,2025-12-28
2004551894199640079,aliiorgi,2025-12-26T15:56:29.000Z,لنج و غروب جمعه,0,0,0,https://x.com/aliiorgi/status/2004551894199640079,2025,12,2025-12-26
2004293937369174260,aliiorgi,2025-12-25T22:51:27.000Z,همینا اگه نوروز بشه میگن بوی عید نمیاد,0,0,0,https://x.com/neggneg/status/2004293937369174260,2025,12,2025-12-25
2004254501675717061,aliiorgi,2025-12-25T20:14:45.000Z,فرار,0,0,0,https://x.com/sabatrm/status/2004254501675717061,2025,12,2025-12-25
2004245588427395221,aliiorgi,2025-12-25T19:39:20.000Z,"چیزی برای توییت کردن ب ذهنم نمیاد
پس سلام",0,0,0,https://x.com/aliiorgi/status/2004245588427395221,2025,12,2025-12-25
2003772338580668473,aliiorgi,2025-12-24T12:18:48.000Z,هیچی گفتم جا نمونم,0,0,0,https://x.com/aliiorgi/status/2003772338580668473,2025,12,2025-12-24
2003475001425691028,aliiorgi,2025-12-23T16:37:17.000Z,برای شروع رپ پایان خوبی بود.,0,0,0,https://x.com/aliiorgi/status/2003475001425691028,2025,12,2025-12-23
2003172818100290020,aliiorgi,2025-12-22T20:36:31.000Z,آدم آبی باشه ولی بلو نباشه,0,0,0,https://x.com/aliiorgi/status/2003172818100290020,2025,12,2025-12-22
2003155007710069190,aliiorgi,2025-12-22T19:25:45.000Z,"ما از خسیسی دراومدیم
غافل از اینکه همه خسیس شدن",0,0,0,https://x.com/aliiorgi/status/2003155007710069190,2025,12,2025-12-22
2002790586819232061,aliiorgi,2025-12-21T19:17:40.000Z,من تو تموم مناسبت های زندگیم تنها بودم.,0,0,0,https://x.com/rsh7nd/status/2002790586819232061,2025,12,2025-12-21
2002839206897631575,aliiorgi,2025-12-21T22:30:52.000Z,"امشب  همینجوریشم برام عجیب و سنگین بود
ولی اینکه یلدا هم بود 
و تو تنهایی و تلخی گذشت عجیب ترش کرد…",0,0,0,https://x.com/kiki__miki/status/2002839206897631575,2025,12,2025-12-21
2002839870843273617,aliiorgi,2025-12-21T22:33:30.000Z,خب رسما و شرعا وارد زمستون شدیم,0,0,0,https://x.com/aliiorgi/status/2002839870843273617,2025,12,2025-12-21
2002770936374890635,aliiorgi,2025-12-21T17:59:35.000Z,یلداتون مبارک,0,0,0,https://x.com/aliiorgi/status/2002770936374890635,2025,12,2025-12-21
2002744428918890788,aliiorgi,2025-12-21T16:14:15.000Z,"یه چیز میگم نخندین
لباس تهرانی",0,0,0,https://x.com/aliiorgi/status/2002744428918890788,2025,12,2025-12-21
2001693554486194203,aliiorgi,2025-12-18T18:38:27.000Z,بوشهر در یک روز ابری و بارونی.,0,0,0,https://x.com/aliiorgi/status/2001693554486194203,2025,12,2025-12-18
2000659948263628987,aliiorgi,2025-12-15T22:11:16.000Z,"تنهایی زندگی کردن خیلی قشنگه.
اما اینکه هر بار شب میرسم درو باز میکنم خونه تاریکه غمگینم میکنه. اینکه هیچ صدایی تو خونه نیست غمگینم میکنه. تنها غذا خوردن غمگینم میکنه. اینکه کسی نیست که بپرسم چایی میخوری هم غمگینم میکنه.",0,0,0,https://x.com/rroommiinnaaaaa/status/2000659948263628987,2025,12,2025-12-15
2000872047795224966,aliiorgi,2025-12-16T12:14:05.000Z,آخرای پاییز باشه بارونی باشه چاووشی آهنگ جدید بده انصافا به به,0,0,0,https://x.com/aliiorgi/status/2000872047795224966,2025,12,2025-12-16
2000491304854155546,aliiorgi,2025-12-15T11:01:09.000Z,شما رو نمیدونم ولی من نیاز دارم که حافظم پاک بشه و دوباره شهرزاد ببینم.,0,0,0,https://x.com/aliiorgi/status/2000491304854155546,2025,12,2025-12-15
2000322811106308325,aliiorgi,2025-12-14T23:51:37.000Z,"نه حرفی نه دوستی نه رفیقی 
واقعا تنهایی جالب نیست",0,0,0,https://x.com/aliiorgi/status/2000322811106308325,2025,12,2025-12-14
2000299866061451540,aliiorgi,2025-12-14T22:20:26.000Z,دلار 130 و دیگر هیچ...,0,0,0,https://x.com/aliiorgi/status/2000299866061451540,2025,12,2025-12-14
1999934484435849528,aliiorgi,2025-12-13T22:08:32.000Z,"از حرف‌های سطحی متنفرم.
اگه می‌خوای حرف بزنی، یه چیزی از دوران کودکی سیاهت بگو.",0,0,0,https://x.com/farin0s/status/1999934484435849528,2025,12,2025-12-13
1999932998893085060,aliiorgi,2025-12-13T22:02:38.000Z,راننده اسنپ اکوپلاسم تو چی؟(تصویر باز شه),0,0,0,https://x.com/aliiorgi/status/1999932998893085060,2025,12,2025-12-13
1999764695138685422,aliiorgi,2025-12-13T10:53:51.000Z,"پیشنهادتون با این واریز بانکی چیه
چیکار کنم؟",0,0,0,https://x.com/aliiorgi/status/1999764695138685422,2025,12,2025-12-13
