tweet_id,username,created_at,text,replies,retweets,likes,url
1933945180236689566,amalsaad_lb,2025-06-14 17:50:36.589000+00:00,"Iran today is not merely defending its “regime” or nuclear program. It is fighting for its survival as a state. It now faces a full-throttled, US- Israeli assault targeting its military, political, and civilian infrastructure. This war is the culmination of a decades-long",0,0,0,https://x.com/amalsaad_lb/status/1933945180236689566
2022888227875754134,amalsaad_lb,2026-02-15 04:18:31.628000+00:00,First they steal your history. Then they erase it.,0,0,0,https://x.com/AlanRMacLeod/status/2022888227875754134
2022877849300988392,amalsaad_lb,2026-02-15 03:37:17.183000+00:00,"This is insane.

US Secretary of State Marco Rubio just gave one of the most explicitly pro-colonialist speeches I have seen in the 21st century.

The US empire wants Europe to help it recolonize the Global South.

Rubio praised Western colonialists for ""settl[ing] new",0,0,0,https://x.com/BenjaminNorton/status/2022877849300988392
2022301131909546364,amalsaad_lb,2026-02-13 13:25:37.042000+00:00,"If the 
@Keir_Starmer
 regime were doing “Israel’s” bidding out of mere cowardice and craven opportunism, they’d use this court ruling to climb off the tree and say “it didn’t go our way, but the law’s the law” and move on. But 
@ShabanaMahmood
’s response reveals that this regime’s",0,0,0,https://x.com/AliAbunimah/status/2022301131909546364
2022251656256106746,amalsaad_lb,2026-02-13 10:09:01.127000+00:00,"BREAKING: WE WON.

The High Court ruled the Palestine Action ban is unlawful as it is disproportionate to free speech and the Home Secretary breached her own policy.

The court ordered the ban be quashed. Details of lifting the ban will be decided and completed at a later date.",0,0,0,https://x.com/HudaAmmori/status/2022251656256106746
2022253644234506277,amalsaad_lb,2026-02-13 10:16:55.098000+00:00,"BREAKING: High Court rules Palestine Action ban unlawful: a disproportionate effect on free speech. 

My understanding is that the ban will remain in place for the time being until details of how it can be lifted are agreed. 

Full report later today after I’ve read the ruling.",0,0,0,https://x.com/AsaWinstanley/status/2022253644234506277
2021951611036459405,amalsaad_lb,2026-02-12 14:16:44.772000+00:00,"WhatsApp: ""this evil government wants to ban our private and secure service!""

Also WhatsApp: ""Hello, Israel, here is the location of this journalist and his family so you can murder them all""",0,0,0,https://x.com/TheGreeneBJ/status/2021951611036459405
2021362171758903805,amalsaad_lb,2026-02-10 23:14:31.497000+00:00,Everyone in Gaza is extremely worried about this . Yet hardly anyone here is talking about it.,0,0,0,https://x.com/el_sabawi/status/2021362171758903805
2021447731945082991,amalsaad_lb,2026-02-11 04:54:30.635000+00:00,Generation after generation of this region’s indigenous people have suffered and died due to the evils of colonialism and Zionism brought and sustained by Euro-American imperialism.,0,0,0,https://x.com/AliAbunimah/status/2021447731945082991
2021552585941889464,amalsaad_lb,2026-02-11 11:51:09.776000+00:00,"To understand how monstrous the US blockade on Cuba is, think about the endgame.  What are they trying to achieve?  

The goal is clearly to starve people to the point where they are too weak to resist an invasion, or so desperate they are willing to accept US control.  

To get",0,0,0,https://x.com/jasonhickel/status/2021552585941889464
2021553288475500754,amalsaad_lb,2026-02-11 11:53:57.273000+00:00,Remember when we all got mad that Israel was imposing a starvation blockade on Gaza? The US is doing the SAME THING to Cuba and hardly anyone is talking about it.,0,0,0,https://x.com/cem_uk_/status/2021553288475500754
2021234313698721797,amalsaad_lb,2026-02-10 14:46:27.760000+00:00,No words. Complete failure of humanity.,0,0,0,https://x.com/AbubakerAbedW/status/2021234313698721797
2020997147492057467,amalsaad_lb,2026-02-09 23:04:02.930000+00:00,"“Cuban President Miguel Diaz-Canel said the island nation would ramp up solar generation and use renewable resources to ensure electricity for vital services, including hospitals, elderly care centres and isolated regions. Cuba produces about 1,000 megawatts, or 38 percent of its",0,0,0,https://x.com/agent_of_change/status/2020997147492057467
2020964884377194912,amalsaad_lb,2026-02-09 20:55:50.804000+00:00,The Labour government has arrested people and have tried to charge them as terrorists for saying what Wes Streeting is saying here.,0,0,0,https://x.com/TrilbeeReviews/status/2020964884377194912
2020885395525812313,amalsaad_lb,2026-02-09 15:39:59.185000+00:00,"Abdullah Nasser, a brave resident of Aita al-Shaab, was shot and killed by Israeli occupation forces today. 

He was known as one of the steadfast heroes of Aita, who dedicated himself to clearing the rubble and recovering the bodies of martyrs immediately after the ceasefire.",0,0,0,https://x.com/galpalpheebs/status/2020885395525812313
2020801219522937137,amalsaad_lb,2026-02-09 10:05:30.062000+00:00,"An Israeli drone targeted a vehicle this morning in Yanouh, south Lebanon, killing 3 people: 4 yr old Ali Hassan Jaber and his father Hassan, grandson and son of the town’s mayor, were killed while passing by the targeted car. 

The third victim, Ahmad Salameh, a retired Lebanese",0,0,0,https://x.com/TheCradleMedia/status/2020801219522937137
2019950278020366741,amalsaad_lb,2026-02-07 01:44:09.798000+00:00,"Yemenis protesting against Epstein better than Americans are. 

Where are all the feminists when it comes to standing up for victims of sex trafficking and rape of women and children?",0,0,0,https://x.com/NerdeenKiswani/status/2019950278020366741
2019420880217207027,amalsaad_lb,2026-02-05 14:40:31.526000+00:00,"Israel’s objective here is to turn the entirety of southern Lebanon into a barren waste land in order to thin out the population. In the short term, that will allow Israel to turn southern Lebanon into a “buffer zone.” In the long term, we’ll start seeing Israeli settlements.",0,0,0,https://x.com/tksshawa/status/2019420880217207027
2019551258710012005,amalsaad_lb,2026-02-05 23:18:36.181000+00:00,"They're repeatedly, openly admitting they deliberately sparked the Iran protests:
""What we have done is created a dollar currency shortage in the country... the Iranian currency went into free fall, inflation exploded, and hence we have seen the Iranian people out in the street.""",0,0,0,https://x.com/caitoz/status/2019551258710012005
2019456430252736512,amalsaad_lb,2026-02-05 17:01:47.315000+00:00,"Arab-Turkish proposal for Iran–US talks urges Tehran to halt support for resistance, ‘restrict’ ballistic missile use: Report",0,0,0,https://x.com/TheCradleMedia/status/2019456430252736512
2019203752784265673,amalsaad_lb,2026-02-05 00:17:44.312000+00:00,"reality is such nightmare fuel that if you try to talk about current events with someone who is blissfully uninformed it is quite literally impossible not to sound delusional, conspiracy-pilled and wildly schizophrenic.",0,0,0,https://x.com/hawillisdc/status/2019203752784265673
2019042732208181637,amalsaad_lb,2026-02-04 13:37:54.015000+00:00,"Not a single conviction has been delivered for the first 6 of the Filton 24 who were accused of shutting down Israel's largest arms firm Elbit Systems in Bristol.

After over 500 days in jail.

They stood up for Gaza, and won.",0,0,0,https://x.com/Lowkey0nline/status/2019042732208181637
2018709197190209688,amalsaad_lb,2026-02-03 15:32:33.070000+00:00,"WATCH | ""Anyone who comes to Lebanon today feels a sense of security and safety.""

Lebanon’s Prime Minister Nawaf Salam, speaking at this year’s World Government Summit, claimed that Lebanon is now “safe and secure,” even as Israeli attacks continue to strike the country’s",0,0,0,https://x.com/TheCradleMedia/status/2018709197190209688
2018884692410552447,amalsaad_lb,2026-02-04 03:09:54.391000+00:00,negotiations,0,0,0,https://x.com/justinpodur/status/2018884692410552447
2018510981748408328,amalsaad_lb,2026-02-03 02:24:54.826000+00:00,"Mona Juul and Terje Roed Larsen, the Norwegian husband and wife team that were the architects of the disastrous Oslo process (which side-stepped international law, devastated Palestinian rights for three decades, and consolidated the Israel regime’s unlawful position in",0,0,0,https://x.com/CraigMokhiber/status/2018510981748408328
2018343907797721274,amalsaad_lb,2026-02-02 15:21:01.292000+00:00,"في عهد فخامة رئيس الجهورية العماد جوزف عون،
وفي ولاية دولة رئيس الحكومة الدكتور نواف سلام، 
وللمرة الأولى منذ 40 عاماً، ومنذ العام 1969، ومنذ العام 1948، يبلغ العدو الاسرائيلي قوات الأمم المتحدة بأنه ألقى مواد كيميائية قي جنوب لبنان أمس!
فخامة الرئيس ودولة الرئيس سيكرران الحديث",0,0,0,https://x.com/Hasanillaik/status/2018343907797721274
2018284859622392144,amalsaad_lb,2026-02-02 11:26:23.110000+00:00,"UNIFIL statement regarding this incident:
 
Yesterday morning, the Israel Defense Forces (IDF) told UNIFIL that they would be carrying out an aerial activity dropping what they said was a non-toxic chemical substance over areas near the Blue Line. The IDF said that peacekeepers",0,0,0,https://x.com/cbonneauimages/status/2018284859622392144
2017662199343251623,amalsaad_lb,2026-01-31 18:12:09.331000+00:00,"With resistance scholars! 
@amalsaad_lb
 @bikrumsinghgill",0,0,0,https://x.com/MomodouTaal/status/2017662199343251623
2017346052118978587,amalsaad_lb,2026-01-30 21:15:53.959000+00:00,The audacity of seeing the Epstein files and the US still wants the world to think it is on some moral high ground to lecture it on human rights and democracy.,0,0,0,https://x.com/EyesOnSouth1/status/2017346052118978587
2017323062765461810,amalsaad_lb,2026-01-30 19:44:32.870000+00:00,This is what awaits Iran if the pedophile ruling elite of the West has its way.,0,0,0,https://x.com/UrOrientalist/status/2017323062765461810
2016934148775055806,amalsaad_lb,2026-01-29 17:59:08.549000+00:00,"Washington and Tel Aviv openly fantasize about assassinating Ayatollah Khamenei. They miscalculate: kill him, and the fatwa against nuclear weapons dies with him.",0,0,0,https://x.com/ali7adeh/status/2016934148775055806
2017007157497979290,amalsaad_lb,2026-01-29 22:49:15.185000+00:00,"The basic worldview of the Islamic Republic of Iran is essentially very similar to that of Latin American liberation theology, with a strong emphasis on empowering the oppressed and opposing global systems of injustice.

If Western leftists broadly support Latin American",0,0,0,https://x.com/agent_of_change/status/2017007157497979290
2017234517585502372,amalsaad_lb,2026-01-30 13:52:42.054000+00:00,"The US is gearing up to literally starve Cuba into submission.  It is absolutely criminal and obscene.  And this to a country that everyone knows poses *zero* threat to the US.

The people of Cuba need our full solidarity in resisting this onslaught.",0,0,0,https://x.com/jasonhickel/status/2017234517585502372
2016681126031741100,amalsaad_lb,2026-01-29 01:13:43.226000+00:00,"Trump officials are reportedly demanding that Iran not have any missiles that can hit Israel

But Israel would keep all its missiles — including nuclear weapons — that hit Iran

So the ""sticking point* is an absurd demand that Iran agree to be defenseless against Israeli bombing",0,0,0,https://x.com/ErikSperling/status/2016681126031741100
2016306385613410308,amalsaad_lb,2026-01-28 00:24:38.148000+00:00,The way they diminish the destruction and annihilation of Gaza by copying the same script -while Western news media parrots it without hesitation after 18 months of denigrating and denying Palestinians sharing their own eyewitness testimony - is a horrifying spectacle to witness.,0,0,0,https://x.com/SanaSaeed/status/2016306385613410308
2016473390337425892,amalsaad_lb,2026-01-28 11:28:15.177000+00:00,"This is one of the most extraordinary and illuminating passages in all journalism. 

CNN frames Maduro as a paranoid liar for claiming the CIA is trying to overthrow him. 

Yet in the very next sentence, it casually notes that the CIA did, in fact, overthrow him. 

The level of",0,0,0,https://x.com/AlanRMacLeod/status/2016473390337425892
2016159121209184629,amalsaad_lb,2026-01-27 14:39:27.578000+00:00,"""Free Iran"" means ""I support the overthrow of the Iranian government""

Pairing it with ""no war on Iran"" is like saying ""I recognize that if the Iranian government is overthrown, the  western jackals will devour it and that's bad, but I still want it to happen""",0,0,0,https://x.com/TheGreeneBJ/status/2016159121209184629
2016077659264971026,amalsaad_lb,2026-01-27 09:15:45.537000+00:00,You can be both: No war on Iran and No war on Iran. This is the nuanced position.,0,0,0,https://x.com/AliAbunimah/status/2016077659264971026
2016085298569003088,amalsaad_lb,2026-01-27 09:46:06.889000+00:00,"Israeli medical researchers find that 66% of Israelis are allergic  to olive tree pollen. 
If that is not indicative of European settlers' exogenicity in Palestine...they are literally allergic to Palestine.",0,0,0,https://x.com/GhassanAbuSitt1/status/2016085298569003088
2015668054181478841,amalsaad_lb,2026-01-26 06:08:08.075000+00:00,"IRAN: Nobody is going to step into this hornet's nest.

The American naval force is still insufficient for a direct frontal attack on Iran. At best, this would be an attack carried out only by the US and Israel-if Israel even decides to get involved.

No Gulf country is going to",0,0,0,https://x.com/pati_marins64/status/2015668054181478841
2015909169501454377,amalsaad_lb,2026-01-26 22:06:14.447000+00:00,"Lebanese journalist Ali Noureddine was murdered when an Israeli drone struck his car in Tyre, southern Lebanon today.

Have you heard Western journalists condemn this attack?

Of course not. They are foot soldiers of Zionism.",0,0,0,https://x.com/s_m_marandi/status/2015909169501454377
2015819632968364061,amalsaad_lb,2026-01-26 16:10:27.274000+00:00,"The problem runs deeper than this:

Firstly, casualty figures are frequently drawn from US-based and diaspora networks with no transparent methodology and, in some cases, documented CIA-linked funding, yet are treated as verified evidence. 
@HRANA_English
 is a prime example.

From",0,0,0,https://x.com/viraameli/status/2015819632968364061
2015575473426968833,amalsaad_lb,2026-01-26 00:00:15.103000+00:00,"They figured if you could just watch 700,000 tons of munitions dropped on Palestinians, then you wouldn’t mind a few street executions here at home.",0,0,0,https://x.com/MHTruthUltra/status/2015575473426968833
2015648175286267933,amalsaad_lb,2026-01-26 04:49:08.577000+00:00,Turns out that freedom of speech was when TikTok was Chinese.,0,0,0,https://x.com/RnaudBertrand/status/2015648175286267933
2015715830235845037,amalsaad_lb,2026-01-26 09:17:58.774000+00:00,"US 'warns' Iraq against pro-Iran government as Maliki’s return looms
——
US Secretary of State Marco Rubio has warned Iraq against forming a government aligned with Iran amid moves by the country’s largest Shia bloc to nominate former prime minister Nouri al-Maliki to lead the",0,0,0,https://x.com/TheCradleMedia/status/2015715830235845037
2015439584956678488,amalsaad_lb,2026-01-25 15:00:16.767000+00:00,"According to local sources, the victim of today's Israeli drone strike on Barish in south Lebanon's Tyre district was a teacher, Mohammad al-Husseini. A math quiz was found among his belongings.

Israel has killed two people in south Lebanon today and also attacked Nabi Chit in",0,0,0,https://x.com/TheCradleMedia/status/2015439584956678488
2014362252976001458,amalsaad_lb,2026-01-22 15:39:20.807000+00:00,"I wrote a long essay on the effect of the establishment of Israel in the Arab a region on Egypt's modernization journey, why Egypt had to be taken out of the equation first, how the Camp David accords can explain the current moment and more for TNI",0,0,0,https://x.com/nihalist___/status/2014362252976001458
2015241118343200999,amalsaad_lb,2026-01-25 01:51:38.639000+00:00,"The murders of unarmed civilians on the streets of Minneapolis, including the killing today of the intensive-care nurse Alex Jeffrey Pretti, would not come as a shock to Iraqis in Fallujah or Afghans in Helmand province. They were terrorized by heavily armed American execution",0,0,0,https://x.com/ChrisLynnHedges/status/2015241118343200999
2014761646410146168,amalsaad_lb,2026-01-23 18:06:23.622000+00:00,"“More Palestinians are let out of Gaza than back in”

What an insane way to describe ethnic cleansing 
@Reuters
.",0,0,0,https://x.com/AssalRad/status/2014761646410146168
2014727754684526759,amalsaad_lb,2026-01-23 15:51:43.205000+00:00,My full statement on my recent detention. 1/2,0,0,0,https://x.com/MomodouTaal/status/2014727754684526759
2014773626621325784,amalsaad_lb,2026-01-23 18:53:59.927000+00:00,"Doctors Without Borders 
@MSF
 (all 4 sections) are about to handover to the Israeli government  a list of all of their Palestinian employees. Endangering their lives and those of their families.  In clear contravention to EU Data Protection law.
Doctors Without Spine
Doctors",0,0,0,https://x.com/GhassanAbuSitt1/status/2014773626621325784
2014342358419001642,amalsaad_lb,2026-01-22 14:20:17.575000+00:00,"In case you’re distracted by the shiny buildings in Kushner’s vision for Gaza, their plan is keep Palestinians in hyper-surveilled prison camps where they’ll eventually provide cheap labor for the resorts/high rises they won’t be allowed to live in, all built atop a mass grave.",0,0,0,https://x.com/tksshawa/status/2014342358419001642
2014272197594849767,amalsaad_lb,2026-01-22 09:41:29.931000+00:00,BREAKING | According to Lebanese-American professor Asad Abukhalil the American University of Beirut (AUB) has banned legal scholar and United Nations Special Rapporteur Francesca Albanese from speaking on its campus.,0,0,0,https://x.com/TheCradleMedia/status/2014272197594849767
2014323561071018287,amalsaad_lb,2026-01-22 13:05:35.938000+00:00,"وردني اتصال من المباحث المركزية يبلغني أن المدعي العام التمييزي القاضي جمال الحجار قرّر استدعائي إلى التحقيق (أمام المباحث) ظهر غد الجمعة. وعلمت أن سبب الاستدعاء هو الفيديو الذي نشرته أول من أمس عن رئيس الجمهورية جوزف عون. 
النائب العام التمييزي ارتضى أن يكون أداة بيد رامي نعيم",0,0,0,https://x.com/Hasanillaik/status/2014323561071018287
2014263061264089357,amalsaad_lb,2026-01-22 09:05:11.660000+00:00,"This is incredible

Something big is happening",0,0,0,https://x.com/kennardmatt/status/2014263061264089357
2014172213130211380,amalsaad_lb,2026-01-22 03:04:11.777000+00:00,Just an incredible headline,0,0,0,https://x.com/daviddoel/status/2014172213130211380
2013858037144916450,amalsaad_lb,2026-01-21 06:15:46.385000+00:00,"I cannot accept what has happened to us, nor what has befallen my city, nor the people I loved and lost. I cannot accept the loss of my memories, my education, and the dreams I used to draw day by day and try to achieve.
I cannot accept what has happened to the olive trees, the",0,0,0,https://x.com/MahmoudMassri15/status/2013858037144916450
2013711590164701276,amalsaad_lb,2026-01-20 20:33:50.704000+00:00,It is absolutely nuts that we abducted the president of Venezuela two weeks ago and everyone has pretty much stopped talking about it.,0,0,0,https://x.com/MHTruthUltra/status/2013711590164701276
2013761610112782345,amalsaad_lb,2026-01-20 23:52:36.389000+00:00,"I know we are all going gaga over Carney, but Gaza, not Greenland, broke what was left of the liberal international order.",0,0,0,https://x.com/GregGrandin/status/2013761610112782345
2014008330776174733,amalsaad_lb,2026-01-21 16:12:59.179000+00:00,"“Israel” just destroyed 12 different buildings in South Lebanon, in 3 different villages… they are also about to destroy more buildings in 2 different villages. But 
@LBpresidency
 this morning was gloating about how “not a single bullet was hit from Lebanon.” Pathetic.",0,0,0,https://x.com/trhxianl/status/2014008330776174733
2013923352675570099,amalsaad_lb,2026-01-21 10:35:18.821000+00:00,"Mark Carney was Governor of the Bank of England when it froze the $5 billion worth of Venezuela's gold that it holds

It was an act of piracy worthy of Trump + part of the UK government's wide-ranging 20-year effort to overthrow Venezuela's government

The gold remains frozen",0,0,0,https://x.com/kennardmatt/status/2013923352675570099
2014050275628023888,amalsaad_lb,2026-01-21 18:59:39.611000+00:00,"The ISIS flag in Raqqa, Syria today.

Why have Trump's allies released all ISIS prisoners? Where is the US planning to use these monsters?",0,0,0,https://x.com/s_m_marandi/status/2014050275628023888
2013705386595844279,amalsaad_lb,2026-01-20 20:09:11.658000+00:00,"BREAKING: Reza Pahlavi now favourite to win next year's Nobel Peace Prize after begging for someone, anyone, to bomb his country ",0,0,0,https://x.com/NormalIslandNws/status/2013705386595844279
2014033786816569545,amalsaad_lb,2026-01-21 17:54:08.372000+00:00,"مع سِلِم أو بلا سِلِم مع سلاح أو بلا سلاح هيي نفسها الحياة مع إسرائيل. ذلّ و قتل و إرهاب. إسرائيل لا تعترف بالقانون. لم, لا و لن تريد السلام طالما وُجدت",0,0,0,https://x.com/ritahayek1/status/2014033786816569545
2014030587946807357,amalsaad_lb,2026-01-21 17:41:25.702000+00:00,"More than 50 Lebanese families who are now displaced and have nowhere to go in the cold, all their belongings and memories completely destroyed by israeli terrorists",0,0,0,https://x.com/VintageVault8/status/2014030587946807357
2013724938272674083,amalsaad_lb,2026-01-20 21:26:53.141000+00:00,"“What he [the European bourgeois] cannot forgive Hitler for is not the crime in itself, the crime against man, it is not the humiliation of man as such, it is the crime against the white man, the humiliation of the white man, and the fact that he applied to Europe colonialist",0,0,0,https://x.com/MomodouTaal/status/2013724938272674083
2013500794796925418,amalsaad_lb,2026-01-20 06:36:13.172000+00:00,The entire European Parliament — left to right — stands for regime change in Iran. The institutions of the EU are irreparably colonial.,0,0,0,https://x.com/pawelwargan/status/2013500794796925418
2013571819102458346,amalsaad_lb,2026-01-20 11:18:26.686000+00:00,"فخامة الرئيس، أن لا تنطلق رصاصة من الجنوب يكون انجازا بحال كان الجنوب محررا وآمنا ومستقرا ... أما أن لا تنطلق  رصاصة واحدة على رغم استمرار الاحتلال والعدوان فهو انجاز لنتنياهو فقط.

إحذر من مستشاريك وكتبة خطاباتك وأقرأ جيدا ما يدونوه لك",0,0,0,https://x.com/hosmatar/status/2013571819102458346
2013587212839858273,amalsaad_lb,2026-01-20 12:19:36.839000+00:00,"This private message from Macron to Trump should be a permanent reminder that nothing unites Western leaders more reliably than their shared willingness to subordinate, destabilise, and terrorise the Global South.",0,0,0,https://x.com/haugejostein/status/2013587212839858273
2013555889723081002,amalsaad_lb,2026-01-20 10:15:08.826000+00:00,"""We are totally aligned on bombing brown people, let's just keep doing that""",0,0,0,https://x.com/jasonhickel/status/2013555889723081002
2013236573349859425,amalsaad_lb,2026-01-19 13:06:17.870000+00:00,"To be clear: The occupation of Gaza is unlawful under international law. Israel and the US are perpetrating genocide in Gaza. Both the occupation and the genocide breach the highest (“jus cogens & erga omnes”) rules of international law, which no colonial edict by Trump, no ultra",0,0,0,https://x.com/CraigMokhiber/status/2013236573349859425
2013379162090696921,amalsaad_lb,2026-01-19 22:32:53.675000+00:00,"We fought with weapons and we fought with love, we tried every means — books, novels, cinema, stories, a revolution of stones and a revolution of roses, we turned nothing into something, transforming an olive tree planted in our land into a symbol of steadfastness and struggle.",0,0,0,https://x.com/OmarHamadD/status/2013379162090696921
2013222692523045178,amalsaad_lb,2026-01-19 12:11:08.423000+00:00,Turns out the word genocide does exist in The Times vocabulary.,0,0,0,https://x.com/Hamza_a96/status/2013222692523045178
2013300833182425312,amalsaad_lb,2026-01-19 17:21:38.608000+00:00,"What the israeli enemy failed to destroy with bombs, they uprooted from the earth. More ancient olive trees were deliberately torn from the land as part of the ongoing zionist land and ethnic cleansing in Lebanon.

This photo was taken today in Ayta al Shaab, South Lebanon.",0,0,0,https://x.com/VintageVault8/status/2013300833182425312
2013174521369334105,amalsaad_lb,2026-01-19 08:59:43.525000+00:00,"I do not know if anyone in this world still cares, but a short while ago the director of Al-Shifa Hospital spoke about a new virus spreading among children in the tents, and about its strong and rapid impact on their fragile bodies. Here, no one fully understands what is",0,0,0,https://x.com/Tamer_Alnoaizy/status/2013174521369334105
