username,display_name,description,followers_count,following_count,statuses_count,verified,created_at,location,url,profile_image_url,profile_banner_url,target_population,locals_vs_diaspora,person_vs_organization,comments
ahwazmedia,حسن راضي الأحوازي,مدير المركز الأحوازي للإعلام والدراسات الإستراتيجية/ باحث بالشان الايراني، معد ومقدم برنامج #ايران_زووم على قناة @سعودي24.. #الأحواز وطني,5884.0,415.0,8467.0,False,April 2012,,,https://pbs.twimg.com/profile_images/2001266107307716608/uR5QrmOd_normal.png,,1,0.0,1,
alisaberi1987,Alex,All religions are human made. Be free of them. Keep your humanity up and spread out kindness.,469.0,1634.0,633.0,False,October 2021,"Paris, France",,https://pbs.twimg.com/profile_images/2001266107307716608/uR5QrmOd_normal.png,,1,0.0,1,
aliansari84,Ali Ansari,"Ph.D. graduate in Materials Science and Engineering, Interested in batteriesand electrochemistry, Posts in Persian and in English, Notifications are off.",742.0,1928.0,1334.0,False,December 2013,"Prague, Czech Republic",,https://pbs.twimg.com/profile_images/2001266107307716608/uR5QrmOd_normal.png,,1,0.0,1,
aicalliance_,AICA - Australian Iranian Community Alliance,Group of passionate Iranian Australians committed to shedding light on the glaring violations of fundamental human rights perpetrated by the Islamic Republic.,80.0,67.0,272.0,False,June 2023,Australia,,https://pbs.twimg.com/profile_images/2001266107307716608/uR5QrmOd_normal.png,,1,0.0,0,
6njeli,اونجلیناجیلی,ماه پشت ابر نمیمونه تو خوب بمون، بلاخره آدم بدا یه جا رسوا میشن,164500.0,,5593.0,False,September 2018,İstanbul-Turkey,,https://pbs.twimg.com/profile_images/2001266107307716608/uR5QrmOd_normal.png,,1,0.0,1,
afintl_,Afghanistan International - افغانستان اینترنشنال,اولین شبکه خبری بین‌المللی ۲۴ ساعته افغانستان The First 24/7 International News Channel for Afghanistan,19600.0,8.0,8.0,False,August 2021,"UK, London",,https://pbs.twimg.com/profile_images/2001266107307716608/uR5QrmOd_normal.png,,1,0.0,0,
abu_al_askary,ابو علي العسكري,المسؤول الأمني لكتائب حزب الله في العراق,2697.0,0.0,4.0,False,August 2023,Iraq,,https://pbs.twimg.com/profile_images/2001266107307716608/uR5QrmOd_normal.png,,1,0.0,1,
ajarabic,قناة الجزيرة,الجزيرة.. الرأي والرأي الآخر.. تابع أخبارنا العاجلة على  @AJABreaking,22300000.0,26.0,1349.0,False,April 2007,Qatar,,https://pbs.twimg.com/profile_images/2001266107307716608/uR5QrmOd_normal.png,,1,0.0,0,
