username,display_name,description,followers_count,following_count,statuses_count,verified,created_at,location,url,profile_image_url,profile_banner_url,target_population,locals_vs_diaspora,person_vs_organization,comments
_dinken_,Ajmal Hussain A,It’s okay to get run over by a bus than never cross the road. I’m at least getting somewhere. Views and Opinions expressed are personal.,379.0,529.0,961.0,False,November 2012,"Kollam, India",,https://pbs.twimg.com/profile_images/2001266107307716608/uR5QrmOd_normal.png,,0,,1,
addyperry20,LilyPerry,Okay but... I’m kinda close to stunning?  Come say hi in DMs.,510.0,3722.0,1567.0,False,May 2025,where the vibes are,,https://pbs.twimg.com/profile_images/2001266107307716608/uR5QrmOd_normal.png,,0,,1,
_uselessgothdm,Definitely Not a Mimic,@ useless_goth_thembo_ in Twitch chat | Avantris brainrot still going strong | D&D/RPG/TTRPG things | Maker and collector of many math rocks (dice) |,19.0,124.0,36.0,False,June 2020,,,https://pbs.twimg.com/profile_images/2001266107307716608/uR5QrmOd_normal.png,,0,,2,
_nam11,Nathan,"@charltonlive  contributor  | Certified in  @FA  Talent ID &  @ThePFSA  Data Analytics, Oppo Scouting & Set-Pieces  | Living the dream",4887.0,2796.0,,False,May 2010,,,https://pbs.twimg.com/profile_images/2001266107307716608/uR5QrmOd_normal.png,,0,,1,
aliceparkny,Alice Park,"Health and medicine (and occasional Olympics) national correspondent for  @TIME . Author of The Stem Cell Hope, How Stem Cell Medicine Can Change Our Lives.",13400.0,469.0,4818.0,False,March 2009,New York NY,,https://pbs.twimg.com/profile_images/2001266107307716608/uR5QrmOd_normal.png,,0,,1,
abkoga,A.B. Koga,SFF Author on Submission | Agent  @BookFairyAngus  | Doctor Husband and Dance Dad | Jiu Jitsu | Retired Gamer | Dark Academia WIP,643.0,633.0,1953.0,False,September 2022,Scottsdale,,https://pbs.twimg.com/profile_images/2001266107307716608/uR5QrmOd_normal.png,,0,,1,
_sgtslaughter,SGT SLAUGHTER,"WWE Hall of Famer, WWE Ambassador & former World Heavyweight Champion. For bookings contact PVT Paul Incerto @ 203-256-0004.",,107.0,6124.0,False,September 2010,,,https://pbs.twimg.com/profile_images/2001266107307716608/uR5QrmOd_normal.png,,0,,1,
aleaguewomen,Ninja A-League,"Official account of the Ninja A-League  Catch live game coverage, as well as news, ticketing and so much more here.",,2092.0,1356.0,False,August 2012,Australia,,https://pbs.twimg.com/profile_images/2001266107307716608/uR5QrmOd_normal.png,,0,,0,
_hannahritchie,Hannah Ritchie,Deputy Editor  @OurWorldinData  / Researcher at  @UniofOxford  / Honorary Fellow at  @EdinburghUni  @EdCentreCC  / Not the End of the World:  amzn.to/3MdaOci,79800.0,1337.0,7978.0,False,July 2014,"Edinburgh, UK",,https://pbs.twimg.com/profile_images/2001266107307716608/uR5QrmOd_normal.png,,0,,1,
afterpay_au,Afterpay,Don’t just pay later. #PayBetter Afterpay it in 4.,5939.0,521.0,964.0,False,July 2014,Australia,,https://pbs.twimg.com/profile_images/2001266107307716608/uR5QrmOd_normal.png,,0,,0,
adnanime,Animation Digital Network,"Evangelion, Utena, Sailor Moon... c'est Noël avant l'heure",385900.0,676.0,1315.0,False,September 2013,Paris,,https://pbs.twimg.com/profile_images/2001266107307716608/uR5QrmOd_normal.png,,0,,0,
ajbends,big boy synthetique,@issues  //  @badwolves  // FEWDFWM //,,1286.0,1350.0,False,December 2011,"Pasadena, CA",,https://pbs.twimg.com/profile_images/2001266107307716608/uR5QrmOd_normal.png,,0,,1,
aesdigitallyart,Aes Digitally Art Prints,"Greetings! I'm Serdar. I'm the founder of this small shop, born from the question: 'Why shouldn't everyone have easy access to striking art pieces?",29.0,333.0,32.0,False,November 2025,Turkey,,https://pbs.twimg.com/profile_images/2001266107307716608/uR5QrmOd_normal.png,,0,,0,
_articlle_,お父さん,はむさんはこちら  @hamuppi_,8556.0,803.0,780.0,False,August 2018,,,https://pbs.twimg.com/profile_images/2001266107307716608/uR5QrmOd_normal.png,,0,,0,
1dish4theroad,Aaron Vallance,'Friday Night Chicken' - due 2027!  Shortlisted for Jane Grigson Trust award 2025. My blog (shortlisted Guild Food Writers award '20 '21 '23).,5435.0,3587.0,2327.0,False,May 2016,"London, England",,https://pbs.twimg.com/profile_images/2001266107307716608/uR5QrmOd_normal.png,,0,,1,
alexvizorek,Alex Vizorek,"Humoriste belge...(c'est déjà drôle comme locution, je crois) Sur scène surtout, sur  @RTLFrance  et  @telematin  parfois, ailleurs occasionnellement.",108000.0,2657.0,1381.0,False,January 2010,,,https://pbs.twimg.com/profile_images/2001266107307716608/uR5QrmOd_normal.png,,0,,1,
abdulsalamdoct,محمد المعمري,يمني يبحث عن وطن.!,6.0,118.0,253.0,False,June 2025,اليمن,,https://pbs.twimg.com/profile_images/2001266107307716608/uR5QrmOd_normal.png,,0,,1,
ajplus,AJ+,"AJ+ is a unique digital news and storytelling project promoting human rights and equality, holding power to account, and amplifying the voices of the powerless.",1200000.0,,1357.0,False,February 2010,"Washington, DC",,https://pbs.twimg.com/profile_images/2001266107307716608/uR5QrmOd_normal.png,,0,,0,
32kennocha,Isis,Every moment is a fresh beginning.,345.0,472.0,458.0,False,June 2013,"Buffalo, NY.",,https://pbs.twimg.com/profile_images/2001266107307716608/uR5QrmOd_normal.png,,0,,2,
abc7ny,Eyewitness News,"New York's #1 news, Channel 7 Eyewitness News. WABC-TV. Comments & photos shared here or using #abc7NY could be used on any ABC platforms.",725200.0,725.0,,False,October 2008,New York City,,https://pbs.twimg.com/profile_images/2001266107307716608/uR5QrmOd_normal.png,,0,,0,
alexerventure,alexerventure,Entrepreneur,446.0,6254.0,932.0,False,March 2008,,,https://pbs.twimg.com/profile_images/2001266107307716608/uR5QrmOd_normal.png,,0,,1,
agencecapa,CAPA,"Témoigner, décrypter, faire rêver, inventer : depuis plus de 30 ans, CAPA raconte le monde... avec un pas de côté. #CAPApresse #CAPAdrama  @CAPAcorporate",7920.0,612.0,5264.0,False,August 2009,"Paris, France",,https://pbs.twimg.com/profile_images/2001266107307716608/uR5QrmOd_normal.png,,0,,0,
_rosemark,Wolfy,So Vrémant po Nice,8.0,127.0,482.0,False,December 2019,,,https://pbs.twimg.com/profile_images/2001266107307716608/uR5QrmOd_normal.png,,0,,2,
alanwake,Alan Wake 2,"Alan Wake 2 out now on the Epic Games Store, PS5, and Xbox Series X|S. By  @remedygames , presented by  @EpicPublishing . Alan Wake Remastered available now.",85000.0,16.0,1465.0,False,March 2009,Bright Falls,,https://pbs.twimg.com/profile_images/2001266107307716608/uR5QrmOd_normal.png,,0,,0,
alcides,Alcides Fonseca,Typing types. Associate Professor at the University of Lisbon.,1893.0,2921.0,2203.0,False,April 2007,"Lisbon, Portugal",,https://pbs.twimg.com/profile_images/2001266107307716608/uR5QrmOd_normal.png,,0,,1,
afghanlgbt,Afghan LGBT Organization (ALO),The first official organization for Afghan #LGBTQ+ people based in Czech Republic,1190.0,401.0,216.0,False,June 2020,Česká republika & Afghanistan,,https://pbs.twimg.com/profile_images/2001266107307716608/uR5QrmOd_normal.png,,0,,0,
alanciwanc41267,alanciwan ciwan,,33.0,2281.0,1.0,False,January 2025,,,https://pbs.twimg.com/profile_images/2001266107307716608/uR5QrmOd_normal.png,,0,,1,
alexmarlow,Alex Marlow,"**BREAKING THE LAW** OUT NOW! 'The Alex Marlow Show,'  @BreitbartNews  EIC, 3x-NYT bestseller. “Alex knows it all.” -President Trump",70000.0,271.0,7396.0,False,January 2009,"Chappaquiddick, MA",,https://pbs.twimg.com/profile_images/2001266107307716608/uR5QrmOd_normal.png,,0,,1,
aaihs,AAIHS,AAIHS was founded to foster dialogue about #Black thought & culture. We publish the blog  @BlkPerspectives  (President:  @robgreeneII ):  bit.ly/2iEQ4uU,36100.0,108.0,6145.0,False,May 2014,,,https://pbs.twimg.com/profile_images/2001266107307716608/uR5QrmOd_normal.png,,0,,0,
abogadasmx,Abogadas MX,Red de Liderazgo y Desarrollo Profesional para abogadas en México.,4618.0,839.0,3107.0,False,March 2015,Mexico,,https://pbs.twimg.com/profile_images/2001266107307716608/uR5QrmOd_normal.png,,0,,0,
aji_fellowships,Allbritton Journalism Institute,,1029.0,20.0,26.0,False,February 2023,,,https://pbs.twimg.com/profile_images/2001266107307716608/uR5QrmOd_normal.png,,0,,0,
alltyf_,طيف سامي,,64500.0,11.0,234.0,False,October 2022,,,https://pbs.twimg.com/profile_images/2001266107307716608/uR5QrmOd_normal.png,,0,,0,
alimeelad94,Mohammed Ali,,89.0,305.0,1916.0,False,October 2017,The Netherlands,,https://pbs.twimg.com/profile_images/2001266107307716608/uR5QrmOd_normal.png,,0,,1,
allanmau1992,Allan Mau,,27.0,560.0,14.0,False,May 2024,,,https://pbs.twimg.com/profile_images/2001266107307716608/uR5QrmOd_normal.png,,0,,1,
4noura,Noura Erakat,"Human Rights attorney | Professor| Author, Justice For Some | Justicia, Paz, Amor",192900.0,2719.0,,False,November 2009,,,https://pbs.twimg.com/profile_images/2001266107307716608/uR5QrmOd_normal.png,,0,,1,
abdynal18132,Zain Al-Ameri,,17.0,552.0,10.0,False,September 2025,,,https://pbs.twimg.com/profile_images/2001266107307716608/uR5QrmOd_normal.png,,0,,2,
abu_aqeel86,عبدالله الخالدي,,0.0,16.0,4.0,False,September 2025,,,https://pbs.twimg.com/profile_images/2001266107307716608/uR5QrmOd_normal.png,,0,,1,
abtc,American Bitcoin,Nasdaq: ABTC | Building America's Bitcoin infrastructure backbone,49600.0,6.0,374.0,False,March 2025,USA,,https://pbs.twimg.com/profile_images/2001266107307716608/uR5QrmOd_normal.png,,0,,0,
abdulzahraa_,عبدالزهراء عبدالحسين,Earnestly striving to achieve the honour of becoming one of the sincere slaves of Sayeda Fatima al-Zahraa (as).,2430.0,366.0,5896.0,False,May 2019,جنة الخدام بين الحرمين,,https://pbs.twimg.com/profile_images/2001266107307716608/uR5QrmOd_normal.png,,0,,2,
0l8o0xgtjkorcjb,SaraThoreau,,127.0,4554.0,0.0,False,September 2023,,,https://pbs.twimg.com/profile_images/2001266107307716608/uR5QrmOd_normal.png,,0,,1,
0pps__,Think,"@_Alignments ,",22.0,159.0,18.0,False,August 2024,,,https://pbs.twimg.com/profile_images/2001266107307716608/uR5QrmOd_normal.png,,0,,2,
ajturk,Al Jazeera Türk,"Haber, analiz, görüş yazıları, belgeseller. Son dakika haberler ve canlı anlatım adresi:  @AJTCanli . İletişim için:  @AlJazeeraTurk .",724600.0,7.0,1357.0,False,January 2011,"Istanbul, Türkiye",,https://pbs.twimg.com/profile_images/2001266107307716608/uR5QrmOd_normal.png,,0,,0,
agakeruka71284,あがけるか,,100.0,3464.0,0.0,False,September 2023,,,https://pbs.twimg.com/profile_images/2001266107307716608/uR5QrmOd_normal.png,,0,,1,
ahahistorians,American Historical Association,The American Historical Association is the largest professional organization serving historians in all fields and all professions.  historians.org/join,56300.0,2335.0,1311.0,False,September 2009,"Washington, D.C.",,https://pbs.twimg.com/profile_images/2001266107307716608/uR5QrmOd_normal.png,,0,,0,
advisorbecki,"Rebecca Iacopelli, CFP®, MT","Helping women control and maximize their wealth  Senior Advisor at Barron’s Top 25 Firm  CFP®, Masters in Taxation  CFA Level III Candidate",10.0,27.0,56.0,False,June 2025,"Philadelphia, PA",,https://pbs.twimg.com/profile_images/2001266107307716608/uR5QrmOd_normal.png,,0,,1,
50uses,50 Uses For The Word Love Podcast,Comedian  @StephenTrumble  invites guests to chat about the varied multitudes of human feeling that in English all fall under the one umbrella term; Love.,489.0,2753.0,396.0,False,January 2019,"London, England",,https://pbs.twimg.com/profile_images/2001266107307716608/uR5QrmOd_normal.png,,0,,0,
a8484aviv,אביב AVIV 🇮🇱,LIVE AND LET LIVE,3028.0,7496.0,,False,June 2014,ישראל,,https://pbs.twimg.com/profile_images/2001266107307716608/uR5QrmOd_normal.png,,0,,1,
_infogirl,🌻hopeful wanderer🌻,"books, music, travel, nature, art",59.0,665.0,290.0,False,November 2021,,,https://pbs.twimg.com/profile_images/2001266107307716608/uR5QrmOd_normal.png,,0,,2,
akumafeelings,👹 AKUMA 👹,"eu minto muito bastante   (⁠◕⁠ᴗ⁠◕⁠✿⁠) mutual pra mim é irmã    ele/dele  filho do silêncio, da doença e da cura",5372.0,4139.0,1386.0,False,October 2016,"Salvador, Brasil",,https://pbs.twimg.com/profile_images/2001266107307716608/uR5QrmOd_normal.png,,0,,1,
